, {'centralized_eval_accuracy': 0.7146999835968018}], [4, 0.8383671641349792, {'centralized_eval_accuracy': 0.7088000178337097}]]
Sorted evaluation results: [2, 0.760032057762146, {'centralized_eval_accuracy': 0.7146999835968018}]
Best strategy for the round is: FedAvg(accept_failures=True)
INFO :      Better accuracy achieved: 0.714700
INFO:flwr:Better accuracy achieved: 0.714700
INFO :      Previous accuracy: 0.204000
INFO:flwr:Previous accuracy: 0.204000
Model weights saved to /Users/olenapleshan/data_analytics/assignments/thesis/federated-learning/outputs/development/20250417-1317/export/model_state_acc_0.715_round_1.weights.h5
WARNING:absl:You are saving your model as an HDF5 file via `model.save()` or `keras.saving.save_model(model)`. This file format is considered legacy. We recommend using instead the native Keras format, e.g. `model.save('my_model.keras')` or `keras.saving.save_model(model, 'my_model.keras')`. 
Full model saved to /Users/olenapleshan/data_analytics/assignments/thesis/federated-learning/outputs/development/20250417-1317/export/model_state_acc_0.715_round_1.h5
Saved artifact at '/Users/olenapleshan/data_analytics/assignments/thesis/federated-learning/outputs/development/20250417-1317/export/model_state_acc_0.715_round_1'. The following endpoints are available:

* Endpoint 'serve'
  args_0 (POSITIONAL_ONLY): TensorSpec(shape=(None, 28, 28, 1), dtype=tf.float32, name='keras_tensor')
Output Type:
  TensorSpec(shape=(None, 10), dtype=tf.float32, name=None)
Captures:
  6189584400: TensorSpec(shape=(), dtype=tf.resource, name=None)
  6189585456: TensorSpec(shape=(), dtype=tf.resource, name=None)
  6189584576: TensorSpec(shape=(), dtype=tf.resource, name=None)
  6189585104: TensorSpec(shape=(), dtype=tf.resource, name=None)
  6189584752: TensorSpec(shape=(), dtype=tf.resource, name=None)
  6189586336: TensorSpec(shape=(), dtype=tf.resource, name=None)
Model exported to /Users/olenapleshan/data_analytics/assignments/thesis/federated-learning/outputs/development/20250417-1317/export/model_state_acc_0.715_round_1
INFO :      fit progress: (1, 0.760032057762146, {'centralized_eval_accuracy': 0.7146999835968018}, 48.69581592600298)
INFO:flwr:fit progress: (1, 0.760032057762146, {'centralized_eval_accuracy': 0.7146999835968018}, 48.69581592600298)
INFO :      configure_evaluate: strategy sampled 4 clients (out of 8)
INFO:flwr:configure_evaluate: strategy sampled 4 clients (out of 8)
(ClientAppActor pid=18141) INFO :      No base model found: Initializing new model
INFO :      aggregate_evaluate: received 4 results and 0 failures
INFO:flwr:aggregate_evaluate: received 4 results and 0 failures
WARNING :   No evaluate_metrics_aggregation_fn provided
WARNING:flwr:No evaluate_metrics_aggregation_fn provided
INFO :      
INFO:flwr:
INFO :      [ROUND 2]
INFO:flwr:[ROUND 2]
INFO :      configure_fit: strategy sampled 2 clients (out of 8)
INFO:flwr:configure_fit: strategy sampled 2 clients (out of 8)
(ClientAppActor pid=18141) INFO :      No base model found: Initializing new model [repeated 4x across cluster]
(ClientAppActor pid=18141) WARNING :   DEPRECATED FEATURE: `array_from_numpy` is deprecated. Instead, use the `Array(ndarray)` class directly or `Array.from_numpy_ndarray(ndarray)`.
(ClientAppActor pid=18141) 
(ClientAppActor pid=18141)             This is a deprecated feature. It will be removed
(ClientAppActor pid=18141)             entirely in future versions of Flower.
(ClientAppActor pid=18141)         
(ClientAppActor pid=18141) WARNING :   DEPRECATED FEATURE: `array_from_numpy` is deprecated. Instead, use the `Array(ndarray)` class directly or `Array.from_numpy_ndarray(ndarray)`.
(ClientAppActor pid=18141) 
(ClientAppActor pid=18141)             This is a deprecated feature. It will be removed
(ClientAppActor pid=18141)             entirely in future versions of Flower.
(ClientAppActor pid=18141)         
(ClientAppActor pid=18140) INFO :      No base model found: Initializing new model
INFO :      aggregate_fit: received 2 results and 0 failures
INFO:flwr:aggregate_fit: received 2 results and 0 failures
INFO :      Using aggregation strategy: FedAdagrad
INFO:flwr:Using aggregation strategy: FedAdagrad
INFO :      Evaluating aggregation strategy: FedAdagrad
INFO:flwr:Evaluating aggregation strategy: FedAdagrad
(ClientAppActor pid=18140) 
(ClientAppActor pid=18140)         
(ClientAppActor pid=18140) 
(ClientAppActor pid=18140)         
INFO :      Using aggregation strategy: FedAdam
INFO:flwr:Using aggregation strategy: FedAdam
INFO :      Evaluating aggregation strategy: FedAdam
INFO:flwr:Evaluating aggregation strategy: FedAdam
INFO :      Using aggregation strategy: FedAvg
INFO:flwr:Using aggregation strategy: FedAvg
INFO :      Evaluating aggregation strategy: FedAvg
INFO:flwr:Evaluating aggregation strategy: FedAvg
INFO :      Using aggregation strategy: FedOpt
INFO:flwr:Using aggregation strategy: FedOpt
INFO :      Evaluating aggregation strategy: FedOpt
INFO:flwr:Evaluating aggregation strategy: FedOpt
INFO :      Using aggregation strategy: FedMedian
INFO:flwr:Using aggregation strategy: FedMedian
INFO :      Evaluating aggregation strategy: FedMedian
INFO:flwr:Evaluating aggregation strategy: FedMedian
Results of evaluation with multiple strategies: [[0, 1.1792291402816772, {'centralized_eval_accuracy': 0.7644000053405762}], [1, 2.2021453380584717, {'centralized_eval_accuracy': 0.682200014591217}], [2, 0.6169836521148682, {'centralized_eval_accuracy': 0.7796000242233276}], [3, 0.6169836521148682, {'centralized_eval_accuracy': 0.7796000242233276}], [4, 0.61543869972229, {'centralized_eval_accuracy': 0.7782999873161316}]]
Sorted evaluation results: [4, 0.61543869972229, {'centralized_eval_accuracy': 0.7782999873161316}]
Best strategy for the round is: FedMedian(accept_failures=True)
INFO :      Better accuracy achieved: 0.778300
INFO:flwr:Better accuracy achieved: 0.778300
INFO :      Previous accuracy: 0.714700
INFO:flwr:Previous accuracy: 0.714700
Model weights saved to /Users/olenapleshan/data_analytics/assignments/thesis/federated-learning/outputs/development/20250417-1317/export/model_state_acc_0.778_round_2.weights.h5
WARNING:absl:You are saving your model as an HDF5 file via `model.save()` or `keras.saving.save_model(model)`. This file format is considered legacy. We recommend using instead the native Keras format, e.g. `model.save('my_model.keras')` or `keras.saving.save_model(model, 'my_model.keras')`. 
Full model saved to /Users/olenapleshan/data_analytics/assignments/thesis/federated-learning/outputs/development/20250417-1317/export/model_state_acc_0.778_round_2.h5
Saved artifact at '/Users/olenapleshan/data_analytics/assignments/thesis/federated-learning/outputs/development/20250417-1317/export/model_state_acc_0.778_round_2'. The following endpoints are available:

* Endpoint 'serve'
  args_0 (POSITIONAL_ONLY): TensorSpec(shape=(None, 28, 28, 1), dtype=tf.float32, name='keras_tensor')
Output Type:
  TensorSpec(shape=(None, 10), dtype=tf.float32, name=None)
Captures:
  6189584400: TensorSpec(shape=(), dtype=tf.resource, name=None)
  6189585456: TensorSpec(shape=(), dtype=tf.resource, name=None)
  6189584576: TensorSpec(shape=(), dtype=tf.resource, name=None)
  6189585104: TensorSpec(shape=(), dtype=tf.resource, name=None)
  6189584752: TensorSpec(shape=(), dtype=tf.resource, name=None)
  6189586336: TensorSpec(shape=(), dtype=tf.resource, name=None)
Model exported to /Users/olenapleshan/data_analytics/assignments/thesis/federated-learning/outputs/development/20250417-1317/export/model_state_acc_0.778_round_2
INFO :      fit progress: (2, 0.61543869972229, {'centralized_eval_accuracy': 0.7782999873161316}, 81.9120779740042)
INFO:flwr:fit progress: (2, 0.61543869972229, {'centralized_eval_accuracy': 0.7782999873161316}, 81.9120779740042)
INFO :      configure_evaluate: strategy sampled 4 clients (out of 8)
INFO:flwr:configure_evaluate: strategy sampled 4 clients (out of 8)
(ClientAppActor pid=18141) INFO :      No base model found: Initializing new model
(ClientAppActor pid=18140) WARNING :   DEPRECATED FEATURE: `array_from_numpy` is deprecated. Instead, use the `Array(ndarray)` class directly or `Array.from_numpy_ndarray(ndarray)`. [repeated 2x across cluster]
(ClientAppActor pid=18140)             This is a deprecated feature. It will be removed [repeated 2x across cluster]
(ClientAppActor pid=18140)             entirely in future versions of Flower. [repeated 2x across cluster]
INFO :      aggregate_evaluate: received 4 results and 0 failures
INFO:flwr:aggregate_evaluate: received 4 results and 0 failures
INFO :      
INFO:flwr:
INFO :      [ROUND 3]
INFO:flwr:[ROUND 3]
INFO :      configure_fit: strategy sampled 2 clients (out of 8)
INFO:flwr:configure_fit: strategy sampled 2 clients (out of 8)
(ClientAppActor pid=18140) INFO :      No base model found: Initializing new model [repeated 4x across cluster]
(ClientAppActor pid=18140) WARNING :   DEPRECATED FEATURE: `array_from_numpy` is deprecated. Instead, use the `Array(ndarray)` class directly or `Array.from_numpy_ndarray(ndarray)`.
(ClientAppActor pid=18140) 
(ClientAppActor pid=18140)             This is a deprecated feature. It will be removed
(ClientAppActor pid=18140)             entirely in future versions of Flower.
(ClientAppActor pid=18140)         
(ClientAppActor pid=18140) WARNING :   DEPRECATED FEATURE: `array_from_numpy` is deprecated. Instead, use the `Array(ndarray)` class directly or `Array.from_numpy_ndarray(ndarray)`.
(ClientAppActor pid=18140) 
(ClientAppActor pid=18140)             This is a deprecated feature. It will be removed
(ClientAppActor pid=18140)             entirely in future versions of Flower.
(ClientAppActor pid=18140)         
(ClientAppActor pid=18141) INFO :      No base model found: Initializing new model
(ClientAppActor pid=18141) 
(ClientAppActor pid=18141)         
(ClientAppActor pid=18141) 
(ClientAppActor pid=18141)         
INFO :      aggregate_fit: received 2 results and 0 failures
INFO:flwr:aggregate_fit: received 2 results and 0 failures
INFO :      Using aggregation strategy: FedAdagrad
INFO:flwr:Using aggregation strategy: FedAdagrad
INFO :      Evaluating aggregation strategy: FedAdagrad
INFO:flwr:Evaluating aggregation strategy: FedAdagrad
INFO :      Using aggregation strategy: FedAdam
INFO:flwr:Using aggregation strategy: FedAdam
INFO :      Evaluating aggregation strategy: FedAdam
INFO:flwr:Evaluating aggregation strategy: FedAdam
INFO :      Using aggregation strategy: FedAvg
INFO:flwr:Using aggregation strategy: FedAvg
INFO :      Evaluating aggregation strategy: FedAvg
INFO:flwr:Evaluating aggregation strategy: FedAvg
INFO :      Using aggregation strategy: FedOpt
INFO:flwr:Using aggregation strategy: FedOpt
INFO :      Evaluating aggregation strategy: FedOpt
INFO:flwr:Evaluating aggregation strategy: FedOpt
INFO :      Using aggregation strategy: FedMedian
INFO:flwr:Using aggregation strategy: FedMedian
INFO :      Evaluating aggregation strategy: FedMedian
INFO:flwr:Evaluating aggregation strategy: FedMedian
Results of evaluation with multiple strategies: [[0, 0.7223392724990845, {'centralized_eval_accuracy': 0.7599999904632568}], [1, 3.557110071182251, {'centralized_eval_accuracy': 0.3262999951839447}], [2, 0.7117692232131958, {'centralized_eval_accuracy': 0.748199999332428}], [3, 0.7117692232131958, {'centralized_eval_accuracy': 0.748199999332428}], [4, 0.6908696889877319, {'centralized_eval_accuracy': 0.7612000107765198}]]
Sorted evaluation results: [4, 0.6908696889877319, {'centralized_eval_accuracy': 0.7612000107765198}]
Best strategy for the round is: FedMedian(accept_failures=True)
INFO :      fit progress: (3, 0.6908696889877319, {'centralized_eval_accuracy': 0.7612000107765198}, 113.56392195300577)
INFO:flwr:fit progress: (3, 0.6908696889877319, {'centralized_eval_accuracy': 0.7612000107765198}, 113.56392195300577)
INFO :      configure_evaluate: strategy sampled 4 clients (out of 8)
INFO:flwr:configure_evaluate: strategy sampled 4 clients (out of 8)
(ClientAppActor pid=18140) INFO :      No base model found: Initializing new model
(ClientAppActor pid=18141) WARNING :   DEPRECATED FEATURE: `array_from_numpy` is deprecated. Instead, use the `Array(ndarray)` class directly or `Array.from_numpy_ndarray(ndarray)`. [repeated 2x across cluster]
(ClientAppActor pid=18141)             This is a deprecated feature. It will be removed [repeated 2x across cluster]
(ClientAppActor pid=18141)             entirely in future versions of Flower. [repeated 2x across cluster]
INFO :      aggregate_evaluate: received 4 results and 0 failures
INFO:flwr:aggregate_evaluate: received 4 results and 0 failures
INFO :      
INFO:flwr:
INFO :      [ROUND 4]
INFO:flwr:[ROUND 4]
INFO :      configure_fit: strategy sampled 2 clients (out of 8)
INFO:flwr:configure_fit: strategy sampled 2 clients (out of 8)
(ClientAppActor pid=18141) INFO :      No base model found: Initializing new model [repeated 4x across cluster]
(ClientAppActor pid=18141) WARNING :   DEPRECATED FEATURE: `array_from_numpy` is deprecated. Instead, use the `Array(ndarray)` class directly or `Array.from_numpy_ndarray(ndarray)`.
(ClientAppActor pid=18141) 
(ClientAppActor pid=18141)             This is a deprecated feature. It will be removed
(ClientAppActor pid=18141)             entirely in future versions of Flower.
(ClientAppActor pid=18141)         
(ClientAppActor pid=18141) WARNING :   DEPRECATED FEATURE: `array_from_numpy` is deprecated. Instead, use the `Array(ndarray)` class directly or `Array.from_numpy_ndarray(ndarray)`.
(ClientAppActor pid=18141) 
(ClientAppActor pid=18141)             This is a deprecated feature. It will be removed
(ClientAppActor pid=18141)             entirely in future versions of Flower.
(ClientAppActor pid=18141)         
(ClientAppActor pid=18140) INFO :      No base model found: Initializing new model
(ClientAppActor pid=18140) 
(ClientAppActor pid=18140)         
(ClientAppActor pid=18140) 
(ClientAppActor pid=18140)         
INFO :      aggregate_fit: received 2 results and 0 failures
INFO:flwr:aggregate_fit: received 2 results and 0 failures
INFO :      Using aggregation strategy: FedAdagrad
INFO:flwr:Using aggregation strategy: FedAdagrad
INFO :      Evaluating aggregation strategy: FedAdagrad
INFO:flwr:Evaluating aggregation strategy: FedAdagrad
INFO :      Using aggregation strategy: FedAdam
INFO:flwr:Using aggregation strategy: FedAdam
INFO :      Evaluating aggregation strategy: FedAdam
INFO:flwr:Evaluating aggregation strategy: FedAdam
INFO :      Using aggregation strategy: FedAvg
INFO:flwr:Using aggregation strategy: FedAvg
INFO :      Evaluating aggregation strategy: FedAvg
INFO:flwr:Evaluating aggregation strategy: FedAvg
INFO :      Using aggregation strategy: FedOpt
INFO:flwr:Using aggregation strategy: FedOpt
INFO :      Evaluating aggregation strategy: FedOpt
INFO:flwr:Evaluating aggregation strategy: FedOpt
INFO :      Using aggregation strategy: FedMedian
INFO:flwr:Using aggregation strategy: FedMedian
INFO :      Evaluating aggregation strategy: FedMedian
INFO:flwr:Evaluating aggregation strategy: FedMedian
Results of evaluation with multiple strategies: [[0, 0.5837633013725281, {'centralized_eval_accuracy': 0.7918999791145325}], [1, 6.314384460449219, {'centralized_eval_accuracy': 0.10000000149011612}], [2, 0.5456088781356812, {'centralized_eval_accuracy': 0.8052999973297119}], [3, 0.5456088781356812, {'centralized_eval_accuracy': 0.8052999973297119}], [4, 0.5297658443450928, {'centralized_eval_accuracy': 0.8131999969482422}]]
Sorted evaluation results: [4, 0.5297658443450928, {'centralized_eval_accuracy': 0.8131999969482422}]
Best strategy for the round is: FedMedian(accept_failures=True)
INFO :      Better accuracy achieved: 0.813200
INFO:flwr:Better accuracy achieved: 0.813200
INFO :      Previous accuracy: 0.778300
INFO:flwr:Previous accuracy: 0.778300
Model weights saved to /Users/olenapleshan/data_analytics/assignments/thesis/federated-learning/outputs/development/20250417-1317/export/model_state_acc_0.813_round_4.weights.h5
WARNING:absl:You are saving your model as an HDF5 file via `model.save()` or `keras.saving.save_model(model)`. This file format is considered legacy. We recommend using instead the native Keras format, e.g. `model.save('my_model.keras')` or `keras.saving.save_model(model, 'my_model.keras')`. 
Full model saved to /Users/olenapleshan/data_analytics/assignments/thesis/federated-learning/outputs/development/20250417-1317/export/model_state_acc_0.813_round_4.h5
Saved artifact at '/Users/olenapleshan/data_analytics/assignments/thesis/federated-learning/outputs/development/20250417-1317/export/model_state_acc_0.813_round_4'. The following endpoints are available:

* Endpoint 'serve'
  args_0 (POSITIONAL_ONLY): TensorSpec(shape=(None, 28, 28, 1), dtype=tf.float32, name='keras_tensor')
Output Type:
  TensorSpec(shape=(None, 10), dtype=tf.float32, name=None)
Captures:
  6189584400: TensorSpec(shape=(), dtype=tf.resource, name=None)
  6189585456: TensorSpec(shape=(), dtype=tf.resource, name=None)
  6189584576: TensorSpec(shape=(), dtype=tf.resource, name=None)
  6189585104: TensorSpec(shape=(), dtype=tf.resource, name=None)
  6189584752: TensorSpec(shape=(), dtype=tf.resource, name=None)
  6189586336: TensorSpec(shape=(), dtype=tf.resource, name=None)
Model exported to /Users/olenapleshan/data_analytics/assignments/thesis/federated-learning/outputs/development/20250417-1317/export/model_state_acc_0.813_round_4
INFO :      fit progress: (4, 0.5297658443450928, {'centralized_eval_accuracy': 0.8131999969482422}, 149.79091032200085)
INFO:flwr:fit progress: (4, 0.5297658443450928, {'centralized_eval_accuracy': 0.8131999969482422}, 149.79091032200085)
INFO :      configure_evaluate: strategy sampled 4 clients (out of 8)
INFO:flwr:configure_evaluate: strategy sampled 4 clients (out of 8)
(ClientAppActor pid=18141) INFO :      No base model found: Initializing new model
(ClientAppActor pid=18140) WARNING :   DEPRECATED FEATURE: `array_from_numpy` is deprecated. Instead, use the `Array(ndarray)` class directly or `Array.from_numpy_ndarray(ndarray)`. [repeated 2x across cluster]
(ClientAppActor pid=18140)             This is a deprecated feature. It will be removed [repeated 2x across cluster]
(ClientAppActor pid=18140)             entirely in future versions of Flower. [repeated 2x across cluster]
INFO :      aggregate_evaluate: received 4 results and 0 failures
INFO:flwr:aggregate_evaluate: received 4 results and 0 failures
INFO :      
INFO:flwr:
INFO :      [SUMMARY]
INFO:flwr:[SUMMARY]
INFO :      Run finished 4 round(s) in 156.19s
INFO:flwr:Run finished 4 round(s) in 156.19s
INFO :          History (loss, distributed):
INFO:flwr:      History (loss, distributed):
INFO :                  round 1: 0.6193543822759511
INFO:flwr:              round 1: 0.6193543822759511
INFO :                  round 2: 0.718711585949122
INFO:flwr:              round 2: 0.718711585949122
INFO :                  round 3: 0.8380780316261388
INFO:flwr:              round 3: 0.8380780316261388
INFO :                  round 4: 0.46448032196659267
INFO:flwr:              round 4: 0.46448032196659267
INFO :          History (loss, centralized):
INFO:flwr:      History (loss, centralized):
INFO :                  round 0: 2.296370029449463
INFO:flwr:              round 0: 2.296370029449463
INFO :                  round 1: 0.760032057762146
INFO:flwr:              round 1: 0.760032057762146
INFO :                  round 2: 0.61543869972229
INFO:flwr:              round 2: 0.61543869972229
INFO :                  round 3: 0.6908696889877319
INFO:flwr:              round 3: 0.6908696889877319
INFO :                  round 4: 0.5297658443450928
INFO:flwr:              round 4: 0.5297658443450928
INFO :          History (metrics, centralized):
INFO:flwr:      History (metrics, centralized):
INFO :          {'centralized_eval_accuracy': [(0, 0.20399999618530273),
INFO:flwr:      {'centralized_eval_accuracy': [(0, 0.20399999618530273),
INFO :                                         (1, 0.7146999835968018),
INFO:flwr:                                     (1, 0.7146999835968018),
INFO :                                         (2, 0.7782999873161316),
INFO:flwr:                                     (2, 0.7782999873161316),
INFO :                                         (3, 0.7612000107765198),
INFO:flwr:                                     (3, 0.7612000107765198),
INFO :                                         (4, 0.8131999969482422)]}
INFO:flwr:                                     (4, 0.8131999969482422)]}
INFO :      
INFO:flwr:
DEBUG:flwr:ServerApp finished running.
DEBUG:flwr:ServerApp finished running.
DEBUG:flwr:Triggered stop event for Simulation Engine.
DEBUG:flwr:Terminated 2 actors
(ClientAppActor pid=18140) INFO :      No base model found: Initializing new model [repeated 3x across cluster]
DEBUG:flwr:Terminated RayBackend
DEBUG:flwr:Stopping Simulation Engine now.
wandb: / 0.041 MB of 0.041 MB uploaded
wandb: Run history:
wandb: centralized_eval_accuracy ▁▇█▇█
wandb:     centralized_eval_loss █▂▁▂▁
wandb:   federated_evaluate_loss ▄▆█▁
wandb: 
wandb: Run summary:
wandb: centralized_eval_accuracy 0.8132
wandb:     centralized_eval_loss 0.52977
wandb:   federated_evaluate_loss 0.46448
wandb: 
wandb: 🚀 View run experiment-development/20250417-1317 at: https://wandb.ai/sbs24043-cct-dublin/flower-embedded-fed/runs/4whjlidl
wandb: ⭐️ View project at: https://wandb.ai/sbs24043-cct-dublin/flower-embedded-fed
wandb: Synced 5 W&B file(s), 0 media file(s), 0 artifact file(s) and 0 other file(s)
wandb: Find logs at: ./wandb/run-20250417_131730-4whjlidl/logs
wandb: WARNING The new W&B backend becomes opt-out in version 0.18.0; try it out with `wandb.require("core")`! See https://wandb.me/wandb-core for more information.