post_id,level,body,gilded,likes,num_reports,score,subreddit
14efxze,1,"> food could be packaged and sent to places that need it

It's better to produce food as close as possible to the point of consumption instead of relying on centralized ""breadbaskets"" with limited arable land held primarily by corporate farms, which require wasteful packaging and an environmentally devastating global shipping industry to transport. One way to do that is to encourage people to eat more local produce instead of feeling entitled to crops which don't grow where they come from, but you can also supplement that by modifying crops to grow more readily in varied climates and soil conditions.",0,,,27,science
14efxze,2,"This sounds very reasonable and is how the food market was run up until fairly recently.  But knowing that farms are now corporate tells me all that I need to know about why there is a food crisis or why left over food isn’t packaged and sent to the poor.  Keeping food production local is also more sanitary because we used to not have to worry about salmonella and other bacteria ruining our food because we had local farm workers who knew the value of washing their hands and not defecating in the fields.

The only crop that I demand yearlong access to is strawberries and perhaps pears and nectarines.  If I must choose, I choose to keep strawberries.  Cherries would also be nice, since they are rarely available and very pricey.  Okay, so I am a bit entitled.  But could get used to the old way of growing crops and doling out food again.",0,,,2,science
14efxze,1,"Even worse, your tax dollars are going towards the government to buy this corn, artificially keeping the price higher to justify growing more of the cash crop.

Get rid of ethanol in the gas and vanquish the corn subsidies. The meat prices will shoot through the roof though, likely swinging the election cycle back into those that will keep meat prices low.

Bread and circuses",0,,,27,science
14efxze,2,"Corn isn’t that expensive to buy though.  And we do need the ethanol in gas, and hence a lot of corn.  What difference does it make if we get rid of some of it or not?  Every other vegetable, fruit and grocery product has gone up and is pricey af so I see no reason to get rid of corn unless it is causing a lot of the green house gases.",0,,,1,science
14efxze,3,"Corn would probably double in price on it's own without any subsidies.

Ethanol is incredibly wasteful to use for fuel, considering that the inputs to produce the corn (diesel, nitrogen fertilizer, shipping and transporting, then processing) are all energy expensive. It's very wasteful from an economic and energy perspective.",0,,,1,science
14efxze,1,"Ooh, that is sick!  I am hoping that you’re wrong but am afraid that you’re right.  And we think of this as only affecting 3rd world countries and yet, with the latest bout of inflation gripping the world, poor people, poor working class people, and the disabled and the elderly are no doubt being affected right now.  And these are the poor people who have to forgo heat or air conditioning in order to pay for groceries.  Yay, inflation!  How is it helping our economy?  How about we get rid of it right now by lowering interest rates and getting hold of, or producing our own oil until the technology exists to heat and cool homes and power engines by something cleaner than oil?",0,,,1,science
14efxze,0,Now it can be sold at nice high prices and farmers have to pay this every year. Farmers that do not use this can get sued into oblivion if they grow another kind of rice in adjacent land. The company that owns the seed ca/will claim that they have had benefits from their genetically modified rice mixing in their field.,0,,,3,science
14efxze,1,"> Farmers that do not use this can get sued into oblivion if they grow another kind of rice in adjacent land.

No they can't. That doesn't even make sense and doesn't have any precedent to support it.",0,,,0,science
14efxze,2,"Because it doesn’t have precedent doesn’t factor into it…It’s a 21st century problem so probably new laws will have to be enacted on GMO products/land as well as non-GMO products and land, since both will probably have a market.  And people will line up to sue if they think they can get some money out of someone else for ""contaminated"" food.  Because they have people waiting on/counting on that particular item.  And if the food has GMO or non GMO engineering in it, people are likely to know it, and pitch a fit over it.  It’s similar to foods promising to be natural or whole food.",0,,,1,science
14efxze,0,There is no shortage of available food in the world. Those that go hungry do so due to the greed of others.,0,,,3,science
14efxze,1,That is sick.,0,,,1,science
14efxze,2,Agreed. It's politics that separates people from good.,0,,,2,science
14efxze,0,[removed],0,,,32,science
14efxze,1,[removed],0,,,12,science
14efxze,1,[removed],0,,,11,science
14efxze,2,[removed],0,,,3,science
14efxze,3,[removed],0,,,3,science
14efxze,4,[removed],0,,,3,science
14efxze,4,[removed],0,,,1,science
14efxze,5,[removed],0,,,-1,science
14efxze,6,[removed],0,,,1,science
14efxze,0,[removed],0,,,5,science
14efxze,0,[removed],0,,,11,science
14efxze,1,[removed],0,,,5,science
14efxze,0,I'm going to predict a big name company will own the DNA to it.  Farmers will have to buy it only from them.  They will not be allowed to hold seed from one year to the next.  You will also have to use their products to harvest the final products.,0,,,7,science
14efxze,1,">They will not be allowed to hold seed from one year to the next. 

Farmers don't really do that in general, though... Regardless of biotech or not, farmers buy their seed each year because it gives them a specific, known strain rather than a hodgepodge of different traits. Also due to Hybrid Vigor, where certain crossbred cultivars outperform generally bred crops.",0,,,14,science
14efxze,1,"That's how technological innovation works in every industry. There are tens of thousands of varieties of rice that farmers can get that are free. If they want the advantages that come with patented varieties, why wouldn't they need to pay for it?",0,,,6,science
14efxze,1,"This should be the top comment. GMO advances are great, but the patent and IP structure negates many of the advantages",0,,,-2,science
14efxze,2,"Just to be clear, I want to make sure you're aware that IP regulations around farming, and the patenting of plant strains, long predates GMOs, and is in no way inherent to them.",0,,,9,science
14efxze,3,Another important point is that farmers overwhelmingly prefer to purchase seeds with a consistent result rather than rolling the dice with sexual reproduction.,0,,,8,science
14efxze,3,My comment is not against GMO in its own right. But seed patenting is more prevalent with GMO crops.,0,,,2,science
14efxze,2,"That's really going to be a thing of the past.

GMO technology is several magnitudes cheaper to develop than when it first emerged. The barrier to entry is getting lower and lower meaning far more competition, government's and universities will also develop alternatives.

The AI revolution will accelerate this too.",0,,,8,science
14efxze,3,Bureaucracy with a pinch of lobbying can beat all these advances and low barriers.,0,,,4,science
14efxze,0,We are building a house of cards with our continuing population growth.,0,,,4,science
14efxze,1,"Yes, we are.  And it’s the poorest and least able of us who are reproducing the fastest and most.  Governments should give them a big wad of money to accept being sterilized after having one child.  Why should the rest of the world teeter on destruction from people who continuously overpopulate?",0,,,1,science
14efxze,0,[removed],0,,,6,science
14efxze,1,[deleted],0,,,2,science
14efxze,0,"Who is going to have the patent to, you know, prevent fermers from using part of last year's crop to seed this year's crop instead of buying new seeds from the patent owner?  Or sue farmers who have trace amounts of the patented crop growing in their paddies with no idea how they got there.",0,,,4,science
14efxze,1,"> Or sue farmers who have trace amounts of the patented crop growing in their paddies with no idea how they got there.

Never happened, never gonna.",0,,,2,science
14efxze,1,"> Or sue farmers who have trace amounts of the patented crop growing in their paddies with no idea how they got there.

Nobody, on account of it being an urban legend and not actually being a thing.",0,,,2,science
14efxze,2,I'll accept that for now and in reality I probably don't care enough to try to look it up later.,0,,,2,science
14efxze,2,Not even a few seeds getting borne by the wind?  I find that hard to believe.,0,,,1,science
14efxze,3,Well the lack of any lawsuits whatsoever over accidental cross-contamination is pretty convincing...,0,,,1,science
14efxze,0,"Counter proposal: more active population control.

We sure as hell don't need more humans and should actively work on shrinking our numbers each generation.",0,,,2,science
14efxze,1,"That’s true, except in America, certain populations only have 1-2 children and I believe that our replacement number is lower than it needs to be.  And meanwhile, certain populations get paid thousands to reproduce more.",0,,,1,science
14efxze,0,[removed],0,,,1,science
14efxze,1,[removed],0,,,5,science
14efxze,2,[removed],0,,,-6,science
14efxze,1,[removed],0,,,1,science
14efxze,1,[removed],0,,,1,science
14efxze,2,[removed],0,,,-3,science
14efxze,3,[removed],0,,,-3,science
14efxze,4,[removed],0,,,4,science
14efxze,5,[removed],0,,,0,science
14efxze,5,[removed],0,,,-2,science
14efxze,6,[removed],0,,,3,science
14efxze,0,This is just a way to sell a patented seed.,0,,,3,science
14efxze,1,"That's what I'm worried about as well, considering what is happening in cotton farming.",0,,,4,science
14efxze,2,What’s happening in cotton farming?  Does it have anything to do with clothes having no cotton in them in the American market?,0,,,1,science
14efxze,0,"This is a good news, but heat / drought tolerance is what we need for the future.  It's going to be a rough ride without these strains",0,,,2,science
14efxze,0,doesn't matter if we can figure this one out but EU keeps the stupid fear card and says no GMO while millions starve.,0,,,1,science
14efxze,0,[removed],0,,,1,science
14efxze,1,[removed],0,,,-1,science
14efxze,0,It's a single gene. If they deploy this by itself it's only a matter of time before the resistance it provides breaks down. Big selection pressure on a single gene.,0,,,1,science
14efxze,0,[deleted],0,,,1,science
14efxze,1,Does it take into account the use of cars in the production and consumption of rice?,0,,,2,science
14efxze,1,Is that true?  I’m seeing the agriculture sector in its entirety is only about 25% of global emissions.  Your saying rice is half of the entire sector?,0,,,2,science
14efxze,0,[deleted],0,,,-1,science
14efxze,1,"I mean, rice is calorifically dense which is vital for much of the world. White rice is dehulled which removes much of the nutrients. Japan and Korea have both suffered from vitamin B deficiencies in the past (Beriberi disease), thanks to polishing and dehulling their rice, removing the important niacin. It's plenty nutritious if you don't process it the way most industrialized nations do it (and purely for texture and appearance).",0,,,1,science
14efxze,0,[removed],0,,,-1,science
14efxze,1,"> This is how wheat went GMO and corrupted the support industries.

How did GMO wheat ""corrupt the support industries"" when it doesn't exist commercially?",0,,,2,science
14efxze,1,"Ah. Yes. GMO wheat. Right next to the snozzberry jelly, an aisle over from the unicorn burgers.

There's no GMO wheat commercially available.",0,,,2,science
14efxze,0,Rice produces a lot of methane so this isn’t great.,0,,,-6,science
14efxze,1,"It looks worse than wheat but seems like nothing crazy per calorie: [https://ourworldindata.org/grapher/ghg-kcal-poore](https://ourworldindata.org/grapher/ghg-kcal-poore) 

It looks a lot worse if measured per kg, but rice has more calories per kg than grains like wheat.

I personally default to other grains. They're more nutritious and maybe better for the environment. But, rice doesn't seem as bad as I originally thought it was.",0,,,6,science
14efxze,2,It’s going to be based on where it’s grown. A lot of developing countries keep the paddies pretty anaerobic causing a huge increase in methane emissions. Where in the US and more developed countries tend to not take the steps to keep methane down.,0,,,2,science
14efxze,3,So we’ll allow them to push up methane counts because they are developing countries?  The same amount of pressure to keep our methane amounts down should be placed upon all countries.  Greenhouse gas is threatening to destroy ALL countries.,0,,,1,science
14efxze,4,I was just stating what occurs not what should happen,0,,,1,science
14efxze,1,[removed],0,,,4,science
14efxze,2,[removed],0,,,0,science
14efxze,3,[removed],0,,,-2,science
14efxze,4,[removed],0,,,2,science
14efxze,5,[removed],0,,,0,science
14efxze,6,Plastic actually isn’t bad if you recycle it. The carbon stays fixed. The issue is the carbon that is getting released into the atmosphere. But obviously micro plastics have been a concern too. But whenever you can avoid these things for compostable or biodegradable material that’s a win.,0,,,-4,science
14efxze,7,[removed],0,,,0,science
14efxze,0,"This is really great news, but I worry about the long term effects of how many farmers switch to this variety. We already have monoculture issues with corn and bananas.",0,,,0,science
14efxze,0,How does it affect its digestibility? How does it change the effects rice traditionally has when ingested?,0,,,0,science
14efxze,0,[removed],0,,,0,science
14efxze,0,"I think we need to stop wasting food before we look at ways to increase production. [We waste 1/3 of the food we make globally which is enough to feed 2,000,000,000 people and significantly cut down carbon emissions](https://www.wfp.org/stories/5-facts-about-food-waste-and-hunger#:~:text=One%2Dthird%20of%20food%20produced,worth%20approximately%20US%241%20trillion)",0,,,-1,science
14efxze,1,"That's something we need to work on, but it's not a solution. Countries need to be able to be self sufficient when it comes to food security. The solution to world hunger isn't giving other countries our scraps.",0,,,4,science
14efxze,2,"Well see there-in lies part of the problem - while some countries legit have feeding problems, others do not.

In the end, a lot of food is simply wasted because it's not profitable, and rather than charitably donate it to the starving, teaching people the virtue of patience, corps would rather destroy it and let people starve.

So yeah, self sufficiency is great, but when economic models predicate the starvation of people so that food has market value, I'm not confident more food will have the results people hope it will, especially when for-profit corporations in control of that excess food.

In short, they may be scraps going to other nations, but we can't even be arsed to spare excess to our own people, much less abroad.  Where's the confidence more home-grown food will change anything coming from?",0,,,1,science
14efxze,0,[removed],0,,,-9,science
14efxze,0,[deleted],0,,,-5,science
14efxze,1,This is not how it works. At all.,0,,,5,science
14efxze,1,"If you want to go proper old, just eat grass.",0,,,0,science
14efxze,0,[removed],0,,,-4,science
14efxze,0,[removed],0,,,-4,science
14efxze,1,[removed],0,,,3,science
14efxze,0,[removed],0,,,-1,science
14efxze,1,The point of buying seeds with a consistent result is to get that consistent result. If you’re going to just use it to grow randomly distributed seeds from sexual reproduction then you’re wasting money.,0,,,1,science
14efxze,0,[removed],0,,,-1,science
14efxze,0,[removed],0,,,-19,science
14efxze,1,[removed],0,,,11,science
14efxze,2,[removed],0,,,-4,science
14efxze,3,[removed],0,,,1,science
14efxze,0,[removed],0,,,-4,science
14efxze,0,[removed],0,,,-7,science
14efxze,1,[removed],0,,,9,science
14efxze,2,[removed],0,,,-3,science
14efxze,3,[removed],0,,,1,science
14efxze,0,Does it involve locusts?,0,,,1,science
14efxze,0,I wonder if this will lead to the destruction of other rice crops and heirloom strains? I've seen it done with soy beans and potatoes.,0,,,1,science
14efxze,1,Yes because who needs to eat when you can preserve heritage varieties instead.,0,,,5,science
14efxze,0,Now just fix the toxic compounds and the need to wash it 10 times if you eat it every day and we are golden. Oh and fridge life.,0,,,1,science
14efxze,0,Awesome. Just awesome. You go science people.,0,,,1,science
14efxze,0,Make brown rice great again.,0,,,1,science
14efxze,0,Just what we need as obesity expands around the globe: an ever cheaper way to eat too many carbs.,0,,,1,science
14efxze,0,It can help solve starvation?!  BuT GMO iS BaD!,0,,,1,science
14efxze,0,"Yay, just in time for complete collapse of the ecosystem. I'm sure this new crop will also be able to thrive without any water.",0,,,1,science
14efxze,0,Doesn’t evolution mean that this will be a game of one-upmanship?  The diseases will get harder to combat,0,,,1,science
14efxze,0,"Let's not forget our climate, as it has done eternally, is changing! How can we support the exploding populations of Asia and Africa?",0,,,1,science
14efxze,0,"If we could chill on making babies, that might help too",0,,,1,science
14efxze,0,While you’re at it make rice that doesn’t grow that deadly bacteria that rice grows,0,,,1,science
14efxze,0,"And thanks to global warming, it comes pre-cooked!",0,,,1,science
14efxze,0,Yea but I get bored eating rice pretty much right away.,0,,,1,science
14efxze,0,"How about a version of rice that doesn’t pull the arsenic from the ground and into the rice itself. That would be great. Right now if you eat rice regularly you’re actually significantly increasing your risk of cardiovascular disease because of the trace levels of arsenic. Official food guidelines basically say don’t each more than 3 cups of cooked rice a week. Which I go way over because I love rice. But I really, really wish it was arsenic free so I didn’t ever have to think of it. 

Also I would rather eat brown rice but brown rice has significantly worse arsenic :/",0,,,1,science
14efxze,0,I'm afraid of parenting the seeds and forcing farmers to buy only from.one company.  Seeds that farmers aren't allowed to harvest themselves.,0,,,1,science
14efxze,1,"You'll be glad to learn that farmers haven't been harvesting their own seeds for a good century now, because it's poor practice. It costs them more to do that, and they end up with poor quality crops at the end of it due to a process called Hybrid Vigour.",0,,,1,science
14efxze,0,"That's nice and all, but what about disease resistance, higher yield and, call me crazy, but... how about lower demand?",0,,,1,science
14efxze,0,There goes California's water....,0,,,1,science
14efxze,0,Dudes made nitro rice,0,,,1,science
14efxze,0,"And the seeds definitely won't be copyrighted, impossible or forbidden to re-plant next harvest and sold on a subscription to gouge farmer. Nooo sir.",0,,,1,science
14efxze,0,Getting an increased percentage of the population to go vegan would also help shore up food supplies to a much greater effect.,0,,,1,science
14efxze,0,Maybe they should make 8-12 different variations of it instead of relying on one crop.,0,,,1,science
14efxze,0,It feels like I am reading this same title every couple of years,0,,,1,science
14efxze,0,"Mmmm GMO, it’s what’s for dinner",0,,,1,science
14efxze,0,I read years ago that someone had geoengineered rice to have protein and other nutritious stuff and that alone was going to cure malnutrition. I bet big cow killed it.,0,,,1,science
14efxze,0,It’s wild to think not many people eat rice regularly,0,,,1,science
14efxze,0,"Great, more products for my father to complain that they're fattened up and filled with chemicals",0,,,1,science
14efxze,0,"I get sick reading that we need more food/higher yields in response to growing population. Fact is that we feed food to domestic cattle in an amount that could feed 35 billion humans. Also, iirc we create human food for about 16 billion people, but still not everyone gets something.

Our problems are neither population size nor earth size, it's unfair distribution and being wasteful and inefficient in what we eat (and many more things).",0,,,1,science
14efxze,0,We need less people not more rice. International rights to abortion and birth control are imperative for life on earth’s survival.,0,,,1,science
14efxze,0,"Oooooooh! Can they also make it like the golden rice with beta carotene and vitamin A?

I really want rainbow rice. Plz.",0,,,1,science
14efxze,0,bUt bUt bUT gEnEtIc eNgInEeRing bAd!,0,,,1,science
14efxze,0,Isn't Rice the highest methane producer of any crop?,0,,,1,science
14efxze,0,We need less people imo.,0,,,1,science
14efxze,0,Great. Will the local farmers have to sign a contract and a terms of use agreement?,0,,,1,science
14efxze,0,So GMO rice correct? Isn’t this the thing people protest about around the world?,0,,,1,science
14efxze,0,Not really excited about having to pay big ag to survive.,0,,,1,science
14efxze,0,Rice is in the top three of food categories that cause climate change,0,,,1,science
14efxze,0,"You know what really would be suitable to meet growing global demands? Dedicating less parts of our crop fields to animal food but rather directly using it to grow our food. And I’m not even a vegetarian. We could just eat less meat, thus use our agricultural space more efficiently and thereby reduce two problems at once.",0,,,1,science
14efxze,1, That will be depend on each nation. The West should eat less meat but rest of developing nations will increase meat consumption to meet nutrition requirements.,0,,,1,science
14efxze,0,Can it cover another 3 b in 30 years. Doubtful. How much more potable land will we lose to further human expansion? Maybe just feed everyone less? Why people insist on poping out more kids when people can't even list a net global positive of more humans.,0,,,1,science
14efxze,0,"Makes sense, and it was very smart of someone to think this up. After all, rice bolsters China’s economy and they have very many people to feed.  Thing is, is it heat resistant?  It seems to be most needed in Africa and India.",0,,,1,science
14efxze,0,"And India will probably still ban it and let their people starve, because their government doesn't like genetically modified crops",0,,,1,science
14efxze,0,"Snozzberry jelly sounds like a tasty thing, because I love berries.",0,,,1,science
14efxze,0,"My understanding is that in this country, USA, most of the rice is grown in Texas. However, there are high levels of arsenic in the rice.",0,,,1,science
