post_id,level,body,gilded,likes,num_reports,score,subreddit
14efxze,0,"Welcome to r/science! This is a heavily moderated subreddit in order to keep the discussion on science. However, we recognize that many people want to discuss how they feel the research relates to their own personal lives, so to give people a space to do that, **personal anecdotes are allowed as responses to this comment**. Any anecdotal comments elsewhere in the discussion will be removed and our [normal comment rules]( https://www.reddit.com/r/science/wiki/rules#wiki_comment_rules) apply to all other comments.
        
**Do you have an academic degree?** We can verify your credentials in order to assign user flair indicating your area of expertise. [Click here to apply](https://www.reddit.com/r/science/wiki/flair/#wiki_science_verified_user_program).

---

Author: u/rustoo  
URL: https://www.adelaide.edu.au/newsroom/news/list/2023/06/14/new-discovery-set-to-boost-disease-resistant-rice

*I am a bot, and this action was performed automatically. Please [contact the moderators of this subreddit](/message/compose/?to=/r/science) if you have any questions or concerns.*",0,,,1,science
14efxze,0,Rice really is a golden goose of carbs,0,,,482,science
14efxze,1,"But requires a lot of fresh water and mild temperatures to keep the plant comfortable. When those paddies dry out, soil compaction does it's dirty work.",0,,,249,science
14efxze,2,Isn't most of the water used for rice just to keep parasites away?,0,,,153,science
14efxze,3,"Someone else may be able to confirm this, but I remember reading that rice doesn't *need* to be grown under so much water, but more that it *can*. And parasites, weeds, or other crap that make it harder to grow more rice can't thrive in that environment, so it's just easier to grow rice that way.

I'm sure there are technical details that I'm slightly off about, but that's the general gist.",0,,,258,science
14efxze,4,That and aquatic life like fish help fertilize which is a strong added bonus.,0,,,164,science
14efxze,5,Does Uncle Ben know about this?,0,,,39,science
14efxze,6,Uncle Ben is probably tripping balls.,0,,,37,science
14efxze,7,/r/unclebens,0,,,11,science
14efxze,6,Uncle Ben has been uhhhh informed,0,,,5,science
14efxze,6,I'd ask him if I could get him out from under Mrs Butterworth for 5 min,0,,,2,science
14efxze,6,"Why would Uncle Ben’s care?  Aren’t they all about making clean rooms for shrooms? I just can’t see wasting all of those dollars and brain cells on it, unless it’s being used for therapeutic reasons.  Bear in mind that I’ve recently had a stroke and would love to get some of my damaged brain cells back!",0,,,0,science
14efxze,5,"Hmm, how do fish get into flooded rice fields? Is someone dropping them off? And what happens to them when the water disappears?",0,,,4,science
14efxze,6,If you want to know more [this](https://en.m.wikipedia.org/wiki/Rice-fish_system) Wikipedia article is actually an interesting read to get you started.,0,,,2,science
14efxze,6,"Yes, they artificially introduce the fish and create side channels. When the field is drained for harvest or during the dry season, the fish survive in the side channels.",0,,,2,science
14efxze,5,"That’s kind of gross, to think that rice eaters are also eating fish spe.rm.",0,,,1,science
14efxze,4,"That's correct, it has also been discovered that to benefit from flooded fields they don't need to be constantly flooded, just at specific points during the crop's growth cycle.",0,,,10,science
14efxze,3,I thought that is what the ducks are for...only half joking,0,,,13,science
14efxze,4,"The ducks eat bugs above the water. Fish get em from below. Then you get a harvest of rice, eggs, fish, and ducks. Isaac players wish they had such a busted synergy.",0,,,31,science
14efxze,5,"Ducks eat from above, fish from below, I eat from the back.",0,,,3,science
14efxze,5,"What, you eat the fish and ducks after they were nice enough to eat your worthless bugs??  (Said in an indignant Jerry Seinfeld voice.)",0,,,2,science
14efxze,4,"The solution is, and always has been, more ducks.",0,,,4,science
14efxze,5,"Clucky ducks, to be sure (still in Jerry Seinfeld tone.)",0,,,1,science
14efxze,3,"Weeds really, which means not flooding the fields would mean more work or spraying against it.",0,,,3,science
14efxze,3,But is the kind of rice mentioned here also immune to parasites or only diseases?,0,,,2,science
14efxze,4,And what about the full sun?  Seems like it would be awfully sunny and dry in those areas.,0,,,1,science
14efxze,2,"It does not require a lot of water but it can tolerate a lot of water.
Reason you see it in water is to keep weeds and insects away",0,,,22,science
14efxze,1,"fun fact:

if you draw a circle, centred in Burma (Myanmar), with a radius of 3,300km... [more people (4.2bn) live _inside_ that circle than outside it](https://en.wikipedia.org/wiki/Valeriepieris_circle)

oh, and despite the fact that global populations have risen _by the billions_ in just the past 100 years or so, that population distribution - inside/outside the circle - has remained a constant for around 3000 years now

why?

primarily, two reasons: land and food

China and India both have massive rivers that cut across easy-to-farm plains - in fact India has more arable land than any other country in the world (China is 4th, behind Russia and the US - oh and pay attention to the Russo-Chinese borders because both Russia and China are - and Russia is very, very nervous)

and what was primarily being planted in these easy-to-farm lands?

yep",0,,,27,science
14efxze,1,"I don't get why more people don't just prepare raw wheat as they do rice.   Just started using wheat berries in place of rice, and it is a more well-rounded food in my opinion.",0,,,14,science
14efxze,2,"same reason brown rice isnt as popular, it still has the bran intact, this limits your shelf life and distribution. which should also be considered part of the implication here, but when we say 'rice' it typically means the milled and much more durable variety",0,,,44,science
14efxze,3,"If you don't crack the berry, it's shelf life is damn near 30 years.",0,,,15,science
14efxze,4,"yea its possible with an extra roasting step apparently, theyre still figuring out ways to stretch this. point being its not shelf stable though, meaning oils and acids in the bran make it less edible over time as they go rancid",0,,,13,science
14efxze,5,"I guess that's fair.   I store mine in 64oz jars with oxygen absorbers, and only keep one jar open.   And then I also have some in #10 cans with oxygen absorbers.

I got a little spooked about food supply for a bit, and went wheat over rice.",0,,,2,science
14efxze,5,So my 6 year old wheat berries are still good?,0,,,2,science
14efxze,6,"I mean, they're effectively seeds.  Maybe try to germinate them, and if they work, you should be good?

I'm not expert, but I'd personally test it that way, given no access to outside resources... or a nose...",0,,,2,science
14efxze,4,[removed],0,,,4,science
14efxze,5,"Well, first you need at least three consenting adults, and the one who submits to being the berry is not the heaviest of the group.",0,,,6,science
14efxze,2,"People probably don't like the texture, as with brown rice. So the closest thing that's very palatable is bulgur.",0,,,10,science
14efxze,3,"How does the texture differ?  I’ve had the kind in a cup and it tastes like white rice, to me.",0,,,1,science
14efxze,4,"The bran layer can be rather hard, depending on the variety of rice, and the taste can vary. With some varieties, it's like eating cardboard. Others are softer and more pleasant. Haven't tried rice in a cup, but I guess when they prepare it, they pick the softer varieties and make it even softer when they cook it. Judging by e.g. oats - which are very soft flakes in the instant form, but rather hard in the whole grain form.

And the thing with bulgur is that whole grain wheat is parboiled, like parboiled rice, so that some of the nutrients from the bran layer transfer deeper and you can remove the bran but retain some of the nutrients. This makes it a more nutritious alternative to white rice and e.g. wheat pasta, but without the bran.",0,,,1,science
14efxze,2,"Wheat allergies/intolerances are incredibly common, speaking from experience.",0,,,2,science
14efxze,2,"> I don't get why more people don't just prepare raw wheat as they do rice.

Isn't that just tabuleh?",0,,,2,science
14efxze,3,"More like farro, as the bran and endosperm are still intact.",0,,,2,science
14efxze,2,"Lots of options. Barley, buckwheat, even oats.",0,,,2,science
14efxze,1,"It’s rather nutritionally poor, no? Isn’t there a better grain we could grow? Or just eat more veggies for carbs instead",0,,,2,science
14efxze,2,"It provides alot more calories per acre than almost anything else. Also farmable on a large scale in a pre industry world. Sure many veggies will have a better micro nutient progile, but you cant feed the same amount of people with the same resources.",0,,,32,science
14efxze,3,"> you cant feed the same amount of people with the same resources

this right here

wheat produces something like 4mi calories per acre, while for rice it's more like 11mi - this means for every acre of farmland, wheat can feed around 6 people, while rice can feed 16 people

that difference has meant that for the past 3000 years, [more people have lived inside a roughly 3000km circle centred in South East Asia than outside it](https://en.wikipedia.org/wiki/Valeriepieris_circle) - and that trend continues to this day",0,,,13,science
14efxze,3,Don't potatoes provide more calories than rice? Also a lot more nutrition than rice.,0,,,12,science
14efxze,4,"And very delicious!  Can be prepared dozens of ways.  Very desirable to a gal with Irish blood in her.  Much prefer them to pasta, which is on my other side.",0,,,2,science
14efxze,5,Potatoes are so much better than rice!! So many ways to repair potatoes),0,,,1,science
14efxze,3,"> It provides alot more calories per acre than almost anything else.

Potatoes provide three times as many calories per acre.",0,,,3,science
14efxze,4,God love the Irish!  A perfect food to grow and eat!,0,,,1,science
14efxze,3,[removed],0,,,8,science
14efxze,4,And oats beat wheat.,0,,,12,science
14efxze,4,I'd be interested in hearing just the broad strokes.,0,,,2,science
14efxze,3,"As long as most of the crops are used for animal feed - which is crazy inefficient - we don't really need to talk about using crops efficiently, do we? We just grow what people want to buy.",0,,,3,science
14efxze,4,"If these crop wouldn’t sell for feed anymore, so these crop will automatically sell to humans?",0,,,2,science
14efxze,3,"And don’t forget that Bill Gates wants us eating insects, which will provide the protein.",0,,,1,science
14efxze,2,"Rye is better for less fertile regions, like changing from ""very much not optimal"" wheat fields to ""pretty okay"" Rye fields have been estimated to enabling feeding another billion people across the world.

Barley have a slightly higher yield than wheat but different flavor

Oats have less yield than wheat, but is pretty healthy (but isnt really that good for breads

Wheat is king for breads, because high gluten=good rise, which is why the different types of northern European heavy Rye breads usually have some wheat in it for texture.",0,,,5,science
14efxze,0,Can it grow in brine?  Mekong Delta is the “rice basket” of the world and is becoming salinated as sea levels rise.,0,,,146,science
14efxze,1,"Not just that, the river is dammed everywhere, from its source in China all the way down. So the flow isn't what it should be and the needed flooding doesn't happen as it should.",0,,,46,science
14efxze,2,The flow is political...,0,,,7,science
14efxze,2,[removed],0,,,-33,science
14efxze,3,[removed],0,,,44,science
14efxze,2,[removed],0,,,-35,science
14efxze,1,"There are salt tolerant varieties in production and research, from most major rice producing countries.",0,,,13,science
14efxze,1,"Depend how bad the land and how resistant the rice. If they can’t grow rice anymore, Vietnam for example, farmers move from farming rice to aquaculture.",0,,,2,science
14efxze,2,"Do you mean shrimp farming and the like?  They dump any kind of chemicals in the water to grow the shrimp, it’s very gross and the reason why I no longer eat shrimp, although I like it.",0,,,1,science
14efxze,3,Do you know what chemical and what are they using for?,0,,,1,science
14efxze,1,"I mean, brine-tolerant varieties already exist...  Clearly you haven't been keeping up with the research.",0,,,-114,science
14efxze,2,And varieties that don't accumulate arsenic? Have you kept up that research?,0,,,57,science
14efxze,3,Can we just go back to learning about salt tolerant rice and why it would accumulate arsenic more than traditional strains?,0,,,2,science
14efxze,4,"That’s a good question and one which I do not know, but would like to, the answer.",0,,,1,science
14efxze,3,No need to be a prick,0,,,-144,science
14efxze,4,"The audacity to write ""no need to be a prick"" after that level of condescension is honestly astounding",0,,,121,science
14efxze,5,"He acted as if something that already exists (even if it has issues), doesn't yet exist.

You need to stop bullying and gatekeeping (and of somebody highly qualified to discuss scientific matters no less- I hold a graduate degree in Biology.  Maybe I'll get around to the flair someday, since the process here actually seems secure, unlike certain *other* subs I refuse to trust with proof of my credentials due to wanting my real-life name and diploma, with no promise to delete it after...)",0,,,-30,science
14efxze,6,"No, I asked if it exists because I didn’t know.",0,,,15,science
14efxze,7,"That's my point.

These guys are acting as if you were already aware of the arsenic issue.  Or as if I magically would have been, just because I'm knowledgeable about some plant science and that salt-tolerant rice already exists.",0,,,-8,science
14efxze,8,"Oh, sorry.  Your comment didn’t read that way.  

Also curious to know the answer about arsenic in rice.  Supposedly people aren’t supposed to eat much rice because of the arsenic level, so perhaps rice isn’t the answer?",0,,,2,science
14efxze,4,You’re absolutely the one coming off like a prick and their response was calibrated to that,0,,,72,science
14efxze,4,So why were you? They just came at you like you came at them.,0,,,27,science
14efxze,4,Yes there was. Clearly you haven’t been keeping up with the comments.,0,,,8,science
14efxze,5,There's never a need to behave abusively towards other Redditors.,0,,,-8,science
14efxze,0,"This is a good news, but heat / drought tolerance is what we need for the future.  It's going to be a rough ride without these strains",0,,,188,science
14efxze,1,Field trials of crisper wheat in Brazil or Argentina supposed to be underway.,0,,,78,science
14efxze,2,"Actually a big deal in the plant world. Thanks for bringing this up.

There's a factorial of traits that will be beneficial. Faster time to flowering will be one, since adequate growing season times will be shrinking with temperature extremes fluctuating.
Disease resistance is going to be important due to degraded soils, which also have minimal microbial diversity, making it much easier for pathogens to emerge.
Heat tolerance will be important, but the huge element is compatible flowering and fertilization in heat. While many plants can handle mildly warmer temperatures, their ability to successfully produce the ""fruit"" will be hugely curtailed.

There's some things we can plan for, and some extremes we will struggle with. You won't be able to grow corn easily that gets flooded. You can't grow tomatoes when the temp hits 50C. It's hard to grow rice of there isn't adequate freshwater available. These are not simple solutions we can design plants to ""muscle through"", but will require an interdisciplinary approach. 

Plant protection (covered canopies), intercropping, faster growing periods to flower, drone-assisted maintenance, and  rotations with other livestock will all be parts of this equation.",0,,,57,science
14efxze,3,"I think drones are going to be huge. We got a DJI Agras T40 at work and it has been a game changer. Less chemicals used, more accurate application, being able to apply in more conditions than a wheeled vehicle... And we are just a seed company. When it becomes common in food production it's hard telling how far this technology will take us.

If anyone is looking for a change in career I would suggest looking into getting your Part 107 certificate and an aerial applicators license. The industry is about to explode and the pay is excellent.",0,,,33,science
14efxze,4,This is really interesting and not something I’ve ever thought could benefit from drones. What’s a job in this industry pay? Things like this really get me excited and scared for the future. Technology like this can be so beneficial yet so dangerous in the wrong hands.,0,,,10,science
14efxze,4,I'm in supply chain right now and hate it. I've been looking for a career change for a while. I researched agriculture drones a couple years ago and it seemed like a huge opportunity in the future. Can I PM you some questions?,0,,,6,science
14efxze,5,Sure. I might not be able to get back to you til in the morning though.,0,,,5,science
14efxze,5,"If you can, put them here so we can all learn.",0,,,2,science
14efxze,6,"Yes, I’m interested, as I’d like to tell my son about it.",0,,,2,science
14efxze,3,">Faster time to flowering will be one

Wouldn't this cause less nutritious food? Which is already happening due to soil depletion and higher CO2. Stack 'em up!",0,,,12,science
14efxze,4,"Rice is mostly important for calories. Slightly lower levels of minerals isn't a huge deal if you get higher productivity in return. And it can be fortified, or you can simply add some supplemental minerals to the soil.

And of course you get 0 nutrition if the plant dies in a heat wave and your crops fail.",0,,,11,science
14efxze,5,"Good points, but I will say - they weren't speaking specifically about rice in the comment above.

We are having more and more factors giving us less nutritious food. That's really bad for the world as a whole.",0,,,5,science
14efxze,4,Why are soil depletion and higher CO2 causing less nutritious food?,0,,,2,science
14efxze,3,"Wow, that was all quite fascinating!  Thank you.",0,,,1,science
14efxze,2,"Last I read there are some issues with the approval in Brasil. Afaik it was developed here in Argentina but they were expecting approval in Brasil to fully release it, it was approved but then some NGOs and weirdos claimed that it was done ""in the shadows"" without general consensus of the population, etc.


I dont think anyone used those seeds so far.",0,,,8,science
14efxze,3,That’s nothing new. Ecoterrorists really hate rice for some reason.,0,,,1,science
14efxze,4,Because it can feed and sustain so many people and they are people who hate other people?,0,,,2,science
14efxze,1,\*Laughs in climate chaos\*,0,,,5,science
14efxze,1,"Definitely agree.  The heat is going to be killer and will probably kill off many delicate plants, so heat or drought resistant strains are also important.  Heck, we people of the Western world may also be impacted and may need to plant and eat that kind of rice.",0,,,1,science
14efxze,0,[removed],0,,,26,science
14efxze,1,[removed],0,,,16,science
14efxze,2,[removed],0,,,4,science
14efxze,3,Mine too please,0,,,2,science
14efxze,0,[removed],0,,,168,science
14efxze,1,[removed],0,,,35,science
14efxze,2,[removed],0,,,29,science
14efxze,3,[removed],0,,,10,science
14efxze,4,[removed],0,,,9,science
14efxze,3,[removed],0,,,11,science
14efxze,4,[removed],0,,,11,science
14efxze,5,[removed],0,,,2,science
14efxze,3,[removed],0,,,1,science
14efxze,4,[removed],0,,,2,science
14efxze,4,[removed],0,,,1,science
14efxze,5,"97% of all US farms are family farms. Anything bigger than a hobby plot for the local farmer’s market is going to be incorporated. 

Who owns the land is not nearly as relevant as who farms it.

That “consolidation” of which you speak is typically done within families, which are constantly shrinking in size, simply due to demographics.",0,,,2,science
14efxze,1,[removed],0,,,4,science
14efxze,2,[removed],0,,,7,science
14efxze,1,[removed],0,,,-1,science
14efxze,2,[removed],0,,,1,science
14efxze,1,[removed],0,,,-10,science
14efxze,2,[removed],0,,,21,science
14efxze,3,[removed],0,,,6,science
14efxze,4,[removed],0,,,12,science
14efxze,5,[removed],0,,,-2,science
14efxze,4,[removed],0,,,0,science
14efxze,2,[removed],0,,,1,science
14efxze,1,[removed],0,,,-1,science
14efxze,0,"We need this studies because in the future the rice, and everything else we cultivate, will be in danger due to the climate change, plus the population on the earth is growing fast and we need more food with less  waste of production.",0,,,49,science
14efxze,1,"And, when you think about it, more people = more livestock, which we also will need to feed and which will ratchet up greenhouse emissions.",0,,,2,science
14efxze,1,"Climate change will result in changes in weather patterns/streams and high average heat.

It won't necessarily mean everything is suddenly dryer.  All this water isn't going anywhere.  Quite the contrary, it means the storms will get much worse since heat to them is like oxygen to fire, and global humidity will rise, which is bad, because we can't sweat as well as the humidity rises.  Too much humidity and we're completely screwed.

&#x200B;

As for the food thing - increasing production won't actually solve anything.  We throw away so much excess because it's more profitable to destroy said excess than it is to charitably give it away before it goes bad.  The world economy relies on people starving to death for food to have value (it's every kind of rage inducingly fucked up as it sounds.)

No, this isn't going to change without sweeping legal change, which isn't likely to happen without societal pressure, which would likely require no small amount of violence, because the rich sure as hell aren't going to let their heart grow 3 sizes just because people asked them to for once have one.",0,,,0,science
14efxze,2,"Ummm…sounds like ecoterrorism to me.  And not sure that I agree with all of your conclusions except that the rich will certainly not let their hearts grow 3 sizes larger despite the need for it.  In fact, Bill Gates is buying up tremendous amounts of American 
farmland while advising us to eat bugs.  Perhaps he plans on growing and selling food only for 3rd world countries on that land and force us to eat insects.  Sounds silly but I would not be surprised by anything that the rich do.  Look at the way they’ve been manipulating America over the last few years.",0,,,1,science
14efxze,0,"GMO ftw! (Seriously, I’m a fan of GMO, just not a fan of Montsanto)",0,,,33,science
14efxze,1,Hopefully it won't be tangled up in intellectual property disputes for a couple of decades like golden rice did.,0,,,3,science
14efxze,1,[deleted],0,,,3,science
14efxze,0,"I’m curious how this will affect the price of rice worldwide. If there is a increase in the supply of rice won’t that decrease the price of rice, and therefore farmers will make less money growing it?",0,,,11,science
14efxze,1,"Rice is contracting in growing acreage. The huge drought and heat wave that struck China last year has already sent rice prices soaring. As weather becomes more unpredictable, the freshwater required to grow the rice paddies will also be affected. The ability to grow rice at all right now is probably on the precipice of dropping in the near future.",0,,,14,science
14efxze,1,Increase in supply may also create more mouths to feed,0,,,3,science
14efxze,2,"That seems likely, both in live stock, pets and people.",0,,,2,science
14efxze,1,"> If there is a increase in the supply of rice won’t that decrease the price of rice

That's 19th/20th centry thinking.  Here in the 21st, prices go up up up forever!",0,,,6,science
14efxze,2,"Was about to say.  Corporations anymore raise prices ""as necessary"" but when demand drops or supply rises, they don't drop the price, they just destroy the excess to make room for something else. There is no reason a single soul in America for example should ever go hungry except corporate greed.  We produce enough to feed everyone and we'd STILL have food left over.

No matter what, they don't want to encourage people to just wait for prices to drop, they want you to buy it now, wait for a FOMO sale or don't buy it at all.",0,,,5,science
14efxze,3,"Damn it, that’s a sick way of doing business (and is bound to make them more money.). What is FOMO?   Not familiar with the term.",0,,,1,science
14efxze,4,Fear Of Missing Out.  Sales (and a lot of online games) generally lean hard on this behavior to make bank.,0,,,1,science
14efxze,2,"Yeah, that’s for sure!  It’s how people lived up until the 18th century, usually in their home country.",0,,,1,science
14efxze,1,"Poor farmers, no less.  And they will become poorer.",0,,,1,science
14efxze,0,"The food supply is already there. Tons of food is wasted on purpose to keep prices ""stable"" when this food could be packaged and sent to places that need it. Yay capitalism.",0,,,56,science
