post_id,level,body,gilded,likes,num_reports,score,subreddit
2mpf5c,0,"A farmer here...
That is a silage cutter not a grain harvester.  Silage being the whole plant chopped (corn in this case I believe) into tiny pieces for livestock feed... So they didn't lose much money on this mistake...if even $50 total from the entirety of this gif id be surprised.",0,,,509,funny
2mpf5c,1,"Let's say the cutter does 4 rows at 30 inch spacing, so 10 ft wide. I estimate it traveled maybe 35 feet in the gif.  So 350 square feet, out of 43560 in an acre, so .00803 acres worth of corn.  Even though its silage, let's give them a grain value of $3.50 and 200 bu/ac. 

$700/ac x .00803ac = $5.62 loss",0,,,261,funny
2mpf5c,2,Ok. Can I have you do my Homework? ...also my son's homework?,0,,,200,funny
2mpf5c,3,"I'm an agronomist, so stuff like this is really in my wheelhouse. Just simple math and unit conversion!  I guess if it makes you feel better, I could look at your hw.",0,,,57,funny
2mpf5c,4,Joking... but it's uplifting to see that there's someone willing to go that far. You are a good person... on Reddit no less.,0,,,13,funny
2mpf5c,5,Are you implying Reddit doesn't have good people?,0,,,4,funny
2mpf5c,6,"We're a step above 4chan, which isn't saying much.",0,,,4,funny
2mpf5c,6,"U WOT M8 I WILL FUCKING 1V1 U AND U WILL GET REKT

ON RUST.",0,,,2,funny
2mpf5c,4,"""simple math""",0,,,2,funny
2mpf5c,5,It was honestly only multiplication and addition...should be pretty simple.,0,,,24,funny
2mpf5c,6,ONLY multiplication and addition?! Sounds like something a genious would say.,0,,,7,funny
2mpf5c,7,"Haha, well I do have a degree in Math, but still.",0,,,2,funny
2mpf5c,5,it's really not hard.,0,,,4,funny
2mpf5c,3,"I too, failed high school math.",0,,,85,funny
2mpf5c,4,I am failing high school math,0,,,36,funny
2mpf5c,5,I've failen and I can't get up.,0,,,25,funny
2mpf5c,5,I LOVE HIGH SCHOOL METH,0,,,90,funny
2mpf5c,6,Math. Not even once.,0,,,5,funny
2mpf5c,6,I LOVE METH HIGH SCHOOL,0,,,0,funny
2mpf5c,7,"I was going to make a joke about the teachers and students each do things that only people on meth do. Then I realized I don't ready know that much about meth. So in the end, I decided to not make a joke, and instead tell you about my decision process for a decision you didn't know existed until reading this.",0,,,9,funny
2mpf5c,8,Sounds like you need to try some [Krokodil](https://www.google.com/search?q=Krokodil&rlz=1C1BLWB_enUS521US523&es_sm=93&source=lnms&tbm=isch&sa=X&ei=FJxsVKfFHoGvyATu2oCwCg&ved=0CAgQ_AUoAQ&biw=1035&bih=667),0,,,0,funny
2mpf5c,5,"It used to be that if they knew you were trying your best, you got a passing grade.  It changed by the time I got to 9th grade.",0,,,4,funny
2mpf5c,5,I am failing,0,,,4,funny
2mpf5c,5,"Are you planning on going to college and majoring in math?

If not, don't worry about it",0,,,4,funny
2mpf5c,6,Dude seriously? I keep hearing from just about everyone that if I fail I'll grow up to be a bum. ,0,,,5,funny
2mpf5c,7,"> I'll grow up to be a bum.

That is still achievable if you want it badly enough. Never stop reaching for your dreams.",0,,,9,funny
2mpf5c,4,Me + math = ?,0,,,2,funny
2mpf5c,5,"D͓̫̣̻̲̝͇a̳̳̥͝r̡̝̖̼̗̮̝ͅk͔̮ne͍̭s҉̳̙s̱̝͇̘̗͓̹͘ ̬̜͝f̦͍͟a̭̙̰l̜̦͖̜͓l̼̼̺s̲̥̯̩͖͕͢ ҉̙͚͇a̗c̵̦͖͉͔̗̪r̠̯̞̤͕̤͍̀o͔̪̱͇s̜s͉͖̜̱ ̲̣̱̹̯͉ͅt̲̤̘̮͝ẖ̬e͕̬̲͓͈͚̭ ̦̝͉̥̝l̤̬̝̟͇a͕̣̖͠n̼͈͙͈̬̘̭d̹̖̭͍͍
̮͕̥̰̗T̰h̰̟͈e̗̤͍͕͔̕ ̞͔͢m̳͍͎̥͝i̘d͏̳͔̞͇̜͉n͈͖̗̪̲̰̲i̩͎̫͔̫g̸h͍̦͖̹̤̝t̬͠ ̢h͏̖̜̬̟̠o̖̼̗ṳ̺͎́r̰͘ ̳͈͙̣̼̘i͎͝s̬̭̳͓ ̞̟̞͈̤͍̩c͢l͏̤̦̯͔͓o̷̩s͓̤̙͎͖͢e͍̯̭̱͖̻ ̷͚͚͔̥͍̫ͅa̩t ̢͙͇̦h̡aṋ̨̼̙̫̣̤̻ḍ́
͕̖̩̣̟C͕͔r̷̲̝ẹ̸̻a̴̳̥̹̗̞̮̟t͎̗͚͓̫̀ur̮̪e͙s̼̲̗͔͇̤͢ ̶̠cr̞̺̩͉̪̩a͚̙͕w̛̠̟̻̰̼̖̲l ̰̱̳̰͇́i̸̫͎̜n̪ ҉s̟̥̤̥̱͠eá͈̞͇̼r̲̩͘c̘̰̪̰̬̼͝ẖ̯̮̯̰͞ ̧͈̼͖̗͖͎͍o͎f ̭̰̤b̀l̵͇̤̪̹̲̙ͅó̹̣̠o̶̲̖͔d̫͇̱͓͙͓͡
̸̥T̹̤o̤̩͍̺̜̞̯ ̗͓̙̹t̝̜̗̜͞ẹ͈͇̣̼͓͉͠r̪r͇o͓r̴̥̺̯̰i͚͎̙̣͇̫̣̕z̦̞̹͈e͉̣͔ ̧̳̤̬̩̠y̱̯̫̜̱ͅo͖̪͙̤͚u̯͡r̼̹̳ͅ ̴͇n͎̯̘͜e̲̮̻̟͓̠̺i̲g̹̝̯̮̣̠̜h͔b̺̝̝̹̘o͕̺͙̱͍̫̟u̟r҉̖̣̣̪͎̺h̻̳ọ͇͚͚̯̝̠o͎d͚̝̕
̮̥̫̝A̜̳̻͡n͇̠̼̫̦̘d̲͕ ̱́w͈͔̭̳̠̥h͈͖̮ͅo̥̫͎̟͙͜ͅș̯̝́o̯͕̪̼e̤̯̠͇̫ͅv͈̯̻̫̠̀e̤r̪͎͍͜ sh͙̜̭͙̺̣͘a̼ll̢̼͍̖͔̗ͅ ͔̺͕b͙͔̥͖ę ̟ͅfo̸̟͙͖u̻nd͚̹̳̤̥̪
̞͙̻W̦̜̞̩̹̟̞͘ḭ͙t͉͎̺h̞̖̱͇͚͕̯o͍̩̖ṳ̫̜̝̱ͅț̨͖͔͓ t̥͙̼̟͔͞he͎ ̠̤ṣ̛o̗̳̹̥̠̳u̞͙͚̝̬̘l̡ ̦̪̟̳͚f̭͇o̵͕̹r̷͙͉͚ ̡̺͚̰̫̤͖̥g̖̭̫e̯̬̦̘̙̳̮͞t̮̝t͖͙̻̰̮i̦̼͖͎̦n̗̟̫͓̫͇̕ͅg̸̣̱ ̢͍̰͚̣̣̦d̨o̙̼̭̲̗̭̟w̷n̷̩̝̙͕̘͎͙
̙M̷̥̲u͙̖̙̖̩s͔̹̲t͏̞̞̯̗̮̮ s̲͇͞ț͓̭̳͈̲̰͟a̳͙͍̱̠̙n̺̲̝̤̝d̼̞̟̖̭͡ͅ ̹a̪̲nd̖͙̯ ̝̳͕̠ͅf̫̣̲̺ͅa̘̠c̡̘̗̼̱͙e҉̲̳͙ ̰̗̣͜ͅt̛̟̗̻̠̞h͚̻e̴ ̝̮̭ḫ̨̟̪̞o͓̭̝̜͉̹̹͡u̫̜n̺͓̳͞d̙͇̰̠̭̣s͔͖̬̺ ͈͓̪̘͢o͎͎͍̬̠͍̲f̪̻ ̲̝̺ͅh͉̟ẹ̴̩͈l҉͓̲̪͔͈̬̙l̪̖͉̼͚̫
̪̯̺̩̺̩͖Á̝̳̖͔̭̼n̴͈͔̭̹͈̳̗d͏̙̮̥͇͈̤̳ ̙̖ro̼̩̲̦͔̮̙͘t̵̤̱̲ ͔̱̜̪͙i̶͉̠̲n͇̲̰͝s̱̜ḭ̪̻d̛͓̥̯͍͓̞͈e̙̗̭͉ ̡a͝ ̫̹͓͈́c͔͢o͇͙̲̙̳r̪̞̙͕̣̪p̺ṣ̨̼e̲̫'͍̥̟͚̳s̗̹̟͚̱̱̤ ̨͔̪͖͓͓s̸̝̠͙̜̩͓̱h͔̦͖̺͕͍̯e̟̬̱̜͇l̙̯̫̹͖̕l̖
͎̳̲̠̠ͅṮ̲̖̫h̷͎e̜ ͕̤̪͈͇͎͝f̻͈͙̪o̟̳̭͞ͅu̞͍̣̳̦̺l͜es̩̰̥̳̲t͎͎͈̟̥͖̠͞ ͏̬̭̭s̩̰̪͉̕t͓̫̱̬̮e͎n͡c̡̘̲̤̭̝̰̠h i͕͙s̪̱̺͈̟̥ ̢̱̪̥͖i̲̲͇͈̙n̤̹̼ ̥͉̼̺t̜́h̵̠e̲͈̯ ̲̀a̩̹͈i̴̝̖̥̙̪̰ŕ̠͚͔̭
̪̣Ţh̪̺͇̰ͅe̶͓̩̞̟ f̰̘͇͇̜͈̦u̴͕̟̘̜͓ͅn̯͎̲k̨̲̯̖ ͓͖͚o̲̖̫ͅf ́for̹t͎y͕ ̗̠͎́t̗̖̼͟h̷̯͚͕͕̻o̟̫̫̥̤̣͟ͅu͍sa͕ͅn͜d̴͕͍̟ ̸̦̺y̘̩̰̘̣̞̕e҉͉̩̯̺̥͇a͝r͍͔̠̲s͘
͠A̴̳̠͙̩͔̬n̮͍̭d̥͈̱ ͈͚̺͈̰g҉̠͖̜͓̠ͅr̖̖̲i̯͈͝ͅͅs͉̰̯̫̺͔ͅl̩͈̦̦̱͕̭y ̭͙̀g̠̗̪̹̜͔͖͜h͈͝o̰̠̩̗̦̤̲u͙̭̣l̶͉s ̙f͇͕̲̘̦͓͞ͅr̵̮̱̲̭o̷̝̜͇͉͖͙m̪͈̻ ̱̙̥͓̫ͅe̖͙ve̼͎̟̬r͕͉̹̯̘̳͔y͏̼ ͔̱ͅt̼̙o̶͉̫̘͉̘̝̺m̜͖̩͉͞b̷͓̼͎̼͉
̖̣̗A̰̪̩̬̝͎̹ŕ̘e ̘͔́c͖̻̱͝l̜̻͙͎̦ͅo̲̖̬͇͝s͏̫̙ͅi̗͈̜̠̞͇̦n͏̰̦͈g͇̤̗̘̺ ҉̰̰̺̣͇̬̫i̗̻̤ṉ̩̮̮̦ ̖̖t͏͔̯̞̺̥̮ơ̝ ̣̱̩͈̦̱s͏͓̱̥͓é̘a͓͖̮̣̺ļ̩ ͍y̦̖̹̦̲̤̦o͇͙̞̮͉̰ṵ̯̭̻͓̭̻̀r̵̳̭̜̟ ͈̫͎̖d͈͞ơ͎o̰̕m̟̰̘
̭̰͈͍͉̗A̦̻͈n̗̪̰d̥͇̭͝ ̙͔͖t̼̘͉̥h̪͍͈̝̲͚̝ǫ̤̻̰͙͓͔͓u̘͙̰g̣̰̤̭͘h̜̺̭͉̬͇͢ ̷͎͎̞̼̖̹̤y̺̼͢o̸u͙̰̱̝ ̬f͈̳̞͕̞̕ìg̴hṯ̘̝̟̤͖̫ ̻͖́t͘ơ ̶͎s̭͢t̜̜̣̤̝á̜̞̳̘̫̱y̛̳̥͉ ̥̪̲̬͕͢a̡̳̗̮͓̰̟͖l̸̬̘̙͎̪̮̮i̦̜v̮̜̮͚͔̪̜e҉̤̝̩̘
̮̣̘͡Y͉o͚̯̱u͙̙r̵̳ ̢̥b̸o̗̭͈̖̺͉̻͠d̬̩͎͚̱ͅỵ̰ ̩̤͍s̻͎͠ṯ͈̩͍͈̻͠ą̝͕̦̱r̜̪͎t͍s̡ t͚̭̜̗̦͎̺o͎͇͖͠ ͢sh͏͖̬͔̬̝̫į̮̯͕͕͚͇̯v̶̳͖̬̥͖̫̞e̢̬r̫̖͈
F̡̫̙͓o͉͚͢ŕ͔ ̦͖̠̺͎n̛̝͙͓o͍̝̮̜̟ ̵̘̗͚͚̗m̠̤͉̤͖̠e̠̪͓̗̝̭͘r̸̪̦e͉̣̪̰̙̕ ̧m͇̺̱̥o̶̙̩͙̱͕̯r̢̦̳͉̮̗̱t̢̫̗̲̺͇̫̦a͏̥̘̜͓̤l͏̯͇̞̮ ̳͙͇c̜̮a̵̪̬̟͈n̵̘̲͈̬̦ ̥̘r̻e̩̣̤̤̘̥s͈̬i̥͇s̠̣̮̣͜t̩̟̲͚̮͍͡
̷T̳͍͓̥h̡̤̗͔̣̝ͅę̭̦̪͍͖̦ ̣̭̯͚͞ẹ̭̳̠vi͙̘̞̱̮l̦͘ ҉of͟ ̞̼̀t̻̣̖́h̫e͙̕ ̗͖̝̲t҉̜̺͔͖h̗͚̩̮r̨i̯͖̜̪ll̪̦è̘̠̣̺̩͚̤r̬ͅ",0,,,2,funny
2mpf5c,3,Do your own.,0,,,7,funny
2mpf5c,3,Are you an underage parent?,0,,,3,funny
2mpf5c,4,"No, I'm an asshole who knows how to strategically generate comment karma.",0,,,10,funny
2mpf5c,3,... he didn't do anything remarkable there. lol.,0,,,2,funny
2mpf5c,3,If you can't even do math with a calculator I'm afraid there is no hope.,0,,,-4,funny
2mpf5c,4,"Their is a way to modify your TI-82 graphing calculator to hold an IPod touch...

Since common core is ruining the future generations they have got to improvise.",0,,,1,funny
2mpf5c,5,">Since common core is ruining the future generations

I hope this is a joke :-p",0,,,1,funny
2mpf5c,2,"Fuel, vehicle costs, labor,  insurance,  operations cost?",0,,,4,funny
2mpf5c,3,"I feel reasonable in assuming that the overshot didn't start, nor end at the boundaries of this gif. 

Lord knows the actual value lost. 

Also, nobody gives a shit about silage... its just an attempt at extra cash flow... sometimes its helpful... other times its just expensive. 

The father in law (farmer) generally prefers to take potential silage and just fold it into the soil prior to each planting. (theres a word for that, I dont remember what it is). 

",0,,,7,funny
2mpf5c,4,"technically he would just be using it as a cover crop and turning it under at that point.  Improves soil structure, not sure on the Nitrogen or other nutrients added to the soil by silage though",0,,,2,funny
2mpf5c,5,"No significant nitrogen from silage. Legumes return the nitrogen into the ground while corn sucks it up. that's why you'll see a crop rotation. Soybeans will give you 20-30+ credits of nitrogen. Then you add more either through fertilizer, anhydrous ammonia, liquid 28, or liquid 32. You're best off to space out your applications so you don't lose that much through leaching and other weather related issues. On a true crop rotation, I do: fall applied nh3, pre plant 28 incorporated with tillage, then a v4 stage side dress with 32. Total nitrogen varies per farmer but I do a .8# nitrogen/bushel of expected corn. So 200bu of corn needs 160# nitrogen. ",0,,,2,funny
2mpf5c,4,Didn't realize that ,0,,,1,funny
2mpf5c,5,"It's apparently some form of fertilizer. 

Not necessarily for the crop the follows immediately, but for the crops after that. 

I mean.. 

Farming is simultaneously a very straightforward endeavor, as well as a highly scientific one. ",0,,,5,funny
2mpf5c,6,"I mean that's what top-soil is.

I doubt you could really call it composting, but it doesn't really matter.",0,,,2,funny
2mpf5c,7,"It's pretty much laying down material and letting bacteria transform that into organic matter, which is more or less topsoil.  It helps to hold moisture and moisture more effectively.",0,,,1,funny
2mpf5c,3,Do you think that would matter for the calculations he did?,0,,,1,funny
2mpf5c,4,"It was an actual question,  curiosity and all that",0,,,1,funny
2mpf5c,5,Oh I didn't know you actually were interested in this kinda of thing. Sorry I thought you were just being nit picky.,0,,,1,funny
2mpf5c,2,"For you, math like this is probably done over breakfast.  I probably struggle equally as hard trying to figure out how much cereal to pour when I'm using up the last of the milk.",0,,,11,funny
2mpf5c,3,Pour milk first!,0,,,2,funny
2mpf5c,4,[deleted],0,,,22,funny
2mpf5c,5,Satan is laughing ,0,,,6,funny
2mpf5c,6,Whose drinking a Monster?,0,,,1,funny
2mpf5c,7,"No, no, on your cereal.",0,,,1,funny
2mpf5c,8,Monster on your cereal?? I bet it would go good with trix. Or fruity pebbles,0,,,2,funny
2mpf5c,4,Pour the milk. add some cereal. Top off with water.,0,,,0,funny
2mpf5c,5,you should be burned at the stake,0,,,11,funny
2mpf5c,2,"Damn, look at you math. ",0,,,2,funny
2mpf5c,2,Fucking story problems.,0,,,2,funny
2mpf5c,2,"Four rows? You must be from the 70s.
",0,,,3,funny
2mpf5c,2,/r/theydidthemath,0,,,5,funny
2mpf5c,3,/r/thatguystolemycomment,0,,,-9,funny
2mpf5c,4,/r/subredditsashashtags,0,,,-4,funny
2mpf5c,3,/r/itwasapoopsmash,0,,,-9,funny
2mpf5c,4,...couldn't bring myself to link to \/r/wafflestomp,0,,,1,funny
2mpf5c,5,"> /r/wafflestomp

haha i did that once in the dorm showers when i shit by accident",0,,,2,funny
2mpf5c,2,"Corn silage usually averages about $60/ton, so it's less than even that. 

For layperson's reference, a wagon that size should hold about 4-6 tons depending on moisture. ",0,,,1,funny
2mpf5c,2,"Now work it back to how much that wasted corn will cost, if it were seeds that you buy for replanting?",0,,,1,funny
2mpf5c,2,Couldn't the farmer just let his live stock out near the spilled silage? Can they not eat it up from the ground?,0,,,1,funny
2mpf5c,3,"Corn fields are not always near pastures or barns, plus no fence",0,,,2,funny
2mpf5c,2,/r/theydidthemath ,0,,,-1,funny
2mpf5c,2,/r/theydidthemath ,0,,,-2,funny
2mpf5c,2,"This accounts for marginal costs, but not the true cost of doing this. He's running a fossil fuel powered vehicle, burning fuel, and compacting croplands by using heavy machinery. All of these have intangible negative outcomes that aren't accounted for in the current economic system. 

His idea of not much loss in wasteful and wrong. Or at the least incomplete. ",0,,,-4,funny
2mpf5c,1,"Have played Framing Simulator 2013, can confirm.

Edit: I know it's there, I'm sticking with it.",0,,,15,funny
2mpf5c,2,"Whilst that looks like a misspelling of Farming, I cant help but think there probably is a Framing Simulator where you frame art pieces.",0,,,10,funny
2mpf5c,3,Or frame other people to take the fall for your crimes.,0,,,4,funny
2mpf5c,4,"I'd play the shit out of that.

Assassin's creed, but better. ",0,,,3,funny
2mpf5c,5,Should be a new mode to Hitman. Top stealth isn't making it look like an accident or doing it completely undetected- its making it look like an inside job by your target's allies.,0,,,2,funny
2mpf5c,3,Or roofs.  That would be awesome.,0,,,3,funny
2mpf5c,3,Or frame houses. ,0,,,1,funny
2mpf5c,2,Haven't played the Farming Simulator 2015 yet?,0,,,1,funny
2mpf5c,3,"Nope, waiting for it to go on sale. Why, have you played it? Is it any good?",0,,,2,funny
2mpf5c,4,"Only watched it on twitch, looks fun with multiplayer.",0,,,1,funny
2mpf5c,1,"Also, that stinger has a camera on it so the driver can aim. ",0,,,9,funny
2mpf5c,1,As a city boy I just want to say thanks. Farming is tough work that few people want to do anymore. It's a necessity for everybody and I just wanted to say thanks to you and all the other Farmers for what you do. ,0,,,7,funny
2mpf5c,2,Well in fairness few people *have* to do it anymore what with modern farming practices being what they are. ,0,,,4,funny
2mpf5c,3,You could also say modern farming practices are what they are because few people want to do it anymore. The machinery/production industry had to evolve to the farmers needs.,0,,,1,funny
2mpf5c,4,I realize you're being clever but you need literally hundreds of workers to match the same efficiency. And you don't have to pay the farm equipment an hourly wage.  ,0,,,1,funny
2mpf5c,2,[Farming is actually not that hard](https://www.youtube.com/watch?v=6A7bq1HFygs&feature=youtu.be),0,,,1,funny
2mpf5c,1,Is it usually $50 profit for that if collected? or $50 revenue?,0,,,3,funny
2mpf5c,2,Revenue. Lots of value add further down the food chain,0,,,1,funny
2mpf5c,1,is he actually trying to catch it or is he setting up to till the refuse into the soil to revitalise it as the crop prices were not worth harvesting and shipping expenses?,0,,,9,funny
2mpf5c,2,Pretty sure he was trying to catch it. I haven't heard of people spreading corn to get nutrients back into the ground. That's what cow craps for. ,0,,,13,funny
2mpf5c,3,"It's not specifically to get nutrients back into the ground, it's because sometimes it costs more to harvest and ship than you get back from the sale. It's more cost effective to simply till the whole harvest (rather than just the crushed/chopped up stalk mulch) than to harvest the corn.

The government even pays farmers on and off not to grow corn when there is a surplus.",0,,,5,funny
2mpf5c,4,Yeah I get what your saying now. But being corn silage you usually don't sell it for profit it's used for feed. ,0,,,2,funny
2mpf5c,5,"Not saying that is what he is doing, just asking the question since it seems odd to me that he's clearly gone quite a distance and not stopped, and it makes me think that it's deliberate. Plus it's being filmed.",0,,,6,funny
2mpf5c,6,He's on his phone.  ,0,,,3,funny
2mpf5c,4,Is that getting less common now that Ethanol is more common? I know it takes a lot of corn to make that.,0,,,1,funny
2mpf5c,2,[deleted],0,,,1,funny
2mpf5c,3,"Could be anything, why would you be filming it missing and not stop?",0,,,3,funny
2mpf5c,4,"Because one of the other workers saw it and thought it was fucking hilarious so he decided to take a video of it?

Source:  That's what I would have done.",0,,,3,funny
2mpf5c,1,That would sting if it wasn't. ,0,,,2,funny
2mpf5c,1,"Guy who plays Farming Simulator here, this guy knows what he's talking about.",0,,,2,funny
2mpf5c,1,"I went to your profile to see what other interesting farmer things you posted.

Disappointed.",0,,,1,funny
2mpf5c,2,Go to r farming subreddit. Heaps there.,0,,,1,funny
2mpf5c,2,"Sorry, that was the first time I've ever commented on here... Been a lurker for a few months but saw an opportunity where I had a base knowledge of the matter and couldn't resist.",0,,,1,funny
2mpf5c,1,50 dollar loss over about 10 seconds? That means 300 dollars every minute. That can't be good. Unless I'm misunderstanding something? ,0,,,1,funny
2mpf5c,1,"I left this gif running for hours, cost he $1000s.",0,,,1,funny
2mpf5c,1,That an I'm sure the person filming it would have put a stop to it pretty quickly if it was a problem.,0,,,1,funny
2mpf5c,1,could they just let the cows out to eat all that stuff off the ground?,0,,,1,funny
2mpf5c,2,It's in the middle of a corn field.  Fencing it in would cost far more time and effort than it's worth.  ,0,,,3,funny
2mpf5c,3,don't all the cows stick together in a group? you could herd them while riding a horse with a lasso - cowboy style!,0,,,1,funny
2mpf5c,4,"Sometime.  Or they don't. Mostly the idiots head right for your neighbors flowers, the road, the woods.  Cows are worth money.  You don't just turn them lose and hope it's fine.  This is dairy farming (possibly beef) not the Wild West.  We haven't had horses here since my grandfather was a boy.
Again it's just  a few dollars of feed.  ",0,,,1,funny
2mpf5c,2,"Every year we let our cattle out on harvested corn fields (ones with adiquate fences) and let them graze off the fields.  They will find most of the corn that gets thrashed out or the ears that fell off the plant before harvest.  They'll eat up a lot of the thrashed cobs and leaves that got ran through the combine and ultimately clean up a lot of the residual trash left behind from the plant. This helps because if the corn crop is halfway decent there will be a lot (sometimes far too much) of material one would have to work into the ground to be naturally broken down over the following years to put organic material back into the soil for future crops to draw nutrients from.  (And yes, I relize that sentence was a run-on like four times over...) sometimes one would have to clear it off with a stalk chopper and bale it, or drag it and burn the residue of there is far too much.  So short answer, yes, grazing cattle on corn stubble is beneficial both as basically free feed, and to rid the ground of excess material.
",0,,,1,funny
2mpf5c,1,[deleted],0,,,1,funny
2mpf5c,2,Looks like it ,0,,,1,funny
2mpf5c,2,"What do you mean oddly, it´s a great game. Do you have the new one already?",0,,,1,funny
2mpf5c,0,... and the cameraman just kept laughing while the camera was on.,0,,,41,funny
2mpf5c,0,and that's why you don't quit being a pro football player,0,,,13,funny
2mpf5c,1,Perfect full circle reference to end my morning reddit read.,0,,,2,funny
2mpf5c,1,http://imgur.com/rPMqufx,0,,,1,funny
2mpf5c,0,About how much money is being lost here?,0,,,13,funny
2mpf5c,1,http://www.reddit.com/r/funny/comments/2mpf5c/crop_yield_was_unexpectedly_low_this_season/cm6ln0w,0,,,11,funny
2mpf5c,1,750ish $ an acre lol,0,,,-24,funny
2mpf5c,2,">$7.50ish an acre lol

FTFY",0,,,20,funny
2mpf5c,3,"$6ish in the gif, assuming that's corn, about $700ish an actual acre. 

[Source.](http://www.reddit.com/r/funny/comments/2mpf5c/crop_yield_was_unexpectedly_low_this_season/cm6ln0w)",0,,,9,funny
2mpf5c,3,"It's pretty clear he is saying that if the farmer keeps going like this, then it will amount to more money. The actual number based on average crop yields for 2014 and the current price for corn is $661.05/acre.",0,,,1,funny
2mpf5c,3,I think he was trying to calculate the lost costs.,0,,,-1,funny
2mpf5c,3,"approx $750.00 worth of corn in an acre
FTFY",0,,,-15,funny
2mpf5c,4,"I remember growing up with my grandparents having a half acre property. It was so nice to run around in the yard and play sports with my family.

These days, you can't hardly do that. You can barely park a car in an acre now, let alone have a house and a yard.

Kids these days.",0,,,-1,funny
2mpf5c,2,That was painful to read,0,,,3,funny
2mpf5c,0,That gif is very grainy. ,0,,,92,funny
2mpf5c,1,What a corn-y pun.,0,,,19,funny
2mpf5c,2,[deleted],0,,,15,funny
2mpf5c,3,"Shucks, you guys are good at these. ",0,,,16,funny
2mpf5c,4,These puns are giving me a mi-grain.,0,,,9,funny
2mpf5c,5,They're a kernel (colonel) in the art of making puns. ,0,,,2,funny
2mpf5c,6,"Wheat are you guys shocking about?

Edit: Wow.  I guess Mr. Downvote has never heard of a wheat shock...",0,,,0,funny
2mpf5c,6,This train has not yielded the best of results.,0,,,1,funny
2mpf5c,4,I'm going to stalk this thread for corn puns.,0,,,5,funny
2mpf5c,5,I'll keep an ear out for them and let you know if more come in.,0,,,2,funny
2mpf5c,6,I like corn.,0,,,0,funny
2mpf5c,0,"So we sent Matthew McConaughey, America's greatest son through a wormhole for NOTHING??",0,,,10,funny
2mpf5c,1,"He was driving a rocket ship since... long before anybody paid him to drive one. He didn't do it to be cool, he didn't do it to make a statement, he just liked it. ",0,,,3,funny
2mpf5c,0,"Pissing with a boner.

FTFY ",0,,,16,funny
2mpf5c,1,I just use the sink.,0,,,1,funny
2mpf5c,0,"When thou tillest the ground, it shall not henceforth yield unto thee her strength; a fugitive and a vagabond shalt thou be in the earth. Then knowst thou that this shit is cray.

Genesis 4:12",0,,,19,funny
2mpf5c,1,"A lot of seed spilled on the ground, here. God have killed for less",0,,,2,funny
2mpf5c,1,Jay Z reminds me of jesus.,0,,,2,funny
2mpf5c,0,"He forgot to press ""B"" to turn off the harvester.",0,,,6,funny
2mpf5c,1,Press X to pay respects to the harvester driver...,0,,,2,funny
2mpf5c,0,I had a guy in a Lexus do that to me with his windshield washer!,0,,,4,funny
2mpf5c,0,Should have spent more time on [farming sim 15](http://www.farming-simulator.com)....,0,,,4,funny
2mpf5c,1,"WHERE WAS THIS GAME WHEN I WAS A KID? 

I kinda still wanna play it. ",0,,,2,funny
2mpf5c,2,I suggest not if you value daylight. I got it the day after it was released. Three days later I had about 40 hours into it.,0,,,1,funny
2mpf5c,2,"Don't listen to him, check this out: https://www.youtube.com/watch?v=gEJHrmliVQw",0,,,1,funny
2mpf5c,2,If you can get in with a group of about 10-12 people to run a farm it's fun.  I played it for a while until my group moved onto another game and it was great.  You have to communicate and work together to get everything right.,0,,,1,funny
2mpf5c,1,[deleted],0,,,2,funny
2mpf5c,2,it's not up to the 15th game the 15 is for the year 2015 we will get 16 next year probably ,0,,,1,funny
2mpf5c,3,[deleted],0,,,2,funny
2mpf5c,4,It's a surprisingly fun game to play like Euro truck simulator 2 :),0,,,1,funny
2mpf5c,5,[deleted],0,,,2,funny
2mpf5c,6,"I had the original way back in 98?, It's up to Train Simulator 2015 now (You can disable all the arcade things so you need to interact with everything I think) personally I like RailWorks more, favorite part is shunting.",0,,,1,funny
2mpf5c,3,I think the last one was 2013 (but seriously I know this as fact because I have both of them but I was trying to pass it off as if I had only a vague recollection and didn't spend 6 hours last night playing it). The next will likely be 2017.,0,,,0,funny
2mpf5c,0,I guess that's one way to reseed the field. ,0,,,5,funny
2mpf5c,0,What is happening here?  ,0,,,5,funny
2mpf5c,1,He's chopping corn for silage and didn't adjust the snout to hit the wagon.  Operator is obviously not paying attention and probably on Reddit.,0,,,18,funny
2mpf5c,2,"Next post : TIFU by, redditing during woork.",0,,,2,funny
2mpf5c,1,Im not 100% sure but it looks like the collector is overshooting the trailer. It should be going INTO the trailer and collecting the crops.,0,,,6,funny
2mpf5c,2,"Oh okay, I thought it was shooting seed and some of the seeds were going into the trailer instead of into the ground.

Thanks for explaining.",0,,,3,funny
2mpf5c,3,"Corn planting is done in the spring, and it's done with one of [these machines](http://cdn0.pahlsmarket.netdna-cdn.com/wp-content/uploads/Corn-Planter.jpg). 

There might be some stray growth here next year just by the amount of crap on the ground, but most of that won't germinate properly. If you notice in fields where farmers are rotating crops and a short crop like soybeans is planted, you might see a few stray corn plants sticking out because of spillage like this. ",0,,,3,funny
2mpf5c,2,If you look at how high that trailer is you can't simply look out the back window he's right up the arse of the chopper to get round the Electric pylon and will probably break off onto the right once he's around it so the chopper guy can see where his spout is shooting off to ,0,,,1,funny
2mpf5c,0,Ban this sick filth.,0,,,2,funny
2mpf5c,0,"Finally, a gif that represents me trying to take a shit while I'm drunk.",0,,,2,funny
2mpf5c,0,Anyone else watch this and think of Kim Kardashian's new photo?,0,,,2,funny
2mpf5c,1,$1 /u/changetip ,0,,,0,funny
2mpf5c,0,That's me in the morning!,0,,,1,funny
2mpf5c,1,You need to get better at pouring your cereal. ,0,,,3,funny
