post_id,level,body,gilded,likes,num_reports,score,subreddit
2mpf5c,0,Wtf are they doing?  Usually the wagon is right next to the chopper when they do this lol,0,,,1,funny
2mpf5c,1,Power lines are coming up so they had to go behind. ,0,,,3,funny
2mpf5c,0,You can’t blame Miley for this one.,0,,,1,funny
2mpf5c,0,So who would be at fault here? The truck driver or the cutter operator? ,0,,,1,funny
2mpf5c,1,Both really but honestly the tractor driver pulling the grain wagon should not have been that close to the harvester.  Its not like they did the entire field this way. They put the wagon behind the harvester to get around the powerline tower without having to run over crops.  They would normally be running parallel and staggered to you can actually see whats happening.,0,,,1,funny
2mpf5c,0,The best of british farming (The pylon is looking very british),0,,,1,funny
2mpf5c,0,I don't get it,0,,,1,funny
2mpf5c,1,the stuff they're harvesting is missing the box they want to keep it in,0,,,0,funny
2mpf5c,0,Where is the Kardashian post?????,0,,,1,funny
2mpf5c,0,where is the kardashian post?????,0,,,1,funny
2mpf5c,0,"as my mum always says ""in it not at it""",0,,,1,funny
2mpf5c,0,Worst case of corn ejaculation I have seen in some time.,0,,,1,funny
2mpf5c,0,A fresh crop of commercial grade fail is being harvested. ,0,,,1,funny
2mpf5c,0,"Crop yield was so high this year in fact that corn and soybean prices dropped too low for any farmers to be very profitable. 



okay",0,,,1,funny
2mpf5c,0,As a guy that grew up on a farm.... this had me in tears! lmfao!!,0,,,1,funny
2mpf5c,0,That's silage. Guy running the tractor behind the chopper didn't know what he was doing. ,0,,,1,funny
2mpf5c,0,"Interstellar confirmed
",0,,,1,funny
2mpf5c,0,This hurts to watch for some reason ,0,,,1,funny
2mpf5c,0,"I followed a chopper like that for a season. The tractor is doing exactly what he is supposed to. Our chopper had a camera that he put on the bottom of the spout so he could see behind him and that prevented things like this for the most part. Compared to the total harvest, that is a part of a single drop in the bucket. ",0,,,1,funny
2mpf5c,0,"also farmer here. can confirm that assuming they noticed their mistake before finishing that row, not much of a loss. still stupid as hell though",0,,,1,funny
2mpf5c,0,I have the same problem with my wiper fluid. ,0,,,1,funny
2mpf5c,0,"I wonder how many dollars just went to waste right there. If we could get the price of grain per pound, find the amount of grain processed by a machine like this, math it, and see dollar amount",0,,,1,funny
2mpf5c,1,its silage,0,,,11,funny
2mpf5c,2,I've never heard that word in my life. City dweller. ,0,,,2,funny
2mpf5c,3,"It's the rest of the stalk that is cut up for livestock feed, among other things.

Source: Live in Iowa, surrounded by this shit.",0,,,2,funny
2mpf5c,2,Corn silage is worth about $65 a ton around here.,0,,,2,funny
2mpf5c,0,So you're telling me Matthew McConaughey left his kids on earth for no reason?,0,,,0,funny
2mpf5c,1,Fuck you.,0,,,-1,funny
2mpf5c,2,"Thanks! You too, mate :)",0,,,3,funny
2mpf5c,0,Not funny.,0,,,-21,funny
2mpf5c,1,Nobody cares what you think ,0,,,14,funny
2mpf5c,2,I hope someone posts a GIF of your ultimate failure moment that results in months of lost time and thousands of lost dollars. Then you will agree with me.,0,,,-19,funny
2mpf5c,3,"I doubt they harvested the entire field in this manner. Probably went on for a row or two at most before somebody noticed. On the other hand, isn't finding humor in someone else's misfortune pretty widely accepted on the Internet? Do you always feel this way towards anything that is unfortunate for anybody? ",0,,,3,funny
2mpf5c,4,"Unless the person is a douchebag, yes, I always feel bad for them when something goes wrong. Honestly, in farming, it doesn't matter if they only harvested a few rows like this - that's still an entire year's worth of work and water, 2 rows of seeds, 2 rows of gas, 2 rows less profit, and possibly 2 rows of wasted pesticides and nutrients. That fucking sucks.",0,,,-7,funny
2mpf5c,5,"Hey man, both of my uncles & grandpa lost over 1.5 million dollars 2 seasons ago doing custom combining in Iowa, so I can kind of understand where you're coming from. Investing in agriculture can be a roll of the dice most times, but try to make light of these misfortunes. My family did, and they've made back that loss and then some this year alone.",0,,,7,funny
2mpf5c,5,Who says the people in this gif aren't douchebags?,0,,,-3,funny
2mpf5c,6,"Seriously, the douche bags are wasting grain when there are people starving in this world... Assholes. 

Edit: Do you dumbasses not know humor and sarcasm.",0,,,-6,funny
2mpf5c,7,They are actually working hard to feed people and either fucked up for a moment or had a malfunction.  It's compost now and only a small loss unless they kept going for a long time.,0,,,3,funny
2mpf5c,8,"Sarcasm. Does anyone think this is intentional, no.... So chill the fuck out. ",0,,,1,funny
2mpf5c,7,"Okay, gonna stop you right there. First off, this is silage (as many people in this thread have pointed out) so no grain is being wasted. Silage is used mostly for livestock feed.

Second, we keep a surplus of grain here in the states that is kept to artificially raise the price of grain. So if you want to yell at anybody for wasting grain, yell at the government.",0,,,3,funny
2mpf5c,8,"There is grain in silage. We chop the whole plant, mature but not dry ear of corn and all.",0,,,2,funny
2mpf5c,8,"Sarcasm. Does anyone think this is intentional, no....  So chill the fuck out. ",0,,,-1,funny
2mpf5c,3,It's a very small loss.  Maybe $50,0,,,1,funny
