post_id,level,body,gilded,likes,num_reports,score,subreddit
4p1xr6,0,"It also should be noted that it takes about 13 years to get a new variety of corn from inception to market. 

About 3 years to secure USDA funding and then another 10 years of testing to meet EPA and FDA regulations. ",0,,,447,science
4p1xr6,1,*New* varieties aren't really required.  It's just that the different varieties which already exist need to be utilized more appropriately.  ,0,,,263,science
4p1xr6,2,The typical product lifespan of a hybrid corn variety is something like 5 years or less. If it performs great then maybe up to 10 years but that's pushing it. Most farmers test new varieties each year and will adopt what makes sense,0,,,72,science
4p1xr6,3,[deleted],0,,,61,science
4p1xr6,4,I'm an Iowa farmer growing about 1300 acres of corn & soybeans; I try new varieties each year while retaining the best half-dozen or so from the previous few years.,0,,,22,science
4p1xr6,5,"Is this for animal feed?  Alcohol? Oil?

I'm a big fan of tofu, and it's always puzzled me how much soy is grown, but how little tofu I see in the store, and how expensive it is.  What is the disconnect here?",0,,,2,science
4p1xr6,6,"All of the above. I don't grow most of it for a specific purchaser; I grow standard commodoties (USDA #2 field corn, etc.). and sell to local buyers who sell it on to the various industries which use it. Around here, most corn ends up as either ethanol fuel or animal feed. Soybeans are usually either pressed for oil or processed into animal feed (they're a good source of protein to balance the carbohydrates from corn). The tofu industry is irrelevantly small compared to the other uses; I know very little about it. I sell my soybeans for something in the ballpark of $10 per 60lb bushel, and I typically sell them hundreds of tons at a time.

I also grow some corn and beans on a contract with seed companies, to be repackaged as seed for the next year's crop.",0,,,11,science
4p1xr6,6,"Probly because tofu is more of a niche, and crop brokers make more selling the soy to ethonal plants and as livestock feed. Although saying that it's probly mostly ethonal because a byproduct of that is distillers grain",0,,,2,science
4p1xr6,4,"I'm currently in Benin. Here, most people sell (and probably cultivate) very few varieties. When you go to the market, you see the same fruits and vegetables everywhere. I've seen something like 3 varieties of hot peppers, top. Maybe 2 of oranges. One or two varieties of tomatoes. 

If the country's weather changes, corn, manioc, igname and rice might take a great hit, and they are the staples noone here can live without.",0,,,32,science
4p1xr6,5,"Please correct me if I'm wrong (especially since I have minimal knowledge on Benin), but it seems like you're using the term ""variety"" in the colloquial sense. In agriculture, varieties aren't just about obvious phenotypic differences. Different varieties are defined by the stack of traits (whether they are genetically engineered or traditionally bred) that includes disease resistance, heat tolerance, herbicide resistance, pest resistance, high potential yield, etc.

Although I'm sure there are fewer varieties in less developed nations like Benin, I'd wager that there are multiple varieties that are not visually discernable. 

Of course if you are talking about corn seed, then I'm completely missing the mark. ",0,,,48,science
4p1xr6,6,"I work with an agricultural NGO here so I have discussed it with them and they confirmed there are indeed few varieties of each plant being cultivated outside a few places. Everyone replants the same seeds they had for a long time, sometimes generations ago. The only place where you find diversity in food in Bénin is beer.

Considering how poor the country is, only government and/or international subsidies will make them buy new seeds, even if the yields go down. 

And their techniques for growing plants are not even that great. With proper training, they multiply their cucumber yields by 14 for example.",0,,,32,science
4p1xr6,7,"OK, yeah. Then I stand corrected. 

>And their techniques for growing plants are not even that great. With proper training, they multiply their cucumber yields by 14 for example.

I can't agree with this more. I did some research awhile back looking at the cost-benefit for various technologies in different regions. For less developed regions, the benefit of transgenic crops (which I am a fan of in general) pales in comparison to the benefit of educating farmers on techniques and providing basic tools &ndash; e.g. tensiometers to measure soil moisture. 

One example that doubly proves this point is rice farming in Punjab &ndash; the breadbasket of India/Pakistan with one of the most dire water/aquifer crises on the planet. If Punjab rice farmers flooded their rice fields every three days instead of daily they would **triple their yields and reduce their water usage by 67%**... from doing LESS work... 

If you add in potential NGO+government sponsored adoption of relatively simple technologies like automated water pumps and pivot irrigation systems the yield increases and water savings would be astonishing.

Slightly off topic: What do you do for the NGO?",0,,,19,science
4p1xr6,8,"I was sent by a French NGO as an expert on insect farming. Songhai (the NGO in Benin) tries to develop more techniques for the locals to get their proteins (and vegetables as well, you'd be surprised how little they eat outside of starches), and some of the people here (especially in the North) already eat insects. 

We have created a first farm two months ago (from plastic boxes in a shed, very low key though plastic bins are expensive compared to concrete or wood), which is going well: the first generation already laid eggs, they have hatched and when I get back in September, their should be a few millions hanging around, with a starting number of less than 50 wild caught crickets.

The founder is very happy about it and has approved plans to get a full fledged farm in one of their big land plots (I'm in the first, small, 18Ha farm in Porto Novo which is mostly here for training and demo purposes but they have two 300Ha+ plots further north). I also help them finding new opportunities on the animal feed side (Hermetia illucens larvae raised on plant matter to replace fish meal/soy meal) and developing new products such as mango vinegar to reduce waste (they have way too many mangoes when in season). ",0,,,15,science
4p1xr6,7,"> With proper training, they multiply their cucumber yields by 14 for example.

I find this fascinating... so I assume there are efforts to increase local knowledge on farming?

If the same land can produce 14x (or let's be conservative and call it 5x) of any staple crops, wouldn't that practically solve hunger in that region? ",0,,,5,science
4p1xr6,8,"It would with proper access to capital, which as I said in another comment, is very difficult. People here need something like 3 times the capital they borrow to secure a loan, with 18 to 24% rates being the norm. 

The way I see it, people are resigned and would rather continue to live like they do instead of making the enormous efforts that would be necessary to :

a) Get proper training (for example at the Songhai center in Porto Novo where I'm working)

b) Get the capital to start a proper farm or modify the infrastructure of one they already own.

",0,,,5,science
4p1xr6,9,"I'm sorry - I also would rather continue the way I already do things than to take a predatory loan.  Also, how is a farmer supposed to run a farm if they're off at some center getting training?  It's idiotic what you expect people to do.",0,,,2,science
4p1xr6,4,[removed],0,,,3,science
4p1xr6,5,"You are right on how you see things, luckily my uncles tail is a bit brighter. He is a season from retiring and letting the big boys (contractors) do the lot. Because I turned the career down. He has run a tight ship, low maintenance, low output etc which has meant for his time he has expanded the farm and done alright. Doubt it will ever return to being ran as a unit, but it's a pretty tidy lump to rent out. Family farming is over, industrial farming is here.",0,,,2,science
4p1xr6,3,Are new varieties really significantly better? I mean is there significant improvement every 5 years in genetics of corn? Do old ones disappear?,0,,,9,science
4p1xr6,4,"Yes and yes. I work in the ag industry and, add an example, we've been pushing crop yields up year for over a century. 50 years ago, it would be crazy to pull 200 bushels per acre but now we're pushing near 300 and we're only getting better",0,,,37,science
4p1xr6,5,The interesting graph is crop yield (of corn for example) plotted over time.  I think the increases now are far more conservative than 50 years ago.,0,,,5,science
4p1xr6,5,"300 bushels per acre? Is that monoculture? Corn is pretty cheap product I think. At what field size is it economically justifiable to irrigate it? Sorry if my questions are a bit technical, I've finished faculty of agriculture (European), so it interesting to me cause I rarely see corn irrigated in my surrounding, maybe we just have decent amount of rain here...",0,,,10,science
4p1xr6,6,"Yeah that's monoculture as in its the only crop in the field. We don't do continuous monoculture. As for irrigation, we typically only plant corn in our fields with sprinkler systems, so about 160 acres is the smallest you'll see where I'm at. (Kansas)",0,,,12,science
4p1xr6,7,"Now I have, perhaps a bit silly question in your eyes. How much(approximately) is the lease for land in your parts? For instance, someone has a field and doesn't wont to work it, won't sell it. Can he lease it for money?",0,,,2,science
4p1xr6,8,"Leasing is between $150-250 per acre annually to rent to a farmer, depending on the quality of soil. ",0,,,3,science
4p1xr6,8,"Yes he can rent it out to a farmer. Cost can be different depending. I've seen it where the farmer and owner split operating costs (2/3 to 1/3) for example, and the profit is split the same way. Ratio can vary. Or a flat fee per acre. Fee can increase or decrease depending on land quality, location, availability of water for irrigation, etc.

I've also seen it where the landowner pays for everything, and pays a flat fee to the operator for planting, spraying and harvest, and then the owner takes all they profits but that's less common in my neck of the woods.",0,,,2,science
4p1xr6,5,Wierd numbers you have there.. Average corn  yield went from about 40 to 160 bushels/acre in the last 50 years.  400% up. https://www.agry.purdue.edu/ext/corn/news/timeless/images/CornYieldTrend_US.gif,0,,,2,science
4p1xr6,3,What if a perennial corn was developed? Wouldn't that increase lifespan significantly?,0,,,1,science
4p1xr6,3,"/agree

This timing sounds like the GMO process of gene splicing.

Using the same type of technology but using the older 'nature' hybrid cross-breeding method, it's a 5 year process vs 13, and pretty much rubber stamped being as it's 'natural selection'.

You just can't patent the end results like you can with a GMO.",0,,,1,science
4p1xr6,2,"This is exactly what this study, as far as I can tell, totally missed. There are already varieties that can cope with warmer temperatures, it's just that those aren't in use.",0,,,3,science
4p1xr6,1,"That is only for GM corn. EPA and FDA testing aren't needed for non GMO corn.  

Source: I'm a plant breeding grad student. ",0,,,23,science
4p1xr6,2,But wouldn't you agree that creating new varieties with the specific traits needed to keep yields stable or growing in the face of pests and environmental changes could very well take longer or be impossible through traditional breeding?,0,,,7,science
4p1xr6,3,"No I don't think so. There is a ton of genetic diversity that can still be exploited. GM doesn't work very well with traits like yield since it is highly quantitative and the amount of loci that need to be breed for is too much to do on a gene by gene basis (even with recent in CRISPR/Cas9 technology. 

For things like disease and pests, GM has worked well in the past... for example the papaya industry in Hawaii. However that methodology is dependent on having a gene ready to deploy and insert into another genome, which we don't always have. At that point we are back to square one and are doing various methods of traditional breeding to improve the crop species. 

",0,,,4,science
4p1xr6,2,"From first cross to testing, to scaling trials, to seed increase to public release is between 4-7 years. That's depending on if you use winter nurseries or not, and if you Double Haploid the lines.

Source: Plant Breeding Grad Student also ""Breeding for Quantitative Traits in Plants"" by Rex Bernardo, page 13",0,,,2,science
4p1xr6,1,[removed],0,,,17,science
4p1xr6,2,[removed],0,,,11,science
4p1xr6,1,I can guarantee that in the event of an actual serious global food crisis it would probably happen at least a little bit faster.,0,,,4,science
4p1xr6,2,[removed],0,,,1,science
4p1xr6,1,Is that historically speaking or including modern techniques? ,0,,,3,science
4p1xr6,1,I believe that number is specifically for transgenic crops,0,,,1,science
4p1xr6,1,"And ~$110 million. Which is a bargain compared to pharma/medical devices, but still a huge expense. ",0,,,1,science
4p1xr6,1,The introduction of different farming techniques might be faster than creating a new plant variety? ,0,,,1,science
4p1xr6,1,"And hawaii, the best place to have a 3 crop year cycle to produce new varieties banned GMOs. Now research has to move out of the US, slowing the research significantly.",0,,,1,science
4p1xr6,1,I'm guessing if we're all starving those numbers reduce to about 3 months total,0,,,1,science
4p1xr6,1,We could stop using corn for everything and use something better suited for warmer climates.,0,,,1,science
4p1xr6,1,"This isn't true; it takes 13 years to get a new recombinant DNA (GMO) trait approved in corn, but new varieties can be made in 6 generations, or two years in a place like Hawaii. Any breeder can license a GM trait from Monsanto to breed into there crop without going through new regulations, assuming the trait has been approved. This is why roundup ready corn is around 90% of the market, but only 1/3 of it is sold by Monsanto (Directly)",0,,,1,science
4p1xr6,1,"That's state side, Russia has less boundaries and more grain lands.  It's in America's best interests to get on the stick with regulations regarding agra tech.  ",0,,,1,science
4p1xr6,0,"I've lived on a farm my entire life the newer varieties are better yielding than the older ones for us. I think the problem is drought, I don't think any plant is going to yield well in these conditions ",0,,,227,science
4p1xr6,1,"It will be a mix of drought and floods, ruining top soil and gouging out the earth.

",0,,,55,science
4p1xr6,2,"This, I ween, is at the core of the problem. Compaction of the top soils by the agricultural machinery coupled with its acidification by fertilizers and it being stripped of organic matter by erosion can ultimately yield to permanent reduction of the quality of the substrate in fields all around the world. This should be what's alarming us the most when we turn to face this unprecedented climate change. ",0,,,16,science
4p1xr6,3,"Don't know where you're looking, but you're describing the problems of 1940s-style farming, not 2010s-style farming. I'm a farmer, and I actively manage compaction using many different tools. Soil acidification is actively managed by annual soil testing and prescription lime application to reneutralize the pH, and a combination of conservation tillage, no-till, and cover crops both curbs erosion and builds organic matter.

Yes, these factors are still problematic in developing parts of the world, but the techniques and technology to manage them effectively is already in common use.",0,,,86,science
4p1xr6,4,This is a really interesting discussion; could you point me towards somewhere I can read more in-depth about modern farming techniques?,0,,,3,science
4p1xr6,5,"It's tough to summarize an entire network of interconnected industries in a single place, but...  
[Conservation Practices from MN Dept. of Ag](http://www.mda.state.mn.us/protecting/conservation/practices.aspx)  
[Prescription lime & fertilizer](http://www.aces.edu/pubs/docs/A/ANR-1362/ANR-1362.pdf)  
[Compaction](http://store.extension.iastate.edu/Product/Understanding-and-Managing-Soil-Compaction-Resource-Conservation-Practices-PDF)",0,,,5,science
4p1xr6,6,"Thanks!  Yeah, I just had never really thought about all the considerations that go into modern farming, and I'd like to explore it a bit more.",0,,,4,science
4p1xr6,3,"Eh.  Farmers used to plow, which ruined topsoil.  Now they largely no-till.  Topsoil has been improving for 40 years.  We're literally at a point where most agricultural land, at least my region, is at its most productive, best managed state in American history.",0,,,12,science
4p1xr6,3,[removed],0,,,14,science
4p1xr6,4,[removed],0,,,18,science
4p1xr6,5,[removed],0,,,8,science
4p1xr6,6,[removed],0,,,2,science
4p1xr6,7,[removed],0,,,2,science
4p1xr6,3,[deleted],0,,,6,science
4p1xr6,4,[removed],0,,,2,science
4p1xr6,4,sadly by then it will be too late.,0,,,6,science
4p1xr6,5,[deleted],0,,,5,science
4p1xr6,2,"Care to elaborate? Or is this just some doomsday babble? 

edit: The way the parent comment is worded sounds oddly prophetic, which made me wonder whether it was true, and to what end.",0,,,-1,science
4p1xr6,3,"Atmospheric warming causes more frequent extreme weather events, and both flooding and drought are very bad for soil quality. Drought creates dustbowl conditions while flooding causes soil erosion.",0,,,34,science
4p1xr6,4,Thanks for the explanation.  ,0,,,2,science
4p1xr6,3,"Doomsday babble? It's a common issue, even before climate change, and is only made worse now with it. Erosion ruins crop lands, the water sources they use, and the local environment. ",0,,,17,science
4p1xr6,3,"It pretty common estimate for what climate change will cause. Basically there will be longer periods of drought with heavy rainfalls in between. So the yearly rainfall might not decrease, it could even increase, but it will rain less often with more rainfall each time. This is not good for farming, that usually requires more even rainfall trhoughout the growing season.",0,,,6,science
4p1xr6,3,"Some middle eastern countries are experimenting with nanomachines in the soil, and to grow stuff in the desert. Also, skyscraper farming will also probably be a thing soon. It's supposedly a hell of a lot more efficient than standard ground farming.",0,,,3,science
4p1xr6,4,"> Also, skyscraper farming will also probably be a thing soon. It's supposedly a hell of a lot more efficient than standard ground farming.

It's just extremely expensive. We can't feed seven billion people from that. ",0,,,7,science
4p1xr6,1,"We unfortunately understand very little about the biological regulation of plant water use efficiency. We know that hormones like ABA are really important for it, but most of it is still very unclear. Even if we wanted to do, for example, genetic engineering to improve water use efficiency or drought tolerance, we wouldn't really know where to begin. We need to start devoting way more of our research infrastructure to plant sciences, and not so much to things like terminal cancer. I'm saying that having researched both.",0,,,5,science
4p1xr6,2,"I was with you!

and then this.

> terminal cancer

whaat?

",0,,,1,science
4p1xr6,3,"eh. Not OP, not agreeing, but basically, ""do you want to produce food, or keep old peoples alive ?"" ",0,,,4,science
4p1xr6,2,"Wouldn't you think that evolution has way more experience with drought than you can ever hope to figure out, meaning that conventional hybridization techniques should be much more promising than GM for things like drought tolerance?",0,,,1,science
4p1xr6,2,"Do we really need to understand drought tolerance? Can't we just farm different varieties the old fashion way until a good one comes, then use that as a baseline for creating a new GM variety? ",0,,,1,science
4p1xr6,1,What about the indoor farming like they are doing in China? ,0,,,7,science
4p1xr6,2,"It remains to be seen if it works on a large scale, and it only works for particular crops. 

I highly doubt growing corn indoors will ever be worth it.",0,,,6,science
4p1xr6,2,"http://data.worldbank.org/indicator/AG.LND.AGRI.K2

So divide those areas by 20 to account for improved yield.  For just the US, we go from 4 million square km to 200 billion square meters.  The largest building the US is under 400,000 square meters, so we would need 500,000 of those.  Let's say an extremely low $10 per square meter, so $2 trillion dollars just in construction costs.  For that amount of money we could install **over 25 times the  wind turbines needed to power the US** at $73.6 per MWh and 4,000 TWh per year

Edit: I am being very conservative at $10 per meter, it's likely higher, and using existing wind turbine levelized costs, which would actually be less at this scale.

Edit: banana for scale http://c1cleantechnicacom.wpengine.netdna-cdn.com/files/2014/09/Tesla-Gigafactory-How-Big-620x350.png building on the left, Everett assembly footprint, is 400,000 square meters. Cost of the gigafactory structure is over $1billion, with floor space of apx 1 million square meters, $1000 per square meter, 100x my cost.",0,,,4,science
4p1xr6,2,"I'm pretty sure it's Japan, not China, that is leading the way on indoor farming. But anyway, not everything grows well indoors. A lot of the indoor farming has focused on lettuces and leafy greens. I don't think anyone has grown staple crops like corn and rice indoors yet.",0,,,2,science
4p1xr6,3,Here in the netherlands there is a lot of indoor farming as well in greenhouses but they are only used for peppers and other high value crops,0,,,3,science
4p1xr6,3,"There were successful-within-the-parameters experiments in the 70s with wheat and some other grains in field-sized greenhousoids, but haven't heard from since.",0,,,2,science
4p1xr6,2,"While a potential solution, those facilities have their own problems.  My major concern with them is it's a very large investment.  A large building needs to be constructed with people well trained in its operation.  Something that would be very difficult in an impoverished African village that can't even clean their own water.",0,,,2,science
4p1xr6,3,"We need to be less gentle. It's a damn stupid idea. It would be over ten times cheaper to convert the electrical grid to wind and battery storage with electrical vehicles.  Which would be enough to cut emissions roughly in half, and actually start to slightly lower CO2 levels.",0,,,3,science
4p1xr6,2,"Yes, isn't this supposed to be significantly more efficient than traditional agriculture?",0,,,4,science
4p1xr6,3,"The term is usually called vertical farming. It uses about 30% of the water, but you have to pay for lighting and HVAC. That said, you can place it right next to or even inside a store. HEB is going to try this out in the Dallas market pretty soon.

Some of the benefits:  

* crop yields every 3 weeks (2 of you boost the CO2, but that may be risky for humans)
* Fresher and riper crops, no shipping costs
* Less spillage because the plants can be growing until the customer picks them.
* No pesticides if placed in a sealed container.",0,,,8,science
4p1xr6,4,"Now we just need 200 billion square meters of it, about 100,000 Boeing assembly buildings worth, the largest structure in the US.  And that would be equivilant to the 4 million square km of US farmland.

It would cost a lot less to not add the CO2 to begin wIth

Banana for scale http://c1cleantechnicacom.wpengine.netdna-cdn.com/files/2014/09/Tesla-Gigafactory-How-Big-620x350.png

**Energy Requirements for Liighting**

200 billion square meters at 200 watts per square meter, for eight hours per day

200e9 m^2 * 200Wm^-2 * 8h * 365 days = 

**116,800 TWh per year**

That is **28 times** the current electric energy generated in the US



Contast this with the energy cost of enough solar to cover 25 percent of US roofs, about 40 percent of generation, reducing US CO2 emissions by 30 percent.  The one time  energy of producing the solar panels and electronics that go on 25 percent of rooftops is about 3,000 TWh. Assuming a short twenty year life that is **150TWh per year**

Edits: include energy requirements",0,,,5,science
4p1xr6,2,"Indoor farming is the future.

I've seen some *incredibly* impressive patents and technologies in that sector currently unreleased to the general public that will be world-changing.",0,,,1,science
4p1xr6,1,[removed],0,,,5,science
4p1xr6,1,"You'd be surprised though how much better current varieties are with drought than the ones a decade ago.  
We need better though",0,,,1,science
4p1xr6,1,"> better yielding

Here's my concern about that. It always comes down to money. Farms are so very necessary, like obviously and utterly necessary. So why is a monoculture of max-yield for profit even allowed over a variety of long-term healthy, sustainable farming practices?

Not at all criticizing your particular setup, but questioning the ""socioeconomics / sociopolitics"" of farming as a whole.",0,,,1,science
4p1xr6,1, i think a big concern here could be the temperature. when it's above 95 degrees corn silks and desiccate and make pollen not viable ruining pollination. that's as big of a concern to me as lower yields because of inconsistent rainfall. ,0,,,1,science
4p1xr6,2,"Agreed, I don't know how many people commenting have grown their own food, or worked on a farm. Yields are very low with months of extended daytime temperatures above 100F.  If I mention  the temperature dependent response of photosynthesis, the benefits of  vs. C4 plants, or Calvin-Benson, RuBisCO and people look at me like I'm from Mars.",0,,,1,science
