post_id,level,body,gilded,likes,num_reports,score,subreddit
4p1xr6,1,"Yep, and getting any decent yield with low water conditions is almost an impossibility.",0,,,1,science
4p1xr6,1,">I've lived on a farm my entire life 

Then may I ask something?

I wonder, did the price of fertilizer go down since a few years back to 2008-9?

And do you think farmers will need to rely on the use of even more fertilizers because of these farming conditions?",0,,,1,science
4p1xr6,2,"Not the commenter, but fertilizer prices have seen a small reduction https://marketrealist.imgix.net/uploads/2015/09/1-Fertilizer-Prices-2015-09-02.jpg?w=660&fit=max&auto=format

Most fertilizer uses natural gas for feedstock.  The fact that it has not dropped the same amount as natural gas has some cause, but I don't know what it is.  Relatively cheap  natural gas will likely last for at least a decade, but that's not guaranteed.

In the coming decades water will be a bigger issue.  Non irrigated crops depend on fairly regular rainfall, weeks without rain can have a large impact on yield.",0,,,1,science
4p1xr6,1,"I am very worried about drought as well.  I live in Idaho, which has gigantic rivers, but you go a mile away from the river, and poof - it's basically desert as far as human food is concerned.  And irrigation has side effects as well - you pull clean water out of an aquifer, the aquifer will eventually dry up.  You pull it out of the river, that ecosystem changes, and nobody downstream gets water.  Plus, once the water has gone through a farm, it's not really clean water anymore - it has fertilizer and pesticides in it, and the ground is collecting that stuff year after year.  ""Poisoned fields: A contributor to collapse    Along with factors such as war and changes in the environment, scientists now believe irrigation techniques played an important role in Mashkan-shapir's collapse. The same process that allowed farming in this region also eventually made it impossible to farm. Irrigation has a Catch-22: if irrigation water is allowed to sit on the fields and evaporate, it leaves behind mineral salts; if attempts are made to drain off irrigation water and it flows through the soil too quickly, erosion becomes a problem. Scientists believe that Mashkan-shapir's collapse was caused in part by destruction of the fields by mineral salts. When mineral salts concentrate in the upper levels of the soil, it becomes poisonous for plants. ""  http://www.learner.org/interactives/collapse/mesopotamia.html  They say the same thing is happening to San Joaquin - http://vric.ucdavis.edu/virtual_tour/sanjoq.htm.",0,,,1,science
4p1xr6,0,[paper](http://www.nature.com/articles/nclimate3061.epdf?referrer_access_token=eMorniuFlBi9nEjrN5TY-NRgN0jAjWel9jnR3ZoTv0NnhzgXX4Bs7cYbxfafPUhgVKoExslYfIKwkfQW-sadtc0PIsfajeTpuBHj4Bd2Br2aO1DmIraEWGymVUAunD783X3rnbqr_qoPl34JFltQVIsVdet6zpQEucXk5l06YTpQWRJ6B8EQQba0RKvOF7AF&tracking_referrer=www.bbc.com),0,,,76,science
4p1xr6,0,"Forgive me if this is a silly question, but, uhh, there are warmer and colder parts of the world, right? So can't we just take the crops we grow in the warmer parts and grow them in the colder parts?",0,,,118,science
4p1xr6,1,"This isn't a silly question at all.  Part of the problem with current crop science is that we have devoted a large portion of time and effort to creating hybrid crops with large yields under very specific conditions.  You alter these conditions by a small fraction and you have crop failure or low yields, or the weather doesn't co-operate.
Moving them from warmer areas they can no longer survive in to areas that were once cool can yield a crop, but often there are other problems, like weather, to contend with.  Weather patterns in cooler climates, as they warm, can become erratic. What would work best is to take existing non-related hybrids (from seed banks) and interbreed them with what we have to create better suited varieties.  Still, this takes many, many years. In the interim, we may be able to prevent food shortages by using varieties from the past that were grown to struggle through harsh conditions and produce.  The only problem with this being that such varieties often do not have the yields of our current super crops, because they have not been so closely line-bred/genetically modified in a lab.

It's a bit of a complex issue, I hope this helped explain.",0,,,135,science
4p1xr6,2,"Ah, so it's a combination of growing conditions being far more complicated than simply ""average temperature"", and over-fitting to very specific growing conditions. 

Like, places like San Francisco have both warmer winters and colder summers than places like Austin. Heating up both places doesn't help crops from one work in the other, since tolerating the cold in the winter is kind of a separate thing than tolerating heat in the summer.",0,,,32,science
4p1xr6,3,"In a word, yes. Crops can grow in areas they were not field tested for, but funny things happen. (For instance, my family's farm grows brassica (kale-type) greens from Guatemala.  We are far from Guatemala in both temp and longitude.  However these greens grow amazingly well. But we have a shorter growing season and even with the last five abnormally hot years, the greens 'bolt' (go to seed) much faster than their southern counterparts.  And this is with 80-90F days, an ideal range for this crop.  The nights are still cooler, there is probably less rain and humidity, and the sunlight is not the same, so these are likely influencing factors.)  We also have an Ethiopian eggplant variety that loves it here in the high tunnels, who would have guessed?

Speaking of sunlight, the further north or far south you get, light levels change.  Some crops (certain types of onions, melons, and corn) are light (day length) sensitive, and require periods of darkness that northern locations may not be able to create without artificial means.  The more one delves into this, the more you realize just how amazing it is that anything grows in places it was never bred to live under, and why crops engineered for specific conditions suffer.  ",0,,,24,science
4p1xr6,4,There are these amazingly adaptable plants... and then there are sensitive ones that will die twice if they can. ,0,,,8,science
4p1xr6,5,"Once saw a documentary in which a guy took standard strawberries to the Alps. Quite a lot died, but some survived and produced seed. Which he put in more cooperative soil at more cooperative altitudes close by (that is, at the foot of the Alps)

They grew like a motherfucker. What they speculated is that the harsh conditions the parents grew up in triggered epigenetics in the children that made them very, very, good at actually using the nutrients they are given.",0,,,5,science
4p1xr6,2,Day length can also be an issue. Here in south of Finland we have basically 22 hours of somekinda sunlight. Even if it gets warmer here some plants and varieties cant either grow or produce flowers with such long days.,0,,,4,science
4p1xr6,2,"/u/PM_ME_YOUR_PRIORS, There's also the infrastructure.  

The breadbowl of America has a hundred years of infrastructure set up, from planting to watering to harvesting.  Some of it (like vehicular machinery) is easy to move while others (like silos and underground water piping) is less so.  It takes money and time to prepare the now-warmer areas to be agriculture-ready.  That delay could mean food shortages.

And there's also a problem of soil conditions.  Perhaps where it's now-warmer the soil is sandy, or clay, and not suitable for the crops we'd like to move there.",0,,,3,science
4p1xr6,2,"Slight tangent, but this reminds me of a study I read about like 15-20 years ago. Some lab decided to try to ""evolve"" a better computer circuit. They would make a bunch of computer circuits, with slight randomized changes to each one, and then measure performance and then copy the best ones and make a bunch more random small changes.

Apparently the circuit they ended up with they couldn't understand how it worked. It had random wires connected to nothing and different grounds and all sorts of goofy things. But the biggest issue was they found when they built the circuits again, they didn't work. At all.

They ended up figuring out that the circuits were highly specialized to the single location they had been evolved in. That part of the lab had certain other electrical fields nearby and even things like the air-conditioning nearby affected it.",0,,,3,science
4p1xr6,2,">  large yields under very specific conditions. 

That makes sense. Thanks. So we need new plants for new environments. Or older varieties which are adapted to a broader range of climate, but have lower yields.",0,,,2,science
4p1xr6,3,"Yes.  Older varieties are not inherently bad for their lower yields either, and some yield quite well and would do even better under modern fertilizing methods.  They are just lacking in *intensive* breeding, because often selection criteria for their survival, throughout the years, has been dependent on farmers saving seed and planting what survived (there are literally hundreds of area-specific corn varieties, all looking as different as you can [imagine](http://www.seedweneed.com/index-1.html)).  Farmers, then, were selecting for traits and producing better plants, but their methods were not as focused as a team of ag scientists growing acres of corn and specifically locking in only a small handful of traits.  Farmers of the past could never compete with modern crop scientists for speed, nor did they select for things like ""ship-ability"", which can influence flavor. This is why many people don't have a problem with GMO crops, because you are merely speeding up what nature(and crop scientists)* would have done...something we may find ourselves required to do as the Earth changes.

As for needing new plants for new environments, China comes to mind.  They are working on getting their citizens to eat [potatoes](http://www.usatoday.com/story/news/world/2016/02/10/forget-rice-and-noodles-china-looks-potatoes-new-staple/80050200/).  Very specifically, their newly-bred variety [Cooperation-88](http://www.rtb.cgiar.org/blog/2016/01/14/assessing-impact-cooperation-88-potatoes-china/), a pretty amazing little potato with an interesting history.

But if we want to feed ourselves, we have to remember the huge issue of [waste](http://www.nationalgeographic.com/magazine/2016/03/global-food-waste-statistics/) too.  It's not just about breeding new plants or using old genetics, we need to stop being so choosy about what that carrot looks like, because a forked carrot tastes just as good as a straight one, and way better than none at all.",0,,,2,science
4p1xr6,2,"I imagine there's also soil issues with moving to previously cold areas, in regards to composition, acidity and available nutrients (?)",0,,,1,science
4p1xr6,3,"Acid and alkaline soils can influence crop growth (or death), as can soil composition. As an example, tomatoes need an acidic soil to avoid things like blossom end rot, but it should not be too acidic.  Farmers amend their tomato fields with lime, or Epsom Salts can work for home gardens (helps with nutrient uptake), in overly acidic areas to balance ph. In the north the soil tends to be naturally more alkaline (cooler soils are).  The warming of the soil in the summer raises the acidity, but it's still poor soil when most plants like a little more of an acidic environment. Would global warming make it more acidic?  Yes, but it would probably still be lacking.

Some areas of the north have silt-based soils (basically very tiny pieces of stone all ground up, and not much in the way of loamy, crop-growing, earth).  These soils must then be fertilized either chemically or organically.  This isn't too terribly different than what is already done in the mid-continent U.S. to grow vast amounts of corn and soybeans without crop rotation, so if the infrastructure was in place this could be less of a problem.  At current, the further north or south you get, the more you must rely on artificial means to ensure proper compost break down, if going the organic route.  Even with warm air the soil is frigid, and areas with permafrost start to show up with frequency the further you go.  Now, in the event of a global warming trend this would become less of a problem, but it still might present small issues with yield.

This is just an overarching explanation, there are small microclimate areas, and coastal soils are different, but generally, even with warming, you would have poor soil in many places.

Edit:  was tired, needed to fix my alkaline/acid soil description a bit.  Sorry about that.",0,,,2,science
4p1xr6,4,"Thanks, that's the sort of issues I was thinking of!",0,,,2,science
4p1xr6,2,"No the issue is certain areas should not be doing agriculture in a global type market but are trying to. California and Brazil for example.

There are some very fertile areas on the planet, we do not need to convert desert or rain forest for it.....",0,,,1,science
4p1xr6,1,"One of the biggest problems is not necessarily ""Warmer"" or ""Colder"". While that is a factor, one of the major issues is extreme temperature swings which can wreck havoc on a plants signaling hormones. You get a cold snap in the middle or end of April? Maybe your buds freeze off your fruit trees. Maybe you accidentally vernalize some perennials and they start growing erratically.

There's also an issue of sunlight recieved. Many of the plants are photoperiod sensitive and are somewhat resistant to being moved further north or south.

Then there's more complicating environmental factors like soil type, precipitation, and agricultural infrastructure availability. Even things like transportation matter.

To put it more simply, in the form of a metaphor, Plant breeders have been operating with a weak flashlight in a house with no lights. But they've been in the house long enough to figure out where things are generally and where things go. What climate change does is move everyone to a completely new house. Now you've got to figure out where everything goes again.",0,,,18,science
4p1xr6,2,"Haha, I like your metaphor. That's quite an apt description of what we in the agricultural field are facing.",0,,,1,science
4p1xr6,1,"Moving north isn't really as big of a problem as the extreme weather events that are becoming the new normal. Moving north won't help your warm weather plants if one side of the continent is experiencing a megadrought and the other is underwater. And then things like El Nino dump a fucking ton of water on California, more than the dry ground has the capacity to deal with, and the water it needs so badly ends up causing its own natural disaster. ",0,,,9,science
4p1xr6,1,"No. 

First of all, property rights and population distribution. Second, just because a colder area becomes warmer, doesn't mean the soil or precipitation are amenable to agriculture. Those are the biggest of a long list of problems. ",0,,,9,science
4p1xr6,2,"Yeah... it takes soil decades to centuries to grow a centimeter. A poor soil will not suddenly become great because it's warmer. Sure, you can fertilize it and correct some of its problems, but that will be expensive.",0,,,2,science
4p1xr6,1,I am actually studying this right now: Yes soms areas of the world will increase production while others will decrease. Problems; the developing countries will see most of the decreases (Hot climates getting hotter). On top of this the net production change will be a significant decrease.,0,,,3,science
4p1xr6,1,"Day Length can be a big issue. Some crops rely on day length to control flowering, so that's why we can't move some crops like soybeans latitudinally around. 

Also there is this general effect called genotype by environment interaction (GxE). A ton of factors can contribute to varieties performing differently in different locations, even from one county to the next in say Illinois or Iowa where they have great agricultural land.  ",0,,,2,science
4p1xr6,1,Well no. I don't think countries in the colder areas would want other countries growing crops that they won't even eat on their land. ,0,,,4,science
4p1xr6,1,"And what do you do with the warmer parts that just got warmer?

And what do you do when the colder parts that got warm, get even warmer?",0,,,3,science
4p1xr6,2,">And what do you do with the warmer parts that just got warmer?

Presumably, grow crops that are customary to even warmer areas. The very warmest places may no longer have good agricultural options. On the flip side, places that were just too cold to be worth growing food on are now warmer.

>And what do you do when the colder parts that got warm, get even warmer?

Move yet more agriculture away from the equator?

Like, don't get me wrong, it is a problem and it's awkward and expensive to fix. It just seems solvable at first glance by fairly simple application of money and moving where you grow which crops.",0,,,3,science
4p1xr6,3,"There are hard limits on photosynthesis, above leaf temperatures of 45C productivity goes way down.  The temperature may be below 35, but the surface of leaves can be considerably warmer.  This of course is much worse in dry soils.",0,,,2,science
4p1xr6,1,[removed],0,,,2,science
4p1xr6,1,We can. As long as we write off the people who are currently living on a single bag of rice a week in the warmer areas as dead on their feet. Which it looks like a lot of people are eager to. ,0,,,2,science
4p1xr6,1,"Each variety is adapted to local conditions. That means that the further it is from those conditions, the higher the risk that it will produce less somehow. This is also why GMOs aren't going to fix the problem. ",0,,,1,science
4p1xr6,1,"There aren't warmer parts of the world than the tropics. The place that is getting hosed is Africa, which is the warmest part of the world (or at least, one of them).

Also, there are a lot of other factors which go into optimizing crop yields. It isn't just about temperature, it is also about rainfall frequency, pests, and other things.",0,,,1,science
4p1xr6,1,That delicious Alaskan pineapple!,0,,,1,science
4p1xr6,0,[removed],0,,,180,science
4p1xr6,1,I don't think those conflating Monsanto's evil business practices with GMO tech are the ones in charge of globally significant agricultural policy-making or practices.  ,0,,,74,science
4p1xr6,2,[removed],0,,,50,science
4p1xr6,3,[removed],0,,,19,science
4p1xr6,3,[removed],0,,,18,science
4p1xr6,4,[deleted],0,,,12,science
4p1xr6,5,[removed],0,,,3,science
4p1xr6,5,[removed],0,,,2,science
4p1xr6,4,[removed],0,,,3,science
4p1xr6,3,[removed],0,,,3,science
4p1xr6,2,I heard a really good podcast from a Monsanto scientist. The amount of money and work gone into creating those new strains is absolutely incredible. A lot of it is still done via natural selection with vast crops and crazy modern techniques. Like they'll even go as far as plant a crop of one type of plant then cut them all at the base after a year then reattach another plant on that root system,0,,,15,science
4p1xr6,3,That's just grafting on a large scale.  Grafting has been around for centuries.,0,,,11,science
4p1xr6,4,"I know what grafting is. But that's just one aspect of them doing their work. For instance say they want to get a gene which will allow for a plant to strive in extreme temperatures. Well it obviously can't live with its current root base so they'll get a plant with a root base which will allow for that planet to survive in the desert while they let it evolve until they can isolate a possible functioning gene. 

The splicing is only a small part. ",0,,,5,science
4p1xr6,2,They sort of are.  They can threaten their elected officals that are in charge of policy making/practices.  After all their votes count just as much as the others.,0,,,15,science
4p1xr6,3,[removed],0,,,9,science
4p1xr6,4,[removed],0,,,4,science
4p1xr6,5,[removed],0,,,6,science
4p1xr6,6,[removed],0,,,3,science
4p1xr6,3,[removed],0,,,5,science
4p1xr6,1,"You can think about GMO whatever you like but neither is the world currently starving because of a lack of GMOs nor would it alleviate the situation significantly. We are already producing enough food to feed ten billion people. In the US alone 31% of eatable food gets thrown away. Even third world countries are wasting high amounts of food because they lack the means to correctly store and transport food (proper trucks and cooling systems). This isn't just food you throw away but also high amounts of fuel, electricity, pesticides, fertilizers and water that are needed to produce it. Just producing more food is like filling more gas into a leaky tank.

A high number of GMO plants are also not used for consumption but for biofuel which wouldn't help alleviating hunger.

One of the reasons for global famines are civil wars, terrorism and displacements. GMOs won't change anything about that.",0,,,18,science
4p1xr6,1,[deleted],0,,,2,science
4p1xr6,2,">Testing and seed distribution are two of the three rate limiting factors

Testing is currently limited by the amount of financial market return. Every plant breeding program has a budget set by what the average return would be. The problem is that food has been unusually cheap since 2012, and many of the companies have shareholders to answer to. If there was a bigger push for the expansion of public breeding programs like ICARDA, IRRI, and CIMMYT, with research programs independent of current food prices, but more focused on long term, steady, and reliable budgeting, it could go a long way towards long term selection.

> GM makes testing more complex and it doesn't help with seed distribution (and would make it worse in those cases where new seed crop needs to be purchased annually).

A homozygous GM trait would not need to be repurchased anually, only relicensed. A hybrid should not be replanted though. While many hybrids have GM traits, they're not the same thing.

",0,,,4,science
4p1xr6,2,"GM does have a useful role. If there's a virus threatening a crop, GMOs are a well established silver bullet. There are also a large number of other problems that can potentially be solved by genetic engineering. The current GMO crops have also reduced the amount of pesticide used and the fuel for farm equipment to spray. Testing new GM crops is only more complex because the system has made it so. For your last point, seed for pretty much every crop needs to be purchased annually; because of seed patents that exist on non-GM crops, hybrid vigor, consistent seed germination rates, and seed treatments with beneficial bacteria/fungi and/or pesticides.",0,,,4,science
4p1xr6,0,"It seems to me in ten years time, suddenly a lot more people won't have problems with GMO crops.",0,,,10,science
4p1xr6,1,"There are 41 million people food insecure in southern Africa, 21 million of whom need emergency assistance... and governments are still not allowing GMO crops into the country.",0,,,9,science
4p1xr6,0,[removed],0,,,10,science
4p1xr6,1,[removed],0,,,6,science
4p1xr6,2,[removed],0,,,5,science
4p1xr6,3,[removed],0,,,2,science
4p1xr6,0,It doesn't help that countries ban the technology that allows us to breed high yielding drought resistant crops. ,0,,,27,science
4p1xr6,0,"People will get concerned about climate change only after the negative consequences have started happening, and not before. Climate change has never happened in human history, so it doesn't feel real to a lot of people.

I'm certain that no action to prevent climate change will ever be taken based on warnings. It will be taken, but only after several years of experiencing the harmful effects.

**Edit:** The last Ice Age happened during human prehistory, not human history.",0,,,54,science
4p1xr6,1,"Actually, climate change happens all the time. The Mideval Warm Period was a thing, and there's a reason why the Norse colonized Greenland, then left it.

Egypt is another example; it used to not be a gigantic desert in very ancient times, but around the start of recorded history it started to become one away from the Nile. Mesopotamia also struggled with it. One theory for the collapse of the Mayan civilization is climate change.

The Dust Bowl is another example of climate change - areas had had abnormally wet weather for a while. When the climate reverted to the mean, it caused a massive agricultural disaster in the US.

The reality is that climate change has happened a lot throughout history, and it has been pretty disruptive at times.

Some of it has even been man-made. Some civilizations dealt with it.

Others, like the Easter Islanders, totally collapsed after they caused too much environmental damage.

The main difference today is that humans are actually aware of what we're doing.",0,,,37,science
4p1xr6,2,"Unfortunately none of it makes the industrial man-made climate change happening now feel real.

Let me paraphrase - if there are crop failures and famines that cause a billion people to die, and half the cities on earth are flooded, and if human civilization recovers eventually, they will care about climate change in a way that we do not. They would not doubt that it can happen. There will be stories and folklore, sunken cities to prove it happened.

Like people know about the Plague even now. Everyone is afraid of epidemics because everyone has heard of the Black Death. People do care about epidemics-prevention. They freak out from Ebola in a way they don't from Climate Change. 

For whatever reason, it seems that all the examples we have now are not enough to convince everyone.
",0,,,19,science
4p1xr6,3,[removed],0,,,5,science
4p1xr6,2,"The Middle Ages also featured a ""little ice age"" in Europe that led to low crop outputs and famine",0,,,2,science
4p1xr6,2,"Those climate change events seem really, really trivial in comparison.",0,,,1,science
4p1xr6,1,Not true. Climate change is very relevant in history from Mayan to Mesopotamian civilizations. ,0,,,2,science
