post_id,level,body,gilded,likes,num_reports,score,subreddit
4p1xr6,1,"> Climate change has never happened in human history

Ummm

http://en.wikipedia.org/wiki/Last_glacial_period

The last glacial period, popularly known as the Ice Age, was the most recent glacial period within the Quaternary glaciation occurring during the last 100,000 years of the Pleistocene, from approximately 110,000 to 12,000 years ago > ",0,,,2,science
4p1xr6,2,"Which is, by definition, prehistoric...",0,,,11,science
4p1xr6,2,"That was prehistory, not history.",0,,,6,science
4p1xr6,0,[removed],0,,,8,science
4p1xr6,0,Couldn't we just grow crops further north?,0,,,7,science
4p1xr6,1,"Some places yes, and move crops to some degree. I've seen maps of areas having improved farming due to climate change. However many farming intense areas are heading towards drought or extreme weather fluctuations. Soils and infrastructure takes time to built too, which might take a generation to establish. ",0,,,4,science
4p1xr6,1,"Shorter days and seasons. Plants need light like food... imagine it as a nutrient deficiency. Crops from places with a wealth of light are adapted to consume it. We can help change some of those adaptations for some crops, but it's a small degree of progress that takes time. ",0,,,6,science
4p1xr6,0,[removed],0,,,3,science
4p1xr6,1,[removed],0,,,4,science
4p1xr6,0,[removed],0,,,3,science
4p1xr6,0,How do GMOs factor into this?,0,,,3,science
4p1xr6,1,"Well,  they'll taken hardy varieties and reproduce them together to.get hardier varieties. Take the best of a crop exposed to harsh environments and the survivors get to reproduced etc.

Generally this is the type of GMO hippies protest against",0,,,3,science
4p1xr6,0,[removed],0,,,21,science
4p1xr6,1,[removed],0,,,13,science
4p1xr6,2,[removed],0,,,10,science
4p1xr6,3,[removed],0,,,7,science
4p1xr6,1,[removed],0,,,12,science
4p1xr6,0,"Well, first stop using massive amounts of farmland for meat production. I eat meat every day almost, but it is what it is, no point in wallowing in luxury when half the world is starving.",0,,,16,science
4p1xr6,1,[deleted],0,,,9,science
4p1xr6,2,[removed],0,,,1,science
4p1xr6,2,"I recently had the opportunity to take in a lecture by Dr. Jennifer Clapp (FAO, University of Waterloo), ""Navigating the global food fight: Trade, Food Security, and the Battle for Policy Space.""  She makes some very interesting arguments about whether trade is the best way to guarantee food security for all. I really don't belive that North American farmland can be the breadbasket for the entire world - communities need local food systems. So in that respect, I think we would be amiss to think that removing livestock from land in first world countries would or should result in growing grain, cereals, or pulses to feed malnourised jurisdictions. One of my favourite efforts is that of Bill Gates who demonstrates the powerful role livestock (specifically chickens) can have not only in providing nutrients, but also in the economic and social development of a population. Check out ""Why I would Raise Chickens"" on gatesnotes.com .",0,,,1,science
4p1xr6,2,"Yes really ( u/turtletotem ) if say all of the USD & Canada suddenly went vegan overnight, the beef ranches and fodder farms wouldn't switch to human-edible grains and beans, they'd go out of business.",0,,,1,science
4p1xr6,1,[deleted],0,,,7,science
4p1xr6,2,Mushrooms could replace a lot of the meat I eat I guess.,0,,,7,science
4p1xr6,3,"There's very simple combinations that provide all the nutrients you need. Middle Easterns had pita and hummus. Indians had rice and lentils. Mesoamericans had tortilla and beans. Every culture has had a carb/protein combo that was a rounded out staple. They cover every necedsary carb and protein type. You could do that plus some veggie dish, some meat every now and then, and fruit for desert.",0,,,3,science
4p1xr6,1,"If you know that eating meat is contributing to global warming, why don't you stop? I stopped a few months ago, and it was surprisingly easy. Just check out the veggie section of the supermarket, and pick stuff at random. You can find a whole bunch of replacements that taste just as good! I haven't cut out meat entirely from my diet, but I eat it only once or twice a week, not 14 times a week.

:)",0,,,7,science
4p1xr6,1,Food distribution causes hunger not scarcity so feel free to keep enjoying,0,,,2,science
4p1xr6,2,Not when the available farm land is collapsing it aint.,0,,,0,science
4p1xr6,1,"Not every farmland is suitable for high yielding crops, rangelands cover up to 27% of terrestrial surface (Ellis and Ramankutty, 2008). Sustainable methods of farming allow us to use these ressources for human food production (meat, secondary uses like milk/wool/work and fertilizer).
So it's not about the used space or meat production itself (at least only from the environmental perspective), rather how we do it and where we need to improve there.",0,,,1,science
4p1xr6,1,"In my area, we grow a decent amount of food by not choosing between meat and vegetables. Crop rotation with hayfields and grazing pastures provide us with excellent growing soil. The trick is, to make a diverse-crop farm work, you need to be willing to have a diverse diet, which... is actually healthier for you anyways.

Plus the synthesis of plant and animal into the farm life provides pest control and other benefits.

We'd need more people doing it. But the system is one that can be copied almost anywhere, if it'll work around here... we have a short growing season and very rocky soil.",0,,,1,science
4p1xr6,1,"This is a huge problem in China, absolutely massive.  Want to know why the rainforest is dying?  Because China wants to eat cows.",0,,,1,science
4p1xr6,0,"Well, how feasible is it that we ditch our old agriculture from the land methods and start building hydroponic high rises? Aren't they supposed to be much more efficient anyway? I'm sure it wouldn't work for all crops, but I thought that places were having success with that.",0,,,7,science
4p1xr6,1,"Not very. Plants are better than any solar cells we have at converting sunlight into energy. If we built hydroponic highrises we would have to provide energy to make the light, and we would do it by inefficient solar or other more polluting methods of electricity generation. In the end it's always cheaper and better for the environment to grow plants in a field. The only exception is that luxury produce in large cities can be grown competitively in hydroponic highrises and provided to that limited city market.",0,,,2,science
4p1xr6,1,"Build them out in very open areas. Surrounded by black asphalt with low height glass panels over top. All of it slightly slanted upwards towards the building, where the heated air is funnelled into the centre of the building, and passes by turbines to power the building.

[Like this](http://www.global-greenhouse-warming.com/wp-content/uploads/2012/07/SolarTowerDiagram.jpg?57ba6f)",0,,,4,science
4p1xr6,2,[removed],0,,,17,science
4p1xr6,3,And certainly not at the prices necessary. Everybody forgets the economics of scale.,0,,,7,science
4p1xr6,4,[removed],0,,,5,science
4p1xr6,5,"My favorite is a local aquaponics system that was started with a multi-million dollar ""Sustainability"" grant. Since they had the capital already, they put local horticulturists out of business by offering cheap food. Then they failed a few years after, essentially destroying an entire local food community.",0,,,6,science
4p1xr6,2,"Black asphalt isn't good for keeping air cool though, it's directly associated with higher temperature. It might accidentally make the local area muggier and hotter as a result.

But what if you use light gray?

""Using light-colored concrete has proven effective in reflecting up to 50% more light than asphalt and reducing ambient temperature.[63] A low albedo value, characteristic of black asphalt, absorbs a large percentage of solar heat creating warmer near-surface temperatures. Paving with light-colored concrete, in addition to replacing asphalt with light-colored concrete, communities may be able to lower average temperatures.[68] However, research into the interaction between reflective pavements and buildings has found that, unless the nearby buildings are fitted with reflective glass, solar radiation reflected off light-colored pavements can increase building temperatures, increasing air conditioning demands.[69][70]""
[Urban heat island](https://en.wikipedia.org/wiki/Urban_heat_island)",0,,,3,science
4p1xr6,1,"I doubt you could grow a lot of staple crops like that. But if you try, aim for potatoes. Vegetables and herbs are nice, but you need calories.",0,,,2,science
4p1xr6,1,"Not feasible yet, requires too much energy, would use too much space. It os OK for legumes, but not for grains.",0,,,1,science
4p1xr6,0,[deleted],0,,,2,science
4p1xr6,1,"It's also hard for primates to digest unless it's treated, see grits and tortillas",0,,,1,science
4p1xr6,0,[removed],0,,,4,science
4p1xr6,1,"The point is that eventually there isn't going to be a meaningful ""south"".",0,,,1,science
4p1xr6,2,At that point we will need good tasting cactus because there is only so far you can push a high yield crop like corn. ,0,,,1,science
4p1xr6,1,"I know.  Overall, the variety of crops you can grow only increases as the average temperature goes up.  ",0,,,1,science
4p1xr6,0,[removed],0,,,2,science
4p1xr6,0,"Does this mean we'll all be able to grow coffee, pineapples, guavas, and papayas?  If so, I think that's a fair trade off.",0,,,3,science
4p1xr6,0,[removed],0,,,4,science
4p1xr6,1,[removed],0,,,7,science
4p1xr6,2,[removed],0,,,1,science
4p1xr6,0,[deleted],0,,,3,science
4p1xr6,1,Really? I can't think of any examples where something was as much of a threat to human civilization as climate change that we successfully solved.,0,,,1,science
4p1xr6,1,So twenty years ago?  The effects from today's CO2 will be in forty years,0,,,1,science
4p1xr6,2,[deleted],0,,,1,science
4p1xr6,0,"And then the population will swell to 9 billion, then 12 billion...

The world is screwed one way or another.",0,,,3,science
4p1xr6,1,[deleted],0,,,10,science
4p1xr6,2,"Food insecurity seems to ironically be a motivation for large families.  If you have five kids, at least one of them may keep you from becoming malnourished in your old age.  ",0,,,5,science
4p1xr6,1,"Not really. Populations in developed regions have stabilized.

TBH, I don't think mass starvation is going to be that big of a problem.",0,,,7,science
4p1xr6,1,[deleted],0,,,8,science
4p1xr6,1,"It's probably going to peak at 9 billion. 

But that's still 50% more than what we had in 2000, and 1/3 of that when the Green Revolution kicked in in the 60s.",0,,,4,science
4p1xr6,1,"That is probably incorrect. The UN population estimates suggest a peak of ~11 billion people in 2100, but there are other estimates out there. The IIASA [estimates](http://blog.iiasa.ac.at/2014/09/23/9-billion-or-11-billion-the-research-behind-new-population-projections/) a peak population of ~9.4 billion in 2070, followed by a decline.",0,,,1,science
4p1xr6,1,"9 billion is projected to be the peak, then a decline ",0,,,1,science
4p1xr6,0,all the strains of corn in the world won't help humans when we polute the earth for another 50 years at the rate we currently are,0,,,2,science
4p1xr6,1,And all the solar power in the world won't help when people are starving. There are no silver bullets. This is one of many tools that can help.,0,,,6,science
4p1xr6,2,Exactly. We have many problems and need all the solutions we can get. This is a multi-pronged approach. ,0,,,1,science
4p1xr6,2,">And all the solar power in the world won't help

If we had near zero emissions from power generation and transportation then CO2 levels would start dropping.",0,,,1,science
4p1xr6,1,"That's what it takes for humans to learn their mistakes. It's going to be tragic, but necessary ",0,,,1,science
4p1xr6,0,"I don't understand crops or farming at all, which is sad for a lifelong Nebraska resident.

Why do we even need to grow crops outdoors in this day and age? I really figured we'd have indoor urban farming working pretty well by this point.

Also, what is up with this big stink about GMOs? Aren't all crops genetically modified to begin with? The fruits and vegetables we buy at the store hardly resemble the same plants that existed before human intervention. Why is altering genetics so bad when we have been doing it for more than 10,000 years?  We can just do it quicker and with better scientific understanding of the plant. I understand that diversity is important in genetics, so don't we just need to account for that when modifying the plant's RNA? 

I'd like to understand this issue better so that I can formulate an informed decision on how I feel about this issue.",0,,,3,science
4p1xr6,1,">Why do we even need to grow crops outdoors in this day and age? I really figured we'd have indoor urban farming working pretty well by this point.

You want to replace 600,000 square miles of cropland[^1](http://www.ers.usda.gov/data-products/major-land-uses.aspx) with hydroponics?",0,,,23,science
4p1xr6,1,"Plants are really good at converting sunlight into energy, way better than any solar tech we currently have. If you're growing indoors you need to provide them light and a large portion of that is going to come from fossil fuels or be really inefficiently converted solar back to light then to the plants. Basically a huge waste for no reason when there is perfectly good farmland that naturally gets sun.",0,,,6,science
4p1xr6,2,"I thought photosynthesis had a solar energy efficiency of 3-6%, which is several times lower than our current consumer grade solar panels.",0,,,1,science
4p1xr6,3,not really a fair comparison since we can't eat electricity. but it really doesn't matter it's still a huge waste to convert light -> electricity -> light again before getting to the plants.,0,,,6,science
4p1xr6,2,You can use mirrors to redirect light to indoor systems. That wouldn't really be a concern.,0,,,1,science
4p1xr6,1,Factory farms in warehouses with multiple levels taking advantage of space is definitely a thing in Japan. However how do you afford the power and water? ,0,,,3,science
4p1xr6,2,"Well the water usage drastically drops with hydro/aquaponics. You still need a supply yes, but current agricultural water needs are probably a huge factor in our current climate predicament. As for power, the biggest factor being lighting, it depends on what you're growing and how you build your facility (greenhouse, sky lights, solid warehouse roof). There's also many innovations in the ""green"" and self sustaining movements that are allowing for better energy efficiency.

When this study was released, they said something like 11x the yields, 12x less water, 80x more power. I think we're getting to the point with alternate energies and efficient design and construction that this will soon be a very viable option for mass scale food production. http://www.ncbi.nlm.nih.gov/pmc/articles/PMC4483736/",0,,,3,science
4p1xr6,1,I'll take this opportunity to plug /r/UrbanAgriculture.,0,,,1,science
4p1xr6,1,"Artificial lighting is a huge energy cost. Growing all US foods indoors would require over 80 times current electric power generation of the US, and that's just the lighting",0,,,1,science
4p1xr6,0,[paper](http://www.nature.com/articles/nclimate3061.epdf?referrer_access_token=eMorniuFlBi9nEjrN5TY-NRgN0jAjWel9jnR3ZoTv0NnhzgXX4Bs7cYbxfafPUhgVKoExslYfIKwkfQW-sadtc0PIsfajeTpuBHj4Bd2Br2aO1DmIraEWGymVUAunD783X3rnbqr_qoPl34JFltQVIsVdet6zpQEucXk5l06YTpQWRJ6B8EQQba0RKvOF7AF&tracking_referrer=www.bbc.com),0,,,1,science
4p1xr6,0,[removed],0,,,1,science
4p1xr6,0,"This was a big topic of discussion when I was in grad school about 7 years ago.  The world is pretty much dependent on a small handful of core crops (corn for example).  If global temperatures changed just enough to disrupt production of any one of those crops, there would be major disturbances in our global food supply chain.",0,,,1,science
4p1xr6,0,[removed],0,,,1,science
4p1xr6,0,"Plants lose water during CO2 respiration. There is more CO2 in the air (280 ppm -> 400 ppm). Plants will either use the increase in CO2 to a) shut down respiration to conserve water, b) use faster photosynthetic rates to grow faster, or c) funnel the increased C to reproduction. 

Can breeders develop strains of maize that do a) instead of b) or c)? I know it's harder than it sounds, but in my research it looks like grasses prefer b) or c) right now, while trees adapt a). ",0,,,1,science
4p1xr6,1,"Even if that was possible, shutting down respiration would affect yield. The number one priority for breeders is yield since no one is gonna buy the new variety if it doesn't yield well regardless if it's water efficient. Thus there is no incentive to develop the variety in the first place.",0,,,1,science
4p1xr6,1,"Sure, how's photosynthesis working with no respiration?  It doesn't of course, leaf temperature climbs quickly and production stops.  So yield goes down.  Corn already shuts down, hence the blue color.  It can recover if it's only a couple of weeks, but crop yield is reduced ",0,,,1,science
4p1xr6,0,[paper](http://www.nature.com/articles/nclimate3061.epdf?referrer_access_token=eMorniuFlBi9nEjrN5TY-NRgN0jAjWel9jnR3ZoTv0NnhzgXX4Bs7cYbxfafPUhgVKoExslYfIKwkfQW-sadtc0PIsfajeTpuBHj4Bd2Br2aO1DmIraEWGymVUAunD783X3rnbqr_qoPl34JFltQVIsVdet6zpQEucXk5l06YTpQWRJ6B8EQQba0RKvOF7AF&amp;tracking_referrer=www.bbc.com),0,,,1,science
4p1xr6,0,"Have we looked into grains that do well in a dry climate? I feel like we blow our gaskets trying to find something new when something usually exists but we don't want to introduce it into the market. 

I've heard certain types of millet do well in dry hot climates.  That being said my knowledge on the subject isn't very extensive and of love feedback. ",0,,,1,science
4p1xr6,1,"Rice cannot be grown in dry climates yet is continually consumed around the world because it's so engrained in their cultures. Changing a staple crop for a country is easier said than done sadly. Thats partly why research is so focused on the major grain crops.
Im studying this topic at the moment and I think the best solution is looking for wild relatives of the wheat/rice/maize and introgressing useful stress related genes to  implement into the elite varieties. However this is also easier said than done. 
This is just a glimpse of some of the research going on in this field.",0,,,1,science
4p1xr6,0,Will the increased concentration of CO2 improve yield at all?,0,,,1,science
4p1xr6,0,"Why can't you just take current corn and continue to grow it in the great plains region, but move production farther into Canada?",0,,,1,science
4p1xr6,0,"You should check out seed hunter, http://www.abc.net.au/tv/documentaries/interactive/futuremakers/ep3/

it's a documentary about looking for wild strains of chick peas to combat  climate change.  really interesting. ",0,,,1,science
4p1xr6,0,Plant breeding grad student here.  AMA!,0,,,1,science
4p1xr6,0,Yeah a great way of doing this is [genetically modifying ](http://12.000.scripts.mit.edu/mission2017/genetically-modified-crops/)  plants to be able to use less water or sunlight or grow in a different climate. But then people make a big deal about gmo's.,0,,,1,science
4p1xr6,0,Resurrection plants are under research at the University of Cape Town and Australian universities to hopefully create crops that can dry to <10% water and revive once watered.,0,,,1,science
4p1xr6,0,"http://www.usda.gov/oce/commodity/wasde/latest.pdf
Global stocks have been rising and will continue to rise. It's just a matter of if it can keep up with population increase. 
",0,,,1,science
4p1xr6,0,"Serious question, but why don't farms simply become more profitable in the north? Can wheat and corn be a profitable future for Canada, Russia and Greenland? ",0,,,1,science
4p1xr6,0,Climate Change is 100% caused by human over population. Want to help the environment? Don't make kids. ,0,,,1,science
4p1xr6,1,"The NASA regression analysis that I saw for CO2 and climate change was a lot more convincing than your argument that it's due to population. However, I am willing to bet there's a correlation between population growth and CO2 emissions for obvious reasons.",0,,,1,science
4p1xr6,0,A solution would be to grow crops indoors using multiple stacking levels maybe,0,,,1,science
4p1xr6,0,[removed],0,,,1,science
4p1xr6,0,Hey everyone! So I'll be graduating in the Spring from San Diego with a degree in biochemistry. Does anyone know of any companies in my area working on this problem? I'd love to get involved.,0,,,1,science
4p1xr6,0,[removed],0,,,1,science
4p1xr6,1,It's generally the only way to feed the humanity in the future. ,0,,,3,science
4p1xr6,2,[deleted],0,,,1,science
4p1xr6,0,"Crops are fine, problem will be water (either not enough or too much).  That's why we need to move farming indoors.",0,,,1,science
4p1xr6,0,Sometimes I really debate just moving to the middle of nowhere and becoming a survivalist and stockpiling food thanks to stories like this. ,0,,,1,science
4p1xr6,0,[removed],0,,,1,science
4p1xr6,1,They promise not to restrict the quantity to a level that brings in optimal profits.,0,,,1,science
4p1xr6,0,[removed],0,,,1,science
4p1xr6,0,Maybe we need to combat the problem instead of the symptoms. ,0,,,1,science
4p1xr6,0,"Or we could look at reducing the global temperature.

One way to start would be to look at reducing the number of airplane flights. It was noted after 9/11 that there was a significant drop in global temperature and likley attributed to the grounding of airplanes. Whilst I don't suggest the total grounding maybe a reduction would be a start!",0,,,1,science
4p1xr6,0,"Most the people who are suffering from these climate shifts are not capable of spending the minimum money for these seeds to be developed, tested, and marketed. That pretty much means that in the coming decades they will all be migrating to Europe, Russia, the US.",0,,,1,science
