post_id,level,body,gilded,likes,num_reports,score,subreddit
5a5qta,6,Nope. Not a direct manipulation of yield. Try again.,0,,,5,science
5a5qta,7,"In that case I'm not really sure what ""direct manipulation of yield"" means or why it matters.",0,,,0,science
5a5qta,8,"The original argument was that GM plants have not offered improvements in yield. I would like to see examples where a direct genetic modification in a widely used crop targets a biological response in yield. I don't see any examples, therefore the original argument that the journalist is exploring is not real. He made up an argument to have with himself to discredit GM technology. Can you follow that?",0,,,3,science
5a5qta,9,"No, because the main purpose of these gene modifications is to increase yield. ",0,,,1,science
5a5qta,6,"BT corn improves pest resistance. It doesn't improve yield. If there aren't any pests that year, BT corn yields equally to non BT corn, assuming the only difference is presence of the BT gene. That's what they mean by improving yield directly.",0,,,0,science
5a5qta,7,"Yea I know what he's getting at, my point is that every genetic modification that increases yields does so only under the right environmental conditions.",0,,,1,science
5a5qta,8,"In plant breeding there is considered a difference between traits that increase yield potential and traits that protect yield potential. Insect and disease resistance protect yield potential instead of increasing it. If you put the battery gene in a variety with low yield potential, it doesn't make it yield more, it just protects yield from being reduced if there are a lot of insects. A trait that produces more ears of corn or makes each ear bigger directly increases yield. [Source](https://www.soybeanresearchdata.com/Project.aspx?id=7102) [Source](https://gmoanswers.com/ask/why-do-you-claim-gm-crops-will-improve-crop-yields-when-truth-long-term-affect-much-lower-crop)",0,,,1,science
5a5qta,1,Why are dissenters a bad thing? Can poor ol Monsanto not handle some public criticism?,0,,,1,science
5a5qta,1,GM crops are wildly successful in the sense that they are in widespread use and have made certain people very rich and nobody is really preventing them from improving; certainly not a bunch of shouting hippies on the internet or new york times readers. Folks can and do vote with their wallets and buy organic but other than that Monsanto et all still get the lions share of the market and have carte blanche to develop whatever GM crops they want.,0,,,-3,science
5a5qta,0,"People who get in the way of GMO progress are a HUGE contributor to the lack of progress of GMOs.  So stop propagating information like this and mind your own business.  You may be thinking, ""But being critical is a part of being scientific"".  Too true, too true, but why don't you look up how well studied the safety of GMOs are, then start doing your questioning.  You'll find they're much safer than other food crops *especially* organic.",0,,,-3,science
5a5qta,1,[removed],0,,,-8,science
5a5qta,2,[removed],0,,,-9,science
5a5qta,0,"I'm not really concerned about crop yields of GMO plants in regions with a lot of arable land, such as Canada and USA. I'm concerned with the crop yields of GMO plants on lands that are otherwise not considered arable. And I'm concerned with the success of GMO trees in areas under serious threat of desertification or coastal erosion (where tree lines can reverse such trends).",0,,,1,science
5a5qta,0,"I think it's true that the folks who were originally trying to convince people that we should explore the application of GM technology explicitly promised that we would see higher yield and lower pesticide use.  The problem is that most of these folks were not the actual scientists doing the work.  We keep seeing these studies presenting it as an important news item that GM technology has failed to produce increases in yield.  While that is true, if you look at the traits that have successfully made it through field testing and into the hands of actual farmers, none of them (with the exception of a drought tolerance trait Monsanto has out) is designed to increase yield.  

So, giant news item, all this work to produce traits that were not intended to increase yield ---- has failed to increase yield.  The scientists who made these things could have told you that in advance.
",0,,,1,science
5a5qta,0,"Finally a GMO post that makes sense and doesn't ignore real science. I am so tired of people repeating ""GMOs have higher yields, GMOs use fewer pesticides"", completely sold on biotechnology propaganda while totally unaware they've been duped and totally unacquainted with the science involved. Thank you for posting this. ",0,,,-8,science
5a5qta,0,[deleted],0,,,-2,science
5a5qta,1,Please tell me about potatoes.,0,,,5,science
5a5qta,0,[removed],0,,,-2,science
5a5qta,0,Thank you for this post. The green revolution was accomplished by putting countries like India into massive debt by getting them to take loans from the IMF and World Bank to buy modern farming equipment.,0,,,-6,science
5a5qta,0,"This ""smells like"" conservation of energy and thermodynamics in action.  Just saying expecting shortcuts to give you miracles is seldom justified by the laws of physics.",0,,,-4,science
5a5qta,0,[removed],0,,,-14,science
