post_id,level,body,gilded,likes,num_reports,score,subreddit
5a5qta,0,"These graphs are bit ridiculous. Pesticide use in the France was measured in thousands of metric tonnes of active ingredient. For the U.S., it was million pounds of what we can only assume is final product (edit: it's actually pounds active). Why would anyone report yields in hectograms per hectare? Can someone explain to me what the scale on the last graph is supposed to mean? 

Furthermore, growing conditions in both continents never received a single mention; GxE is *the* buzzword in plant breeding right now and the biggest factor in ""E"" is climate. No mention of no-till (for which there is a known yield lag at best, and decrease at worst), which is [hardly used in Europe](http://www.fao.org/ag/ca/CA-publications/China_IJABE.pdf). No mention of the various pesticides allowed in North America but banned in the EU, the timing of which I suspect would line up with several of France's usage decreases. ",0,,,299,science
5a5qta,1,"On hectograms per hectare, that's the measurement we always use for scientific publications. In the US, bushels/acre means more to farmers, but you have an added variable of seed weight. You could have the same bushels/acre but have 25 lbs of a really big but light seed, and 50 lbs and a tiny but dense seeds. When you calculate true yield, you want the total weight produced, not bushels.",0,,,62,science
5a5qta,2,"Makes sense w.r.t. bushels, good point! Not a common unit in scientific writing anyway unless it's a US publication. I don't think I've ever come across hectograms in any of my reading though. Kilograms or tonnes are the unit of choice since that's what farmers (anywhere but Canada and the US at least) use and is what we can realistically measure with large equipment. ",0,,,5,science
5a5qta,3,"True, I don't see hectograms that often, but I don't consider a big deal as hectograms and kilograms are used for measuring weight in metric.",0,,,7,science
5a5qta,3,Wouldn't you also need to include moisture content?,0,,,1,science
5a5qta,4,"Moisture content is relatively uniform for commodity crops. For example, yellow corn number 2 is traded at 14% maximum moisture if I recall correctly. Don't pay attention enough to the markets to give you a better answer. ",0,,,2,science
5a5qta,1,"Also, in my area at least, GMO efforts are currently being researched and hopefully implemented to resist a foreign disease that we have little to no defense against. All else is pointless until this issue is resolved or the crop's industry will literally go extinct. Gotta pull yours pants up before you buckle your belt. ",0,,,17,science
5a5qta,2,Bananas?,0,,,14,science
5a5qta,3,"If you don't know the context, this seems like the most random and ridiculous reply. I had a chuckle. ",0,,,12,science
5a5qta,4,Maybe he is just a minion,0,,,6,science
5a5qta,1,"Furthermore, judging success by quantity of pesticide used is a bit disingenuous. A significant goal of genetic engineering has been to create crops resistant to a particular type of pesticide so that it can be used widely without damaging yields. We shouldn't expect such work to result in lower overall pesticide use.",0,,,20,science
5a5qta,2,"To be specific, Monsanto wanted plants to be resistant against Monsanto's RoundUp.",0,,,8,science
5a5qta,3,"Brought to you by Monsanto®.

""Monsanto. Whether you want it or not.™""",0,,,12,science
5a5qta,3,"I'm no fan of Monsanto, for lots of reasons, but it's hard to blame them for engineering a plant to be resistant to their particular pesticide. Obviously their goal is to make money.",0,,,4,science
5a5qta,4,"Yes, that's my position as well. The law is to blame if a product can be sold but does not comply to ethical understandings (generally spoken).",0,,,2,science
5a5qta,2,But one of the main arguments for GMO crops is that it's going to decrease the use of pesticides.,0,,,6,science
5a5qta,2,Shouldn't 'widely used without damaging crops' necessarily increase yield? Or taste? Or something?,0,,,1,science
5a5qta,1,"Yeah, the axes are a bit strange and make comparing across charts difficult. I'm not sure why they used the units they did - if I had to guess, probably because that's how the units were reported in the different reports on which the charts were based.

I think the story they are trying to tell lies in the trendline, though - and that comparison wouldn't be confounded by the unit choices.

Why wouldn't someone report crop yield as hectogram per hectare?",0,,,16,science
5a5qta,2,"The units should reflect the precision of the machines we use to measure yield, whether that's a yield monitor or the scale at an elevator. A hectogram difference across an entire hectare is just noise. I realize you can just convert the units, but to me making a conscious decision to use non-standard and unrealistic units says something about the intent of the article and the author's understanding of agriculture. Combined with a few other comments, like bringing up the Nazis and Agent Orange, this story feels like more of a hit piece against GMOs than an accurate summary of the pros and cons. 

I did some more reading into the [source USGS data](https://pubs.usgs.gov/ds/0907/pdf/ds907.pdf) for the American trendlines and it looks like it is in fact measured in pounds of active ingredient, so you are right that the units don't make a difference. My concern was that if the source data was based on retail sales, then the low concentration of AI in some products (read: glyphosate herbicides) would skew the data. ~~I can't find the host for the raw data referenced in the link above but~~  (edit: linked it in a reply to another comment) Converting everything to the same units would have been easy for the NYT to do, and once again this was a conscious decision on behalf of the editor. ",0,,,36,science
5a5qta,2,"Uhhhh, unit choice manipulation is practically standard operating procedure for confirming your own bias.",0,,,6,science
5a5qta,3,But they didn't manipulate anything. And the units chosen don't have a material impact on how you interpret the results.,0,,,-3,science
5a5qta,4,"The units do matter. Read this: http://weedcontrolfreaks.com/2016/10/the-tiresome-discussion-of-initial-gmo-expectations/

I would argue that not taking the time to apply some basic scientific rigor and overlook something as important as units of measure while cherry picking individual countries to confirm your bias is dangerous and irresponsible.",0,,,43,science
5a5qta,5,"/end thread. I don't think anyone here can provide a better rebuttal than that. I was about to attempt my own re-creation of his first graph. If you look at the USGS data, everything is actually in kg so if the NYT had to convert units anyway, why would they convert to pounds? ",0,,,10,science
5a5qta,4,You are correct. Also it is doubtful the group researching this used just those two graphs to work it out.,0,,,1,science
5a5qta,2,usually in day to day operations people use tones/HA at least in Europe for main crops. ,0,,,1,science
5a5qta,1,"Reading it this morning, i assumed that they controlled for growing conditions because it would be laughable if they didn't (essentially a giant batch effect). Guess it really is that laughable. ",0,,,4,science
5a5qta,1,"Thanks for bringing this up. The data is presented very strangely here. 

 Could you explain what you mean by GxE? I come from a genetics background and I'm unfamiliar with plant breeding buzzwords",0,,,1,science
5a5qta,2,"Genotype by environment interaction. Simply, in one environment a gene has x effect, but in another environment that same gene has y effect. That's a 10,000 ft view and it is much more complicated, but generally that's the idea.",0,,,11,science
5a5qta,3,Ok that is what I assumed but thank you for clarifying,0,,,2,science
5a5qta,1,"not to mention that some GMOs don't limit the use of pesticides / herbicides, they just make the plant to to be immune to them while everything else is not...",0,,,1,science
5a5qta,1,"Yeah this seems biased - I know that per acre yields of corn have trended up rather impressively over the last few dacades, but I would also say that as growth in use of pesticides and herbicides we have witnessed a following trend line of neurological diseases in the US from infants to adults - we are hurting ourselves with our food supply.",0,,,-5,science
5a5qta,2,Show it.,0,,,7,science
5a5qta,2,lul,0,,,2,science
5a5qta,0,[removed],0,,,6,science
5a5qta,1,"Kniss is great. This needs to be at the top of this thread, it does a great job of refuting the NYTimes article.",0,,,3,science
5a5qta,0,"This article fails to mention developing countries where the benefits of gmos are shown the most. Places like India and China where bt cotton has increased yields drastically since 2002. In fact some estimates show India's cotton yields increased 2 fold.  
  
Also while it may be true that chemical usage hasn't gone down ,which I'm skeptical about at best, the chemicals used have changed to ones that are safer.  
For example we have shifted from chemicals that can reside in the soil for lengthy periods, don't easily breakdown, or ones that leach into the ground water to now using mostly chemicals like glysophate which breaks down easily, is a broad spectrum, and doesn't leach as easily.   
By broad spectrum I mean that one chemical can kill multiple types of weeds or pests. So instead of in the past how you'd have to spray 2 or 3 chemicals you now use 1. ",0,,,97,science
5a5qta,1,Proof that it increased yield? ,0,,,8,science
5a5qta,2,"[graph](http://ras.org.in/articles/97/images/fig1.jpg)

[(source)](http://ras.org.in/cotton_cultivation_in_india_since_the_green_revolution#fig1)

Pretty dramatic really. ",0,,,19,science
5a5qta,1,"Almost every sector of agriculture, G.E. or not has made the same shift away from environmentally persistent chemicals. Precision application of pesticides is now a well researched subject and is implemented by most modern farms.",0,,,2,science
5a5qta,1,"Why do you think GM technology has improved crop yields in India and China, but not in the US?",0,,,3,science
5a5qta,2,"American farmers make 100x more than Indian farmers, but pesticides don't cost 100x more in the US. Per Google, the average American farmer makes $61k.  The average Indian makes $600. 

There are chemicals available to fix pretty much every agricultural problem. The decision to apply them is a business decision. Assume a caterpillar infestation that will half your yield if you don't treat.  Treatment costs $500.  The Indian farmer expecting $600 for his crop is better off letting caterpillars eat half the crop, the American farmer expecting $61k for his crop is better off applying treatment.  You would expect Indian farmers to start with much lower yields.

GM crops help guarantee yields.  US farmers were already using chemicals to guarantee yields so I wouldn't expect much improvement in that department.",0,,,51,science
5a5qta,3,"So you're saying that in India they don't use insecticides because they cost more then the crop is worth ?  But if they use GMO seeds which are resistant to roundup, now they can spend the money ? And that's why yields are up ?  I don't follow your logic, maybe I missed something. ",0,,,1,science
5a5qta,4,"Not all gm crops are round up ready. Some are toxic to specific types of insects, or better suited to certain environments.",0,,,3,science
5a5qta,4,"> But if they use GMO seeds which are resistant to roundup, now they can spend the money

That's not the main GMO introduced in India. Their big advancement is Bt cotton, which dramatically reduces the need for insecticides.",0,,,1,science
5a5qta,5,"Until resistance developed and white flys opportunisticly stepped in.
http://news.agropages.com/News/NewsDetail---19805.htm",0,,,1,science
5a5qta,2,[deleted],0,,,59,science
5a5qta,3,"Not to mention the original focus was on survival, not yielding significant bounties. By making the crop more resilient you have a larger yield, because you lost less crops. You only reap what you sew though. If there aren't many new farmers, and the same crop size is planted, you'll yield roughly the same as last year. In the developing world you get new farmers and larger crops so the numbers keep climbing.",0,,,15,science
5a5qta,2,"Mainly because most GM traits are yield protecting traits, not yield increasing traits. That's why the yield no increase argument is such a misunderstanding of agronomy at best (and a complete strawman at worst). If you're already protecting near 100% of your potential yield, you can't increase your actual yield much higher. In the US, we already utilize methods that protect the yield from weeds, insects, etc. The gain for growers here is that the previous methods were often more costly, labor intensive, higher ecological impact, etc.

If you go to India and China, you're more likely to have areas where people are losing yield without protection measures in place. That's why actual yield gains are expected in such areas for traits like Bt.",0,,,24,science
5a5qta,3,"So if the us has near 100% protection already, then you're saying GMO products that key in protective traits are pretty much worthless in the US ?  Is that your stance ?",0,,,-1,science
5a5qta,4,"Why in the world would anyone think that? I already explained why farmers opt for these methods compared to all the other issues with previous control tactics. Pleas reread my post.

Edit: Just to further illustrate how different it is, let's say you want to get a couple pounds of flour for a bunch of baking that needs to be done. Over a 100 years ago in some farming areas of the U.S., that would mean walking (or riding a horse if you were lucky) 10, 20, or even 40 miles away from your home to a general store while making at a day trip out of it. To get that same amount of flour now, I need to only hop in my car and drive only a few miles away in just a few minutes to get it.

If this line of questioning were going to continue, you would hypothetically be asking why I'd bother driving to get my flour when I could just walk all day to where that general store was / still is and get the same amount of flour there. I hope you see how absurd that would be.",0,,,5,science
5a5qta,2,My guess is that part of it is public opinion. Go to the grocery store and see how much products tout when they are 'gmo free'. People are afraid of them because they don't understand them and I'd wager that their resistance towards genetic engineering makes the development process harder and more expensive and restricts the potential market for gm products.,0,,,8,science
5a5qta,3,"The worst part about the ""Non-GMO"" movement is that there are only about 9 gmo crops in the US. 

For example you might see banana labeled as ""non-GMO"" when in reality there aren't any GMO bananas in any grocery store. 

",0,,,28,science
5a5qta,4,"Well sure. And chicken gets labeled growth-hormone free like it's some big deal when it's in fact *illegal to sell any poultry with growth-hormones*. 

Food marketers are always trying to distinguish goods that are essentially commodities even if there's nothing special about them.",0,,,24,science
5a5qta,4,"For the lazy:  
The most prevalent gmo crops in the USA are corn, soybeans, and cotton. Others that are much less common are potatoes, papaya, squash, canola, alfalfa, apple, and sugarbeets.  
[Source](http://time.com/3840073/gmo-food-charts/)",0,,,5,science
5a5qta,4,"Unless you consider artifical selection a form of genetic modification, then there is almost no such thing as a gmo free crop",0,,,6,science
5a5qta,5,Genetic modification refers specifically to the alteration of an organism's genome using biotechnology.,0,,,3,science
5a5qta,6,Explain how genomic selection occurs without the use of biotechnology.,0,,,4,science
5a5qta,3,"I understand gmo technology and I'm still afraid of certain aspects of them. But every time I say that people jump all over it and get pissed off, which I still don't understand. Why can't we question the safety of our food supply being changed in fundamental ways? It's not even the genetic modification itself that makes me question its safety, I do believe the studies that say it is not causing direct problems, but the use of these poisons that the modifications allow is what scares me. I get that there are potential benefits in a lot of situations especially in developing countries, but if we are seeing problems with super weeds, a lack of biodiversity, poisons in our food supply, and not necessarily a rise in yield, it's something we need to strongly consider (and allow for consumers to make the decisions themselves). ",0,,,1,science
5a5qta,4,"Because none of these issues is about GMOs. Monoculture, pesticide use and resistances happen equally to conventionally enhanced crops, as well as ""organic"" farming. There are no large-scale farms that don't use chemicals or that plant multiple crops in the same field at the same time.  

Because singling out GMO crops, compared to crops enhanced via chemical and radiation mutagenesis is similar to only wanting a house held together by manually tightened screws, because you distrust the possibilities that electric screwdrivers allow.  ",0,,,9,science
5a5qta,5,[deleted],0,,,3,science
5a5qta,6,"Yeah, but why doesn't that apply to new seed varieties made by other methods?",0,,,6,science
5a5qta,7,It still does to a lesser extent. Private control over the food supply and market-driven destructive farming practices are bad in general. GMOs just amplify the potential problems and make it much easier for private parties to justify stricter control over the bedrock of human civilization. Remove the profit motive and align research towards fulfilling human needs sustainably and GMOs aren't all that bad.,0,,,1,science
5a5qta,5,There's one small concern I have for GMOs. There's a certain chemical in one food that causes people with a latex allergy to react. The chemical that causes the reaction is also an antifungal. If seeds are made that have this built in resistance they could cause a reaction. I think that this is probably something that wouldn't happen but don't know enough.,0,,,0,science
5a5qta,6,"Thats actually the first legitimate, concrete concern I've ever heard about gmos. But I'd like to point out we could just use it and label it. We also use gluten and phenylalanine product, despite people having strong reactions to those.",0,,,1,science
5a5qta,7,I'm basically against labeling (I'm in GMOLOL) but this is the only one tiny itty bitty situation that makes me question it. ,0,,,1,science
5a5qta,8,"Well, I'm not against labelling allergens, that's a good thing. I'm against labelled fake ""allergens"" though.",0,,,1,science
5a5qta,4,"On Reddit, there is a dedicated group of 'GMO cheerleaders' who act as a group. If your comment ends up linked in one of their subs then they will zero in on you.

Your concerns are valid and aspects of them are most certainly specific to G.E. agriculture. For instance, conventional farmers used Bt insecticide for nearly a hundred years with little to no resistance, while it took less than a decade for widespread resistance after being introduced as a transgenic.",0,,,1,science
5a5qta,3,"I'm not personally not ""afraid"" of GMOs, I'm against monoculture, patenting life and the monopoly control of food by huge corporations. There's plenty of harm in that side of GMOs which never gets mentioned when you people call critics ignorant or anti-science. You people are just as guilty of ingorance because you assume it's about being anti science. I'm against cluster bombs and chemical warfare and I bet you are too. Does that make you or I anti science? No. 

Stop saying people who are anti-gmo are anti science as if there are no other reasons to be anti gmo. It's not very scientific.",0,,,-1,science
5a5qta,4,"Your criticisms against GMOs are applicable to pretty much all of agriculture throughout the developed world, but I rarely see them leveled against conventional crops. ",0,,,14,science
5a5qta,5,"No they are not\*, there was/is no patent and monopoly control on non-GMO seeds. The fact that farmers have to pay royalties on every crop is an innovation brought by the GMOs.

\* Actually you are right for one of them, the ""monoculture"" argument is applicable to non GMO.",0,,,1,science
5a5qta,6,"There decidedly is patent protection on non-GMO seeds, and has been for 30 years: https://www.uspto.gov/web/offices/pac/mpep/s2105.html

Additionally, nearly all tree crops are reproduced through vegetative propagation and are covered by the Plant Patent Act of 1930.

Prior to the introduction of GM corn, more than 95% of corn grown in the US came from F1 hybrid seeds, and farmers were contractually bound to pay on every crop (and the seeds wouldn't breed true, so couldn't be saved to produce new crops).

There are lots of sleazy practices in agricultural commerce, but they aren't unique to GMO crops by any means.",0,,,1,science
5a5qta,5,"Conventional crops are not patented.
There is plenty of opposition to mega agribusiness if you look for it but as usual, they have very little funding to get their message out as compared to agribusiness's multi billion dollar PR budgets.",0,,,-6,science
5a5qta,6,"Direct patents of plant species have been around since 1930, well before GMO crops existed.  Crop-specific patents have been around since the 1800s.  Not that I'm arguing in **favor** of plant patents or the like, just that it's criticism equally applicable to pretty much all crops (and even more so for monoculture farming) which aren't really a talking point outside of GMOs.

Abundance of nutritious food is an important step toward advancing the quality of human life, and GMOs are a fantastic tool to that end, particularly if they can be decoupled from mega-corporations.

A particularly pernicious example of the anti-science and mindless opposition to GMOs is the reactionary struggle against golden rice, which has no profit motive and can improve the health of millions of people.  Being against GMO crops purely on the basis of genetic modification *is* anti-science.",0,,,10,science
5a5qta,7,The argument against golden rice is that the malnourished people who need the beta carotene lack the dietary fats to facilitate its absorption.,0,,,1,science
5a5qta,7,[removed],0,,,0,science
5a5qta,8,"Way to dodge the actual point by getting offended. For the record, once all your arguments have been shown to be false, continued resistance is at least unfounded, and at worst a mindless knee jerk reaction.  

And so far, you're showing all the signs of someone who never even considered that all his arguments against GMOs are actually arguments against modern farming.  ",0,,,1,science
5a5qta,7,"Well the study in the article is saying that GMOs haven't produced higher yields or reduced insecticides, so what exactly are GMOs doing for us ?",0,,,-1,science
5a5qta,8,"There is no study in the article, it's just an article. Based on many many peer reviewed studies, herbicide use is more of a mixed bag, but pesticide use is definitely reduced with bt crops. Yields are decidedly improved in places outside of developed countries with established industrial agriculture.  

Genetic engineering isn't a magic bullet, but it is an extremely useful tool. It has the potential to be literally lifesaving in the case of golden rice, or it can save an industry, like Hawaiian papaya, or it can produce overhyped flops, like the Flavr Savr tomato. So while it isn't miraculous, it does have real, proven benefits.

Now if you want to say that agricultural patents are ludicrous, and that big ag companies are villainous, I'm right there with you.  But those criticisms aren't in any way exclusive to GMOs.",0,,,3,science
5a5qta,2,"A few factors:

Many farms have converted to the no till or low till during this time period. Lower costs allow for lower yields while improving profitability. High fuel costs are a major driver of this. 

Expanded acreage is on marginal ground. New farming methods are allowing marginal ground that previously wouldn't have been viable to farmed. Yields are low, but it works out financially. 

Lower cost from pest control in the US drives the pricing model towards marginal ground further. In developing countries, GMO wasn't a lower cost pest control, it was the introduction of pest control. 

It's the difference between a finely tuned machine and a basic machine. A race engine may only benefit 0.02% in horsepower from a given technology, but save a lot of fuel, where a basic engine may see a 30% boost in horsepower from the same addition. ",0,,,1,science
5a5qta,1,[removed],0,,,2,science
5a5qta,2,[removed],0,,,3,science
5a5qta,2,[deleted],0,,,0,science
5a5qta,3,"Glyphosate disrupts the shikimate pathway in plants, which in turn kills them.  The bacteria in the human GI tract also have the shikimate pathway.",0,,,0,science
5a5qta,4,[citation needed],0,,,1,science
5a5qta,4,Do you have a source for this?,0,,,1,science
5a5qta,5,"It's as simple as going to the [wikipedia page] (https://en.wikipedia.org/wiki/Shikimate_pathway) and reading the first sentence..

[This article] (http://www.glyphosate.eu/glyphosate-mechanism-action) describes glyphosate's method of herbicidal action.  Look at the second paragraph.",0,,,1,science
5a5qta,0,"> has not accelerated increases in crop yields

I'll take highly misleading titles for 500, Alex.

Crop yields are under no obligation to continually increase, and implying that they are is ridiculous. If yields are continuing to increase *because* of gmo's then that statement paints actual gmo efficacy as a failure.",0,,,89,science
5a5qta,1,This is what happens when a journalist tries to misinform the public about science. ,0,,,26,science
