post_id,level,body,gilded,likes,num_reports,score,subreddit
5a5qta,1,"> If yields are continuing to increase because of gmo's then that statement paints actual gmo efficacy as a failure.


What science are you basing that off of?",0,,,3,science
5a5qta,2,"I would guess because GMO's tend not to change, so if the yield is increasing (year over year, using the same organism) then that implies the GMO is not responsible for the increase in yield, and something else is influencing yield, ie climate, sunlight, etc.",0,,,17,science
5a5qta,0,"I wonder what would have happened if, after the first bacterial infection that wasn't cured by penicillin, we said ""Whoops! So much for this *antibiotic* idea. It just didn't work out."" ",1,,,126,science
5a5qta,1,"To be fair, the technology we are talking about is over 40years old at this point - glyphosphate, for example, was brought to market in the early 1970s. So I'm not sure your penicillin analogy really works.",0,,,15,science
5a5qta,2,glyphosphate isnt a GMO,0,,,40,science
5a5qta,3,"Good point, but glyphosphate resistant plants have also been available for decades. So the point still stands.",0,,,-29,science
5a5qta,4,"The first GMO crops were created in the early 80s and didn't reach commercial availability till 1994 so it really is a new technology. its been around for decades yes, but only 2 ",0,,,11,science
5a5qta,5,Not to mention the fact that GMOs have suffered from a lot of attacks on them that has reduced their ability to develop as a technology.,0,,,1,science
5a5qta,4,"Not all GMOs have anything to do with glyphosphates either. 


they arent the only GMO and resistance to it isnt the only kind of modifying",0,,,25,science
5a5qta,5,I don't think anyone is claiming that.,0,,,-12,science
5a5qta,6,"There's also non-GMO glyphosate resistance traits through breeding, so it actually is a valid question of why glyphosate keeps getting brought up in these discussions.",0,,,12,science
5a5qta,6,then why did you mention it in a comment that implies differently?,0,,,1,science
5a5qta,7,Mentioning the most used GM trait-herbicide pairing as an example of GM technology isn't the same as saying all GMOs are linked to glyphosphate.,0,,,3,science
5a5qta,2,"GMOs have been happening long before these companies. Just because you do it naturally doesn't make it any less of a GMO, because it took human interference to create. Most fruit and vegetables were created and bred over long periods of time. It's the pesticides that do damage, and over processing food.",0,,,9,science
5a5qta,3,"Technically your [puppy is a GMO](https://www.geneticliteracyproject.org). Selective breeding is a form of genetic modification. Also, the Native Americans [genetically modified corn](http://www.nativetech.org/cornhusk/cornhusk.html) to be editable to humans. ",0,,,5,science
5a5qta,4,"Can this argument be stricken from r/science please?

It's like arguing all food is 'organic' because it has carbon.",0,,,4,science
5a5qta,4,"> Selective breeding is a form of genetic modification

This is where you are going to lose the trust of the people you are trying to convince to get on your side. They know there is a difference, the companies know there is a difference, the scientists know there is a difference but when an advocate for more genetic modification makes the argument that there is no difference the public paints all of you as manipulative liars who can't be trusted to be honest.",0,,,8,science
5a5qta,5,"There's also a difference between genetic engineering, genetic modification, selective breeding, and natural selection. The point is they all manipulate DNA to an end. Simply painting all of this as GMO and labelling it all as bad is mistake. Some of it is good, some of it is bad, some of it is harmless, and all of it needs to be taken on a case by case basis. 

Also I'm not sure which ""all of us"" I'm supposed to be part of. I fix industrial machinery for a living. I just find the topic interesting and had the daft to share, I suppose. ",0,,,0,science
5a5qta,6,">There's also a difference between genetic engineering, genetic modification, selective breeding, and natural selection. The point is they all manipulate DNA to an end.

Not the same way. Don't dig your heels in. Just admit that it's the wrong tactic and promise not to use it again.

You are making the whole industry look bad and untrustable.

>Also I'm not sure which ""all of us"" I'm supposed to be part of.

All of you who are trying to get people to buy more GMO products.",0,,,2,science
5a5qta,7,"I said there's a difference. That's the whole point. You're trying to argue with me by agreeing with me. Hard to for me to admit I'm wrong and not use it again when you're either agreeing with it or don't even know what you're arguing. 

Your whole anti-GMO movement is rife with ignorance and fear mongering. I'm not going to be silenced or intimidated by a group of people who run around with banhammer just because they don't understand something. ",0,,,1,science
5a5qta,8,">I said there's a difference.

You also said there was no difference. Which is it?

",0,,,1,science
5a5qta,4,"My puppy is not a GMO, technically or otherwise. You are trying to blur definitions and cause confusion. GMO means something, and it's not selective breeding. ",0,,,-4,science
5a5qta,3,You are trying to redefine the term GMO and it's not working. GMO is not synonymous with breeding. ,0,,,0,science
5a5qta,4,"That's your opinion, and I have mine. I would consider breeding a new strain of something the same as modifying it, because that's the entire reason behind breeding new plants. It's all about desired traits in the end.",0,,,3,science
5a5qta,5,"You can redefine things all you want, but GMO is commonly understood to refer to using biotechnology to modify organisms. Here let me google it for you. 
https://en.m.wikipedia.org/wiki/Genetically_modified_organism",0,,,2,science
5a5qta,5,The method of achieving the new trait varies greatly between breeding/hybridizing and genetic modification. They are not the same thing. ,0,,,1,science
5a5qta,3,"Words mean what people collectively decide they mean. When we talk about GMOs, we're talking about organisms that have been directly altered on the genetic level. The whole point is to create something that could never be achieved through traditional, ""natural"" breeding practices. That distinction is important, and it's the reason why we don't call every agricultural product a GMO.",0,,,-4,science
5a5qta,4,"Modern genetic engineering doesn't 'create things not possible with breeding', it directly inserts exact genetic material instead of breeding for several generations and waiting for the gene to be incorporated.

Its a time scale issue. Then the resulting plants are tested for viability and safety for many years in many different ways before they get grown. 

Frankenplants are a myth.",0,,,12,science
5a5qta,2,"An electric car analogy would work fairly well, however.",0,,,-2,science
5a5qta,0,"Gonna throw this out there. While it is anecdotal and I don't have sources, there are some things to consider. 

20 years ago, producers in NE, where I'm most familiar with corn production, were growing 75-100 bushel per acre corn and many people grew milo because it was cheaper and yielded about the same return to acre. 

This year, I had many producers who were disappointed in their 200 bushel per acre corn. 

These guys will tell you, the only reason they grow better yielding crops now is because of drought tolerant varieties. 

Someone will probably point out that bushels is a measure of volume, not weight, but if you throw in test weight, it hasn't changed. Still between 56-61 lbs per bushel. 

Additionally, the USDA crop production reports have said twice now in their estimate that this year will be the biggest production level in US history for corn. (Don't get me started on USDA crop reports, but it bears mentioning) 

It has happened in wheat varieties, soybean varieties, and corn varieties. These new breeds produce so much, that we are currently in a supply glut on corn and wheat. There's literally more in storage than the world is demanding. ",0,,,7,science
5a5qta,0,[deleted],0,,,3,science
5a5qta,1,"This is a great point. This is reddit, not an academically rigorous scientific journal. I think too many expect the posts here to be screened for bias and are willing to accept what they see at face value.",0,,,1,science
5a5qta,0,"There are other reasons for GM crops. Storage life for soybeans, is one. No one expected the use of pesticides to be gone forever, and resistance to them was always expected, just not to what extent, or when. There is no argument there. The 'see, I told you so' just doesn't work here, folks.",0,,,28,science
5a5qta,1,"I think you are shifting the goalposts a bit. Increased yields and reduced dependency on pesticides have always been some of the biggest arguments in favor of GM crops. Trying to deny that seems a bit silly.

I think it may be better to say, GM plants have delivered in certain areas (i.e. storage life).

It would also probably be fair to say GM plants haven't delivered on some of the biggest fears.",0,,,20,science
5a5qta,2,"One of the major GM crops are the roundup ready variety. They actually increase the amount of herbicide used because the GM crops are ""immune"" while other plants are not.

I've not heard anything about roundup ready crops being extra resistant to pests.",0,,,10,science
5a5qta,3,"Glyphosate made a whole slew of old-guard herbicides obsolete.  

Dynap, Lasso, Prowl, Treflan, and others darn near disappeared overnight. When glyphosate appeared on the market it was extremely effective in all weather conditions, safe to spray/handle, and stable enough that any farmer could spray it without drift worries.  

The adoption of no-till that became possible thanks to effective herbicides has conserved an unfathomable amount of topsoil. No more moldboard plowing, full tillage, row cultivating all summer, etc.

With BT stacked corn, granular insecticide use has disappeared. Before the 1980's there wasn't a corn planter sold in the U.S. without insecticide boxes. Now most manufacturers don't even have them as an option.  

Yes, non-GMO soybeans will yield right with a modern GMO number. Many farmers, me included, are going back to public varieties because they are cheaper and can be retained for seed. Being able to use glyphosate as a post spray is slowly losing its advantage because of resistant pig weeds anyway. We are back to the days of yellowing soybeans with Cadet or other strong tanks mixes at post application in hopes the weeds will die and the soybeans will pull through.",0,,,15,science
5a5qta,4,"Would you say it was Bt that eliminated granular insecticides more than seed-applied chemistries? I'm not old enough to remember when the latter really took over. In Ontario, Canada there are farmers that joke about digging out their old insecticide boxes now that neonic-treated seeds are restricted. ",0,,,3,science
5a5qta,5,"You have a good point. I'd say that on-seed treatment for rootworm and BT-traiting for corn borer have both contributed to the change in cultural practices.  

I really feel for those guys in Ontario. There are only a half dozen furrow insecticides left and I am sure the price is going up, just like always. The guys running ""vintage"" planters won't need to add any boxes through. Might have to free them up after not being used for 30 years.   

Most interesting thing to me is that according to a study in Nature, farmers growing non-BT corn actually benefitted more (dollar wise) than the farmers using it. The natural corn borer population has been suppressed so much that they aren't a huge threat in most areas. Think herd immunity. Problem is they will come back with a vengeance if everyone decided to save money and plant non-traited corn.

Let's just hope we don't return to the days of granular herbicide too. I don't have the patience to maintain a Gandy box like my Uncle did back in the day.",0,,,2,science
5a5qta,3,"RR crops reduce herbicide use, promote the usage of no-till farming, and allow for the use of a minimally toxic herbicide (glyphosate) instead of its much more toxic predecessors. The LD50 of glyphosate is a staggering 5000 mg/kg. The surfactants are more toxic than the herbicide itself!",0,,,6,science
5a5qta,3,"It says right in the article that traits are often ""stacked"", so if you purchase RR corn it will more than likely contain at least one Bt trait as well. ",0,,,2,science
5a5qta,3,"Did you mean ""decrease the amount of herbicide used""?",0,,,1,science
5a5qta,3,"BT corn is a pest resistant variety. I'm not 100% sure, but I don't think there are any crops that are both roundup ready and BT. ",0,,,1,science
5a5qta,2,Yeah all the pro GMO people have stated that increased yield through GMOs was the only way to feed the planet. I've heard that argument a million times. ,0,,,3,science
5a5qta,2,"I guess it depends on who is doing the arguing. I was in on the Flavr Savr at one point. Technology gets developed, and it gets that 'wow, think of things we can do with this'. But your comment is fair. Thanks.",0,,,2,science
5a5qta,2,"Actually I think it's the article, and you, trying to shift the goal posts to show failure.  Certainly those two things were probably listed somewhere as one of the potential benefits of GMO research but so we're a lot of other things like increasing crop resiliency and improving nutrient content, both of which you'd be hard pressed to argue against.  You can't look at the one area that hasn't succeeded like you'd like and call it a failure.  ",0,,,1,science
5a5qta,0,"The article is in part based on research recently published in the National Academies Press, [*Genetically Engineered Crops: Experiences and Prospects*](https://www.nap.edu/read/23395/chapter/1).

",0,,,13,science
5a5qta,1,"It's a really terrible article based upon obfuscation of facts, hello units of measurement differences, and ignoring the quantity/prevalence of *actual* GMOs and what the intent of the genetic modifications were, such as *increasing* crop resistance to chemicals to enable stronger applications to remove parasites.

This is nothing more than intellectual dishonesty/misdirection and cherry picking of the sort more commonly associated with climate change deniers.",0,,,24,science
5a5qta,2,Intellectual dishonesty and cherry picking is standard for NYT these days. ,0,,,10,science
5a5qta,2,Your last paragraph describes your own post well. ,0,,,-18,science
5a5qta,3,"My last paragraph describes the entire article, without disguising intent or comparisons. So it can be neither cherry picking, nor intellectual dishonesty/misdirection.

If you're going to try and apply spin, don't use asinine ""I'm rubber you're glue"" replies.

Edit: auto correct got me on a word.",0,,,5,science
5a5qta,1,Only a very small part. The NAP publication gets one reference while the rest of the NYT analysis is their own based on different data. ,0,,,16,science
5a5qta,2,Yes. The NYT references the other sources as well. I just couldn't find the electronic reports to link.,0,,,6,science
5a5qta,3,"[Link to USGS Pesticide National Synthesis Project homepage](http://water.usgs.gov/nawqa/pnsp/)

[Link to official USGS summary of methodology for 2008-2012] (https://pubs.usgs.gov/ds/0907/pdf/ds907.pdf)

I couldn't find the stats from France either. Seems to be from their pesticide lobby group.
",0,,,9,science
5a5qta,1,"""In part"" is the key part. It seems to take the NAS report out of context quite a bit.",0,,,2,science
5a5qta,0,This article is very poorly referenced and heavily paraphrases it's quotes from the articles it does reference. Best just to read the National Academies Press report.,0,,,10,science
5a5qta,0,"How is New York Times talking about an issue based on their own analysis of data, a published peer reviewed research article or a brief media summary of that? 

You know that New York Times is not a legitimate scientific organization producing research, there is no peer review for these claims, but an obviously biased, slanted newspaper outlet. Why is this subreddit not enforcing its rules? Is it going to be something that will happen with other outlets or only with New York Times? Are we going to keep seeing links to to newspaper outlet leaning X side making claims about Z issue, with out any relevant peer review or legitimate scientific publication involved? 

I mean, in other cases we had people not posting reports that were not behind a paywall, but preferred to link over new york times clickbait titles and misleading articles, which was bad enough. (Nothing says science than basing your understanding on an issue of the spin of slanted journalist outlets. And I don't single New York Times specifically, their opposite outlets are also a bad source of information). 

But this is an even bigger low. What's next, blogs? Reddit posters? You understand that you give their claims an air of undeserved legitimacy by allowing them here.  

Should the claims of journalists be discussed somewhere? Sure. But the rules of this subreddit create certain expectations and again give an air of legitimacy. I shouldn't have to explain why this subreddit should enforce it's first and most important rule.

The only positive of this endeavor is that the top posts talk about some of the flaws of their methods or conclusion. But a journalist would lie and try to manipulate the meaning of data to present a dishonest picture?! Or would be more interested in presenting a narrative, or worse and often the case, especially with outlets like the New York Times or worse, interested in a narrative that alligns with the outlet's biases. While the priority of a scientific publication shouldn't be clicks, providing a narrative, but the truth. And should value scientific rigor.

What a big surprise. ",0,,,3,science
5a5qta,0,"Apart from the points made about developing countries and not so fertile planting grounds, GMOs will also show their strength as we transition to indoor vertical growing operations and modifying these plants primarily for rapid and quality growth in that specific type of environment, an environment that doesn't really need to worry about pests or weather.",0,,,5,science
5a5qta,1,"Doesn't need to worry about weather, but there's a high cost associated with keeping a greenhouse or other indoor operations at the right environment all year long. Pests can often get worse indoors too. Talk to anyone that's managed a greenhouse and it's not quite so easy.
",0,,,3,science
5a5qta,2,"Greenhouse is different from this idea, these are metal and cement structures like other buildings in the city, meant to grow food right within the densest locations that need food. By building floors, you save massive amounts of land. It's an expensive investment, but in the long-run you start to save, you throw away a lot less food, don't have to buy pesticides, don't have to fertilize your land, you just give the exact nutrients needed into the hydroponics systems, and you also don't need to ship the food around the country, it just spreads right out to the local markets.

At the moment it's not entirely viable, but with emerging green energy technologies that look to lower energy costs in the future, and advances in robotics and material sciences that will allow these buildings to be built and managed cheaper, it will absolutely become quite viable, and it has to be, because it truly is the proper way to deal with food growth going into the future. (Not just plants, but synthetic meat growing as well)",0,,,2,science
5a5qta,3,"You missed the large energy costs, pest pressure requiring fertilizer, fertilizer, etc. There are simply just fundamental issues that can't be washed away by waiting for technology improvements. Someone sure can do it small scale for high end specialty crops, but what people often claim or picture (even involving hydroponics) is extremely overhyped if you are familiar with agronomy.",0,,,5,science
5a5qta,4,"I didn't miss the energy costs, I talked about that in the second paragraph. The problem is you're imagining the issues with doing this right now versus what our capabilities will be with advances in tech coming down the pipeline for the future.

You don't require fertilizer... it's hydroponics. You don't need pest control because you treat it as a sealed environment with a low grade air-lock and decontamination.

Japan is already testing out such facilities. They're not overhyped, they just aren't the most feasible option right now, but they will be in the future.",0,,,1,science
5a5qta,3,"Insecticides and fungicides will still be valuable tools even in a completely closed-system indoor operation. You can try your best to keep them out but pests will continue to find a way inside, whether that's in the seed supply, on workers' clothing, transferred with equipment...the vectors of infiltration are endless. ",0,,,2,science
5a5qta,4,"You use a low-grade air-lock and decontamination room with clean suits. Though ideally you wouldn't need much human entry in a proper grow house of the future as you'd just have robots doing the work inside and sending it out, but that's a little bit further into the future than the initial implementation of this...

And since you can carefully control the climate in these buildings, fungicides aren't generally needed, it especially helps that there is no soil to help facilitate the growth of fungus.",0,,,1,science
5a5qta,0,How about herbicides? Roundup is so prevalent in the US that traces of it are found in groundwater nationwide.,0,,,4,science
5a5qta,1,[removed],0,,,2,science
5a5qta,2,"""One specific inert ingredient, polyethoxylated tallowamine, or POEA, was more deadly to human embryonic, placental and umbilical cord cells than the herbicide itself – a finding the researchers call “astonishing.”
“This clearly confirms that the [inert ingredients] in Roundup formulations are not inert,” wrote the study authors from France’s University of Caen. “Moreover, the proprietary mixtures available on the market could cause cell damage and even death [at the] residual levels” found on Roundup-treated crops, such as soybeans, alfalfa and corn, or lawns and gardens.
The research team suspects that Roundup might cause pregnancy problems by interfering with hormone production, possibly leading to abnormal fetal development, low birth weights or miscarriages.""

https://www.scientificamerican.com/article/weed-whacking-herbicide-p/",0,,,2,science
5a5qta,3,"One single unreplicated study, and the substance they tested is not glyphosate. It clearly states they did not find toxicity associated with glyphosate. There are literally HUNDREDS of studies confirming the safety of glyphosate at recommended levels in humans. You simply choose not to believe it.",0,,,2,science
5a5qta,4,"They found toxicity when combining glyphosate (the active ingredient of Roundup) with an ""inert"" ingredient of Roundup. ",0,,,0,science
5a5qta,5,Just going to ignore the rest of my point? Thought so. ,0,,,2,science
5a5qta,6,"Your entire point was premised on glyph not being toxic. The study I linked agrees with that, but shows that glyph+""inert"" **is** toxic. Therefore, none of your last two posts are correct or relevant.",0,,,0,science
5a5qta,0,Nutrition improvements: https://www.ncbi.nlm.nih.gov/pmc/articles/PMC2442550/#!po=2.13270,0,,,1,science
5a5qta,0,"I seem to be the only one who sees this article as being behind a soft-paywall of identification (it's asking me to sign-in using facebook or google+, most likely because I have plugins that disable third party access without my permission).

Anyone have a mirror or a copy of the text?",0,,,1,science
5a5qta,0,"Hi SirT6, your submission has been removed for the following reason(s)

It does not include references to new, peer-reviewed research. Please feel free to post it in our sister subreddit /r/EverythingScience. 



*If you feel this was done in error, or would like further clarification, please don't hesitate to [message the mods](http://www.reddit.com/message/compose?to=%2Fr%2FScience&message=My%20Post:%20https://www.reddit.com/r/science/comments/5a5qta/doubts_about_the_promised_bounty_of_genetically/).*",0,,,1,science
5a5qta,1,"The NYT article is based in part on this article published in The National Academies Press: https://www.nap.edu/read/23395/chapter/1

It also draws on several government reports (they appear to be older than 6 months old though).",0,,,1,science
5a5qta,2,It's not clear to me this is new peer reviewed primary research. ,0,,,1,science
5a5qta,3,"It is definitely new (May, 2016).

It is definitely peer reviewed (see page *xi* of preface for list of external reviewers).

I don't think this sub has ever developed a great definition of ""primary research"". It certainly seems closer to meta analysis rather than a review, since it is trying to synthesize multiple pieces of evidence to reach a broader conclusion.",0,,,1,science
5a5qta,0,"To be fair, there's been so much (mostly uninformed) opposition to it...",0,,,2,science
5a5qta,0,Yeah I bet it would be pretty hard to develop a solution that works when you have so many dissenters trying to prevent you from improving.,0,,,-4,science
5a5qta,1,"The article isn't critiquing GM plants because they haven't performed ""perfectly"". It is critiquing them because (based on their analysis) GM plants have not offered even incremental improvements in two of the areas where the most promises were made: crop yields and pesticide use.",0,,,20,science
5a5qta,2,Do you have an example of a crop that has been engineered to improve yield directly?,0,,,5,science
5a5qta,3,Almost all of them.,0,,,-5,science
5a5qta,4,"I said an example, not a blanket statement lacking any scientific merit.",0,,,2,science
5a5qta,5,Ok BT corn.,0,,,-1,science
