post_id,level,body,gilded,likes,num_reports,score,subreddit
bqa7v,0,"WTF.  I did this experiment for science fair like 15 years ago. I failed because my teacher didn't believe me that the electrified grass was growing better.  I guess results just weren't evidence enough for her.

Fuck, I think I just figured out why I hated science until after college.",0,,,144,science
bqa7v,1,Wait... you proved your hypothesis and received a failing grade?  I think she missed that part of teacher school.,0,,,92,science
bqa7v,2,[deleted],0,,,31,science
bqa7v,3,"T-Test.

http://en.wikipedia.org/wiki/Student%27s_t-test

Too bad the student's you judged didn't know about this. (Basically, it compares means relative to the deviations of the data set... plus some more complicated nuances that I don't quite get.)",0,,,5,science
bqa7v,4,"Yeah, I know what a t-test is (thanks, though). Few high school students get to this point though, or understand what it is even if they know how to do one. 

Personally, I'd rather them understand the concept of variance - they can learn stats beyond the descriptive variety in college if they want.",0,,,1,science
bqa7v,5,"Grumble. I learned about variance and extrapolation and t-tests freshman year of highschool (American Public). When I retook Stats in college, I stopped showing up eventually because we never got that far.",0,,,1,science
bqa7v,3,You have judged an electrified grass growing experiment before?,0,,,0,science
bqa7v,2,Seriously... what a bitch. Apparently she can't stand the thought of a student teaching her something? This made me rage.,0,,,38,science
bqa7v,3,[deleted],0,,,27,science
bqa7v,4,Actually it was the entire generation.,0,,,15,science
bqa7v,5,"I had a similar experience. I always addressed adults on their level, and they just couldn't reconcile that in their heads somehow. I'd go in with the ""but don't you think it would make sense to judge my on the merits of my actions"", and they'd go in with ""go to your room"". I had a secret, burning rage for much of my childhood.",0,,,12,science
bqa7v,6,"Also, eating the mushrooms may have had something to do with the amazing results and reports of seeing lightning!",0,,,2,science
bqa7v,6,"It's funny, I find the baby-boomers that told me to ""Sit down and shut up, you little problem."" when I was a child are now my bosses.

I'm still a little problem that needs to sit down and shut up I guess.",0,,,2,science
bqa7v,6,I still do.,0,,,1,science
bqa7v,4,"Yes.  I love how well South Park captures the reasonable kids/unreasonable adults dynamic, using it for enlightening social commentary.",0,,,12,science
bqa7v,5,Sometimes I can't help but wonder how many little things in life like that woosh! me by. Thanks.,0,,,2,science
bqa7v,3,"I used to have this keyboarding teacher who absolutely despised me.  She was fine with everyone else in the class, but any time she had to interact with me, it was pretty much an endless tirade of what I was doing wrong.

Well, this is all because I typed three or four times faster than she did with near-flawless accuracy.  [I guess I turned out okay.](http://typera.tk/hiscore.cws)",0,,,4,science
bqa7v,4,"> keyboarding

When did that get verbed?

> I typed three or four times faster than she did with near-flawless accuracy

There's your problem. [Law 1: never outshine the master](http://en.wikipedia.org/wiki/The_48_Laws_of_Power).",0,,,5,science
bqa7v,5,"Never heard of keyboarding being a strange word, [I see a 1961 here](http://www.merriam-webster.com/dictionary/keyboarding) if that's somehow relevant.

Thanks for linking that list.  It seems I've been pretty much fucking up across the board.",0,,,1,science
bqa7v,5,Learning this list by heart!,0,,,1,science
bqa7v,6,[deleted],0,,,5,science
bqa7v,7,Can't one make more peace with more power?,0,,,2,science
bqa7v,8,"aha, good point",0,,,1,science
bqa7v,4,"Hah. Sorry man. I believe I was the last class in my high school before they made typing a mandatory elective. For my generation, AIM was our typing teacher, and for the 50% who relied on 1awl aim sp3ak, there was another 20% like myself who rapidly learned to type coherently at the speed of verbal conversation.

In 10 year (heck, *two* years) having typing classes in schools will be like having shoe-tying classes.

And I feel sad for your teacher, much like my teacher, who was about 55 in 1998, and for years had been some elite, experienced corporate typist/secretary person, getting shown up by kids.",0,,,1,science
bqa7v,4,"That's pretty damn impressive. My record is 546 keys/min, also set back in 2005. I tried a few times again just now; I could only manage 514 keys/min. :(",0,,,1,science
bqa7v,5,"Don't worry, it's about the only thing I can actually do really well, and I'm sure I'll develop carpal tunnel/arthritis by the time I'm 30.

I'd probably be at the top of the list, but the thing is, I guess I have this problem where when I know I'm doing something well, I start to get excited about it, so that red bar capped out starts to diminish and what you see is the best I was able to manage.",0,,,1,science
bqa7v,2,"Science isn't about being right or wrong: its about learning from the hypothesis.

>I failed because my teacher didn't believe me

is why he received the failing grade.",0,,,3,science
bqa7v,3,"Because as everyone knows, belief is the key part of science, not demonstrated repeatable results. 

",0,,,9,science
bqa7v,4,"Sadly, that's often how science works. ",0,,,3,science
bqa7v,5,No it's not.,0,,,2,science
bqa7v,6,"""A new scientific truth does not triumph by convincing its opponents and making them see the light, but rather because its opponents eventually die, and a new generation grows up that is familiar with it.""

Max Planck",0,,,7,science
bqa7v,7,Which is why many scientist do not see life extension technologies as a good thing as they are an impediment to necessary paradigm shifts.,0,,,1,science
bqa7v,2,"I don’t know theeminus’ experiment, I’ve never been to a science fair (I’m Australian) and I certainly know that no teacher or marker is perfect, but it’s unfair to just assume that the teacher is wrong.

Whether or not you prove your hypothesis has little to do with how you should be graded. Whether your hypothesis has a basis in theory is important, but if you prove a sensible hypothesis wrong, that’s great. In this case, unless you have a mechanism for why electrified plants grow better, the “correct” hypothesis is that they don’t, whether or not this turns out to be the case. If you do have a mechanism, and your experiment shows it – even better. But if you just baselessly take a positive position, that’s bad science. 

Inconclusive results are bad, but if you say your inconclusive results prove something, that’s even worse. It ceases to be science at that point. It also discredits most analysis of the experiment, meaning that it can almost singlehandedly cause someone to fail. I wouldn’t be surprised if threeminus’s experiment would have been better labelled inconclusive, because there wasn’t enough of an effect, or enough repetition, or because outside factors were not sufficiently controlled. Just because he’s right doesn’t mean he had a good project. And also, this experiment is about mushrooms. Grass is about as similar to a mushroom as it is to people, and I don’t think lightning helps people grow.

Unfortunately teachers do seem to relax these issues when they *know* the hypothesis is correct, so doing actually original research is somewhat of a risk. Of course rigorous and original research that adds to the scientific literature is the best thing you can do. So it’s a risk – one that is rewarding if you make sure you do it by the book.

The same is true to greater degrees in other fields – English essays are marked less harshly if they agree with the perceptions of the marker — until they’re good enough to change the markers mind, at which point they’re the best essay ever. History is easier if you view the topic from the perspective the teacher knows, unless you’re so thorough that you have them questioning their own view — same with law, geography, philosophy, art… Even *math* suffers slightly. In middle school, if you were to say that every parabola has roots, you’d be wrong unless you’re rigorous enough to state that you include unreal roots. If you work out a question in a way that differs from the *standard* and get it wrong, you’re unlikely to get marks for logic and carried errors.",0,,,1,science
bqa7v,2,Follow-up experiment should have been on the effect of electricity on the growth of science teachers.,0,,,1,science
bqa7v,1,"Jesus, if scientists had to have a correct hypothesis before their experimentation takes place, not much science would have gotten done.",0,,,16,science
bqa7v,2,"Dude, I doubt he cares. Jesus is not a particularly scientific man.",0,,,3,science
bqa7v,1,Send your teacher this link and let us know how she responds.,0,,,31,science
bqa7v,2,"""I WAS RIGHT, MRS FENGRAVE!!!"" BUT YOU DIDN'T BELIEVE ME!!!AND NOW MY LIFE IS RUINED!!!!!""

""LOOK AT THE MUSHROOMS!!!""

*(lightning in background)*",0,,,51,science
bqa7v,3,And so begins the life of a very odd super villan. ,0,,,58,science
bqa7v,4,"> Police report today that the First National Bank was robbed last Friday. Tellers did not call in the robbery because, I quote, ""we were tripping balls and the patterns in the carpet chased us into a corner, and the phones wouldn't stop barking at us long enough to let us dial 9-1-zebra.""",0,,,38,science
bqa7v,1,Never stop believing in yourself threeminus. You will do great things in life.,0,,,2,science
bqa7v,1,I did the same experiment with herbs! My science teacher didn't care either way.,0,,,2,science
bqa7v,1,Maybe she was just too shocked to acknowledge your electrifying results??,0,,,3,science
bqa7v,0,"Interesting how [two](http://www.reddit.com/r/science/comments/bqa7v/scientists_explore_japanese_farming_legend_that/c0o1cpi) [redditors](http://www.reddit.com/r/science/comments/bqa7v/scientists_explore_japanese_farming_legend_that/c0o1cbm) did high-school projects that had evidence for this, or a similar, effect, but both were more or less told that they couldn't possibly be right.

I wonder how much evidence (from high-schoolers or otherwise) like this we ignore about other things.",0,,,32,science
bqa7v,1,"Confirmation bias is not something that only afflicts bad people.  Good people, honest and hard-working scientists are plagued by every human problem, including confirmation bias.",0,,,16,science
bqa7v,2,I wish someone would tell them that.,0,,,2,science
bqa7v,1,"Actually there has been a fair amount of research done on this topic -- I ended up not actually doing the project, but I did a literature review in 7th grade for a science fair project on this topic and remember finding  a bunch of published articles that suggested that nearby electricity has a significant effect on plants.",0,,,6,science
bqa7v,1,"Hey, right here on reddit we regularly ignore stuff based simply on where it comes from, rather than what the results are, so who are we to complain?",0,,,2,science
bqa7v,2,\**cough*\* Daily Mail \**cough*\*,0,,,3,science
bqa7v,3,_*cough*_ Murdoch _*cough*_,0,,,2,science
bqa7v,1,The teachers were on the Monsanto payroll !,0,,,0,science
bqa7v,0,Is this economically viable? I mean is the cost of the electricity lower than the increase in crops? Probably for the shiitake mushrooms but what about cheapers crops like corn for instance?,0,,,7,science
bqa7v,1,"You can't generalize scientific results pertaining to one organism. Mushrooms and corn are light-years apart. First of all, mushrooms are part of the fungi kingdom whereas corn are in the kingdom plantae. Another issue is that fungi are decomposers and some act as parasites, they take in nutrients differently than plants do, they have different molecular pathways, reproductive pathways hell even their outer covering is different (fungi have chitin, plants have cellulose). 

Now for economic viability, shitake mushrooms are quite expensive if I remember my grocery shopping correctly and electricity is pretty cheap, especially if they're only exposed to short-term bolts of electricity. So yes, electrically shocking the fungi would probably be a good idea. 

Now although it might literally be the electrical shocks giving them greater yields, it could very well just be a byproduct of the electricity as well and that will warrant further research, like perhaps a small amount of ozone or plasma, who knows.",0,,,21,science
bqa7v,2,"My seventh and 8th grade science projects were on exactly this(mid 80's).  I shocked hydroponically grown snap dragons, grass, and corn to see the effect on germination and growth rates.  My project never advanced beyond regionals since my paper had no references to other scientific papers regarding plant shocking.
At the levels I shocked the grass seeds and corn seeds, percentage of germinating seeds were greatly increased.  In addition seeds germinated earlier when shocked.",0,,,18,science
bqa7v,3,[Are you this guy?](http://www.cs.cmu.edu/~dst/Library/Shelf/miller/tomato.jpg),0,,,2,science
bqa7v,4,No I believe he was looking for evidence of plants experiencing pain.  Also he looks more like a scientist then I will ever manage.,0,,,1,science
bqa7v,3,"When you hooked up the electrodes, did you say ""Now you will tell us what you know"" in a thick russian accent?",0,,,3,science
bqa7v,4,"""Ve have vays of making you talk."" And I thought the accent was German.",0,,,1,science
bqa7v,3,[deleted],0,,,2,science
bqa7v,4,"it was 6 volts from 4 c cells, across a foot of water containing dissolved fertilizers.  Morse code contact strip to send dots and dashes several times a day.  It clearly helped with germination but not with already growing plants (grass and corn).  Snapdragons were only tested with growing plants.  Plants that survived grew faster, but a greater number died.",0,,,5,science
bqa7v,5,[deleted],0,,,2,science
bqa7v,6,Nice try Dr. Mengele,0,,,8,science
bqa7v,7,[deleted],0,,,4,science
bqa7v,8,"Designing a ""lil' texas"" garden shouldn't be too problematic.  If you are keen on it, you should post in ""SomebodyMakeThis"" with additional details, such as room space available, budget etc.",0,,,1,science
bqa7v,9,[deleted],0,,,2,science
bqa7v,6,"I was an twelve year old with mad scientist delusions.  My program of research was limited by funds available at the time, and my need to watch Thundercats every day.  Also a whole line of experimentation was ruined when Anna McCormick dumped soap in my hydroponic solution.
So no, testing was not as exhaustive as I would have liked.",0,,,1,science
bqa7v,7,[deleted],0,,,1,science
bqa7v,8,"No I've often thought about going back and doing more research, but after this Japanese mushroom thing, I am confident the research will continue without me.",0,,,1,science
bqa7v,4,"Absolutely, I do this all the time! The secret (which you are apparently privy to) is 'lightly'.",0,,,1,science
bqa7v,5,[deleted],0,,,1,science
bqa7v,6,I'm just going to write up a quick disclaimer and then I'll get back to you on this.,0,,,1,science
bqa7v,7,[deleted],0,,,1,science
bqa7v,8,You're really not bluffing?,0,,,1,science
bqa7v,9,[deleted],0,,,1,science
bqa7v,2,"Yeah, I knew they were totally different organisms. 
What I was asking/wondering about was more along these lines:
Suppose this works with all plants, where would they draw the line economically. I imagined that if it were possible with corn they probably still might not do it for economic reasons. 
So wether or not it's possible wasn't my question :).
Thanks for taking the time to explain it though. 

Yes, I could imagine that the electricity works as a catalyst in the soil making it more fertile rather than directly influencing the seeds.

",0,,,3,science
bqa7v,3,"The cost benefit might not necessarily be in a higher yield, but in a higher yield, faster.",0,,,1,science
bqa7v,1,"Dunno, but I am suprised that scientists had to figure this out. Lightning is a large Nitrogen fixer, converting it into nitrates that are carried down by rain and fertilize crops.

*edit* ok, so it appears hyphae are stimulated by the current. Hmm, might work with corn as well, because of the microrhyzzia fungus that helps nourish root.",0,,,2,science
bqa7v,2,"Well, I just used corn as an example of a cheap crop. I wasn't really wondering if it would work with crop, but if it was possible would it be worth it economically. ",0,,,1,science
bqa7v,1,"Grow mushrooms under high tension power lines?

Or maybe just in high lightning areas such as Hawaii.",0,,,2,science
bqa7v,2,I thought insulated power lines emitting stuff was a myth.,0,,,1,science
bqa7v,3,They emit an electromagnetic field but it's not anything that has been proven to cause harm. It's the same fear as cell phones giving you cancer. ,0,,,3,science
bqa7v,4,Try standing under them with a fluorescent lighttube,0,,,2,science
bqa7v,5,You get mercury poisoning if you bust the bulb over yourself? I know the bulb will light up because of inductance but that hasn't been proven harmful as far as I know.,0,,,3,science
bqa7v,4,Have you ever stood under them while it was raining?,0,,,1,science
bqa7v,3,"Most power lines are uninsulated, and I think practically all high voltage transmission lines are uninsulated.",0,,,2,science
bqa7v,4,Hm. Then what's that black plastic-looking wrapping on pretty much every power line I've ever seen?,0,,,1,science
bqa7v,5,"You might be looking at telephone or cable lines strung about halfway up the pole. But most power lines (generally 3 or more conductors on a crossarm at the top of the pole) are uninsulated aluminum or copper wires that rest on glass/porcelain/fiberglass insulators.

Source: Listening to my dad talk about power lines on every car trip imaginable. :P He worked for a power company for about 25 years.

However, looking it up on Wikipedia, it looks like some other countries do insulate their power lines: http://en.wikipedia.org/wiki/Aerial_bundled_cable",0,,,5,science
bqa7v,6,"Hm, interesting. Thanks.",0,,,2,science
bqa7v,6,"Does the electricity help prevent corrosion or something? That is, in the case of the copper wires. ",0,,,1,science
bqa7v,7,"If you can get a good look, copper power lines appear a bit green. That's oxides building up on the copper, just like the Statue of Liberty or old church roofs.

I really don't know if electricity affects the patina, or what the effects of the patina is on the electricity. I would guess that the oxides hinder electricity since trying to weld something rusty is hard. But the electricity in power lines is just running along the length and not ""trying to get out"" so I guess it's kind of a moot point.",0,,,1,science
bqa7v,8,"Hmm, I hadn't noticed that before. ",0,,,1,science
bqa7v,6,They _do_ have to insulate in cases where things like trees can come into close contact right? I saw a video of a fire started from a power line once.,0,,,1,science
bqa7v,7,"Generally around here they trim the trees to keep enough space around the wires. There's a good example of this close to my parents house where the tree top looks like a C with wires running through the broken part.

If the trees are kept properly trimmed there shouldn't be fires. But when the power company wants to save money, preventive maintenance is one of the first things to go. It'll be fine for a few years, but eventually trees will close in on the wires and short out.

I'm pretty sure the span running from the pole to your house is insulated (although our power is underground so I'm not sure). But by and large, nearly all the power lines running down highways are uninsulated. It's just cheaper to insulate the wire from the pole and keep the trees trimmed. The amount of rubber needed to insulate all wires would cause other problems such as increased cost, wind resistance, and weight.",0,,,1,science
bqa7v,1,might be able to generate the electricity using some kind of solar collector.,0,,,1,science
bqa7v,1,"Could be, if the power requirements are right, that its just a matter of adding wind-based generators to the shroom farm, and bam: doubled yield.  Very interesting situation, if this is the case, because it means that there is potential for growing food in much harsher environments .. Imagine all the electrical energy on the Moon, for example, that can be turned into a productive, edible harvest ..
",0,,,1,science
bqa7v,0,"Suddenly, potheads around the world move to lightning-prone areas.",0,,,22,science
bqa7v,1,[deleted],0,,,19,science
bqa7v,2,Ummm. Lightningy?,0,,,12,science
bqa7v,3,"Yeah! It's *Lightningy*! We gotta do that again! Okay, when the next toke comes, we'll go up on the roof... I know what this needs! Hash! A little hash would *make* this! ",0,,,6,science
bqa7v,4,"Shockin' Sativa?

Inductin' Indica?",0,,,11,science
bqa7v,1,Shroom prices suddenly plummet.,0,,,5,science
bqa7v,2,"D.A.R.E.

Drugs Are Really Expensive

people for a free drug society",0,,,11,science
bqa7v,0,wonder if this works for psilocybin?,0,,,3,science
bqa7v,1,"Those mushrooms are super easy to grow in the first place, you really don't need a boost.

Also, they are grain loving mushrooms (and the shit of grain eating animals).  I am not sure if grain is conductive at all as the earth is.  Or if shit is conductive for that matter.  Though in theory it would be wet shit from rain.  That's a whole other experiment right there.",0,,,3,science
bqa7v,2,Especially rye grain..for those who are interested please google this. It's easier to get started than one would think. For research purposes only of course :),0,,,2,science
bqa7v,3,"Definitely don't search for ""Let's Grow Mushrooms!"" on Youtube,  it won't explain in easy,  detailed steps how to do so.",0,,,2,science
bqa7v,0,"*someone i used to know* used to ""shock"" his hydroponic marijuana plants. i dont know what it did, if anything, but it was definitely good ass weed",0,,,6,science
bqa7v,1,"I don't care how good it is, I'm not smoking any ass-weed.",0,,,11,science
bqa7v,2,[obligatory xkcd](http://imgur.com/COEME.jpg),0,,,2,science
bqa7v,2,:),0,,,0,science
bqa7v,0,"[Lightning fixes nitrogen](http://users.rcn.com/jkimball.ma.ultranet/BiologyPages/N/NitrogenCycle.html) into a form that is usable by plants for fertilizer.  They managed to discover something that has been happening on Earth for billions of years.

This isn't a terribly useful finding, nor terribly scientific unless they control vs. fertilization with an equivalent amount of nitrogen (they didn't even test for that!).  An unusual finding would be discovering some non-nitrogen component that is crucial to mushroom growth.",0,,,13,science
bqa7v,1,"I think it's very important to point out that fungi (mushrooms) aren't plants. They don't need fertilizer like plants do - they release enzymes that break down organic material (usually detritus) into smaller molecules, which they absorb. The two fungi the experiment used, nameko (*Pholiota nameko*) and shiitake (Lentinula edodes) are both saprophytes. Nameko is grown from grain and shiitake is grown from logs or compressed wood shavings. They break down starches, celluloses, lignins, glycans, etc to get their nutrients.

An important thing to remember is that the mycelium (body) of the fungus can produce any number of fruiting bodies (mushrooms.) Think of it more like apples growing on an apple tree - many, many mushrooms can be produced from a single mycelium. They measured the number of fruiting bodies produced by the mycelium after treatment, not the actual mass of the mycelium itself. It's not an easy thing to do, and I don't blame them for not doing it, but it would have been useful in determining if the treatment caused the growth of more fungus, or if the fungus didn't grow more but rather produced more mushrooms.

I suspect that the article is correct in stating that it is probably some kind of ""defensive"" response. It's pretty well-known by shiitake farmers that you have to ""shock"" the fungus into producing mushrooms, either by [beating (PDF)](http://www.fungifun.org/mushworld/Shiitake-Mushroom-Cultivation/mushroom-growers-handbook-2-mushworld-com-chapter01-03_p.22.pdf) the inoculated log with a stick or [cold-shocking](http://www.ehow.com/how_4466184_grow-shiitake-mushrooms.html) it. These simulate trauma and frost, respectively - both things that would really cut into the mushroom's ability to get its spores out if it didn't put out fruiting bodies immediately.

Anyway, I think it's probably similar to that. Lightning is a pretty traumatic thing for a fungus, I'm sure (biologically, they're much more closely related to animals than any other kingdom...) 

Oh, and you're probably right about why we see that effect in plants!",0,,,17,science
bqa7v,2,"
We have a subreddit here about mycology: http://www.reddit.com/r/mycology  

Anybody is more than welcome :)",0,,,6,science
bqa7v,2,"He said ""beating a log"" Beevis!",0,,,1,science
bqa7v,1,How does pulsing electricity through an insulator relate to nitrification as it happens with lightning?,0,,,4,science
bqa7v,2,"Good point.  I'd always thought that the lightning strike was supposed to actually strike nearby, but Araucaria says it's more due to lightning passing through the air, creaing nitrogen oxide, and that nitrogen oxide then falling to the earth.   Question:  Do mushrooms require nitrogen to grow?  I thought it was part of the photosynth process......

",0,,,4,science
bqa7v,3,"I was going write a detailed response, but after reading 7 pages on wikipedia and sorting through ~5 google searches, I've come to the conclusion I know little to nothing about the biology processes governing the world in which we live in.  Therefore I retreat from this discussion, noting my sincere apology.",0,,,20,science
bqa7v,4,Amazing. A reddit first.,0,,,2,science
