post_id,level,body,gilded,likes,num_reports,score,subreddit
bqa7v,3,"But from the article it doesn't appear they are charging the air.

>The experiments were carried out by seeding logs with mushroom spores and then applying high-voltage electricity pulses to the logs.",0,,,1,science
bqa7v,4,"there's fixed nitrogen in the logs, there's fixed nitrogen in the air around the logs. electricity doesn't stay where it's put in an open system.",0,,,1,science
bqa7v,3,"Nope, mushrooms don't even require light, most don't even do photosynth. Mushrooms need a source of nutrients, humidity, and water.",0,,,1,science
bqa7v,4,"Mushrooms react to light in different ways. Light might color them:
Cultivated enoki: http://damadama.files.wordpress.com/2009/10/enoki.jpg
Enoki found in nature: http://www.hlasek.com/foto/flammulina_velutipes_a8875.jpg

Some need light in order to trigger the mushroom fruitbodies. Cultivation books often specify how many lumens the culture needs.",0,,,1,science
bqa7v,5,"Oh, I didn't know that, cool.",0,,,1,science
bqa7v,1,"Shut your pie-hole mr *scientist*. Last time I checked this was America. Now, the way I see it it's nice and simple, and that means the ground is getting F'ing ELECTRIFIED.",0,,,2,science
bqa7v,1,">Lightning fixes nitrogen 

I didn't realize it was broken. hmmmm.",0,,,1,science
bqa7v,0,"Combine this with the acoustic promotion of grape growth, and  you've got one hell of a farm.",0,,,5,science
bqa7v,1,Future of agriculture depends on heavy metal bands with lightning in their stage show.  ,0,,,8,science
bqa7v,0,This technique is described in nearly all hydroponics dope growing books as much as 15 years ago. Also CO2 controlled release.,0,,,2,science
bqa7v,0,We all realise that shrooms are alien life-forms don't we?,0,,,2,science
bqa7v,0,Shocking ,0,,,2,science
bqa7v,1,Quite a jolt to the scientific community.,0,,,1,science
bqa7v,2,Let's hope future experiments shed some light on the phenomenon.,0,,,1,science
bqa7v,3,I am ecstatic that this legend turned out to be true.,0,,,1,science
bqa7v,0,We all know plants crave electrolytes.,0,,,3,science
bqa7v,1,[deleted],0,,,2,science
bqa7v,2,They don't know that. They just know what they crave.,0,,,3,science
bqa7v,1,"Electrolytes, it's what plants crave.",0,,,2,science
bqa7v,1,"know*

Come on now, this is a civilized website in the science subreddit. The least you can do is spell your words correctly.",0,,,1,science
bqa7v,0,I feel like this could make mushroom farming a significantly more interesting profession. I also predict an unexpected intersection between mycology and rocketry...Very cool.,0,,,2,science
bqa7v,0,Gotta start shocking my grow.,0,,,2,science
bqa7v,0,Great Scott! ,0,,,2,science
bqa7v,0,"HA! I finally beat reddit to the punch on something, I saw this on shroomery.org first",0,,,1,science
bqa7v,0,It's also true that grass and weeds grow more luxuriantly under high voltage power lines.,0,,,1,science
bqa7v,0,"Do they try to separate chemical versus electromagnetic aspects of sparks? The effect could be a direct electromagnetic effect on the mushrooms or it could be an indirect chemical effect, e.g., sparking produces nitrogenous compounds that then promote growth. The second of these would be no surprise, while the first would likely be remarkable. ",0,,,1,science
bqa7v,0,"I don't recall lightning helping the farm plots in M.U.L.E., could it be that I've been living by the wrong rules of agriculture all of these years?",0,,,1,science
bqa7v,0,"There is also a belief that the Japanese (or is that Chinese) government had farmers grow crops on top of a buried pyramid.  That archeologies in that country found it was built by people who weren't oriental in ancient times, and they didn't want the Western world to find out about it.",0,,,-1,science
bqa7v,0,"Okay, here is my major gripe.  Without this study, 95% of users on here would be calling ""bullshit"" to this ""ignorant countryside fairy tale"".

  The study proves that the concept is real, but the concept was real before the study.  Some of you need to focus less on ""how does it work"" and focus more on simply, 'Does it work?""  ",0,,,-1,science
bqa7v,1,Understanding how it works and verifying that it works allows us to come up with even better ways to make it work. ,0,,,2,science
bqa7v,2,"Oh, I agree completely.  I like knowing how things work for the same reasons.  The point I'm making is that many people assume something does NOT work because there has been no formal study made.  That's a rash assumption, in my opinion.  ",0,,,1,science
bqa7v,1,Extraordinary claims require extraordinary evidence.,0,,,2,science
bqa7v,2,"Well...you may feel that's a truism, but I'm not sure I follow you.  The proof has been there for centuries, although it *was* anecdotal proof.  I admit that.  I'm not saying it was conclusively proven before this study, but there *was* enough anecdotal evidence to produce real results.  

I'm just pointing out that a lot of reddit is too focused on studies (and wanting other people to be wrong) when they should be focused on ""Does it get results?""",0,,,1,science
bqa7v,1,I'm not sure what your point here is.  Do you take homeopathic remedies because someone told you they work?,0,,,2,science
bqa7v,2,"We aren't talking about homeopathy.  We're talking a folk-legend being proven correct by science.  I am pointing out that the legend was always correct, and that some people need to open their minds to the fact that it was correct before this study was made.  People need to realize that things can be real without a formal study to back them up.  ",0,,,1,science
bqa7v,3,"Yet people shouldn't change their behaviour at all with respect to ideas like these.  If someone says ""hey, I hear <rumour> but there's no proof or reason to believe it other than I heard it somewhere"" the **only** beneficial thing that could come from acting on it is if that someone does a study to prove it one way or the other.  Actually acting as if <rumour> is true without actual proof is totally unreasonable.

Otherwise what you're advocating is giving provisional acceptance to what is in virtually every case bullshit.  The problem here comes down to the asymmetry between the quantity of true versus false claims and the potential cost of a false positive versus a false negative.",0,,,1,science
bqa7v,1,">Some of you need to focus less on ""how does it work"" and focus more on simply, 'Does it work?""

because fuck science and learnin' and shit",0,,,2,science
bqa7v,2,"Yes, that is clearly my stance in this argument. ",0,,,1,science
bqa7v,1,"> Without this study, 95% of users on here would be calling ""bullshit"" to this ""ignorant countryside fairy tale"".

Prior to this study it was anecdotal, or worse - ignorant countryside fairy tale bullshit. No mechanism was proposed. There was no indication that it would be more true than any other old legend passed down by bored farmers with no education about bias or falsification.",0,,,1,science
bqa7v,2,"Yeah, but it *worked* prior to this study.  Your preconceptions about people's intelligence is limiting your range of potential experiences.  Just my opinion.",0,,,1,science
bqa7v,2,"Prior to this study, it was just as true as it is post-study.  I understand that no mechanism was proposed, but the universe doesn't care about that.  *It works!*    I get tired of people assuming that because there is no proof for something working, it cannot possibly work.  That's the real rash assumption, in my opinion.  

This has happened before, which is part of the reason I'm a little on edge here.  I'm the first guy in line to ask for scientific proof, and I want to understand things in their scientific terms, but lack of evidence is NOT proof that something does not work!  That's a logical fallacy.",0,,,1,science
bqa7v,3,"> Prior to this study, it was just as true as it is post-study.

Prior to this study it was mythology. Similarly, Troy was a mere legend until someone took a shovel to Greece and dug it up. 

> I get tired of people assuming that because there is no proof for something working, it cannot possibly work.

The null hypothesis is central to the definition of science. Until something has been demonstrated, its probable truth value is a matter of ""common sense,"" i.e. guesswork based on past experience. Lighting strikes encouraging mushroom growth sounds like bullshit. Turns out it's not. The result was a complete surprise and you're berating people as though they denied a predicted outcome with a well-understood reason for occurring. ",0,,,1,science
bqa7v,4,"No, prior to this study it was working.  This is where my major gripe is.  I'm not saying you're not smart, it's nothing like that.   However, your verification of this phenomena does NOT change the real world effects that were taking place prior to your birth.  This is an observers error - you are placing too much importance on your own existance.  It was working before your were ever born.  

>Prior to this study it was mythology.

Also, Troy is in Ionia...close to Greece, but not technically Greece.  Provincial Greece, perhaps?

See for me, Anecdotal evidence is enough to pique my interest and to make me want a formal study.  Some people act like without a formal study, something is instantly bullshit.  This proves that that isn't true.  

I dunno, I'm just sick of it.",0,,,1,science
bqa7v,1,"> Some of you need to focus less on ""how does it work"" and focus more on simply, 'Does it work?""

When proper scientific trials show that something works, it is accepted as working. There are a number of drugs whose operation we don't really understand, but we know that they _do_ work; trials show it.

When things fail proper trials, though, there's no reason to think that they work. Before someone tested it, this would have looked like homeopathy (also frequently tested). That it is shown to work when tested, unlike homeopathy, makes it different.",0,,,1,science
bqa7v,0,Reminds me of avatar,0,,,-5,science
