post_id,level,body,gilded,likes,num_reports,score,subreddit
wk2emz,5,"It's naive to trust something or someone who consistently proves to not be trustworthy. We have to ensure these statements are upheld, and that the people making them can be held accountable if they're not upheld. My opinion is that while the voluntary action and rebates could be great incentive, others are correct in being cautious about accepting this legislation without due diligence. Talking about it in many forums helps to broadcast the information to a wider audience, though I don't appreciate the media spreading misinformation deliberately.",0,,,6,canada
wk2emz,6,"Now this is some reasonable discourse!

I am not at all naive and I don't trust the liberal government very much, that's why I don't vote for them. I personally can't stand Trudeau. I think he's a little spoiled shit who has no idea what it's like in the real world for the rest of us peasants, but that's just my personal opinion about one man and It has nothing to do with my feelings about the liberal party. The liberal party is full of people who aren't Trudeau. It's their policies that interest me. It's too easy to go after the leader at all costs, just to give  unthinking conservatives a bone to chew on. Many uninformed voters seem to love to tell him how much they want to fuck him, but none of that peripheral stuff will ever make a better economy or better lives for Canadians.   


I definitely want to hold politicians accountable for their actions, but to say there is or will be a mandate is not good faith. It's just speculative propaganda. The more it's repeated, the more confused the public becomes and the more their personal biases determine their beliefs. Truth is truth, and speculation is speculation. 1+1 is 2 and no amount of propaganda can change that. That's all there is to it with this issue and the arguments being made that is is or will be mandated.",0,,,2,canada
wk2emz,5,You're the only one outraged here,0,,,2,canada
wk2emz,6,"No YOU are YOU!! Lol  


Why would you think that? Because I don't think the same way you do? Makes you angry, doesn't it?   


There is no mandate. Sorry about that, can't help you out.",0,,,1,canada
wk2emz,3,"LOL remember when Trudeau said ""we’re not a country that makes vaccination mandatory"" .... I wonder why people don't trust him.",0,,,16,canada
wk2emz,4,When did they make the vaccine mandatory?,0,,,9,canada
wk2emz,5,"I mean if you wanted to exist as a normal member of the public, it certainly was mandatory.",0,,,16,canada
wk2emz,6,"as is wearing pants, and dousing your cigarette before entering a business",0,,,16,canada
wk2emz,7,Pants aren’t experimental medication,0,,,0,canada
wk2emz,8,neither are vaccinations.,0,,,6,canada
wk2emz,6,"if you have two fuckin neurons, you wouldnt need to think twice about getting it",0,,,3,canada
wk2emz,7,"Sure, but doesn’t mean it wasn’t made compulsory",0,,,-1,canada
wk2emz,5,"When its required to function as an equal in society its a ""mandate"". This is like arguing that wearing clothes isn't mandate you might just get arrested every time you leave the house.

Also screw off with your lame attempt to retcon the topic, [canada.ca](https://canada.ca) even used the word mandate.

 https://www.canada.ca/en/transport-canada/news/2022/06/suspension-of-the-mandatory-vaccination-requirement-for-domestic-travellers-and-federally-regulated-transportation-workers.html",0,,,5,canada
wk2emz,6,"You can mandate for behavior and still not have vaccines mandatory as your original comment suggested.

""screw off with your lame attempt to retcon the topic,"" - I am not sure if someone smart said this to you in the past.  But it has no relevance here.  I very clearly asked a question  specifically related to a statement you made.",0,,,1,canada
wk2emz,7,">When did they make the vaccine mandatory?

This was your question, they made them mandatory to participate in society at any sort of normal level prior to 2021. Trying to pretend other wise is attempting to ""retcon"" the the narrative into ""they were never mandatory"".",0,,,2,canada
wk2emz,8,"So different levels of government made it kinda sorta difficult to participate in some aspects of our lives... therefore they are mandatory?

I think the problem here, is that we have a differing opinion on the definition of mandatory.  Question withdrawn.",0,,,0,canada
wk2emz,9,"You right, your understanding of ""Mandate"" and ""Mandatory"" being different is wrong, here is the definition that clearly shows the correlation between the two ""Something mandatory is the result of a mandate or order, which usually comes in the form of a law, rule, or regulation"". Sorry you didn't both to actually look up the definition of those words lol.

You can argue they were not ""compulsory"" but they were 100% mandated, and mandatory to continue participating is society as any person would have prior to 2021.

Again, trying to claim they were not ""mandatory"" is trying to ""retcon"" the narrative. while Retcon is normally a ""literary device in which new information is introduced that puts a new meaning on previous events in the story"" it fits the situation well.",0,,,2,canada
wk2emz,5,when it became legal for the government to discriminate on you based on vaccination status.,0,,,5,canada
wk2emz,6,That's not really the same thing though.  The government discriminates against people without children by offering a monthly payment to those with children.  This does not mean that children are mandatory.,0,,,6,canada
wk2emz,7,"No, that is not the same. That's incentive. There are no incentives for the vaccines, only punishment for not getting it. 

Regaining access to your privileges is not an incentive.",0,,,3,canada
wk2emz,7,"People without children were not singled out by the government as ""evil racist sexists who take up space"" and then allowed to be fired from their jobs, expelled from education, barred from traveling, barred from restaurants, etc...",0,,,-3,canada
wk2emz,8,"Yes, it wasn't the exact same scenatio. Your added complaints still do not describe a mandatory vaccine.  The government singles out, shames, and otherwise belittles segments of the population all the time to try to influence behaviour.
It's not the same thing as making something mandatory.

Edit: I am not going to go back and forth with you about the definition of mandatory.",0,,,5,canada
wk2emz,5,"""iT wAsN'T eVeN MaNdaToRy""",0,,,5,canada
wk2emz,5,Has your head been in the sand the last 6 months?,0,,,0,canada
wk2emz,4,"So propaganda as a response?   


There is no mandate. You're making it up out of thin air. I don't give a fuck if you hate Trudeau enough to make sweet sweet love to him, you can’t make shit up to yell about. Keep yelling about vaccine mandates all you want. While it's debatable if they were actual mandates is beside the point. You want to call them mandates and bitch squeal about public health, go right ahead! You want to make shit up for your pals to squeal about, then there is a problem. The problem is you made that shit up.",0,,,0,canada
wk2emz,5,"Lmao wtf, did you just sleepwalk through the last 2 years?",0,,,9,canada
wk2emz,6,"Did you sleepwalk while reading that article?   


There is no mandate. Sorry for speaking the truth. Yell all you want.   


I was fully aware of the past 2 years. We could have gotten out of this pandemic mess by now if people had just taken the vaccine. No chance for variants to evolve, no unnecessary deaths, etc. Of course, you have the opposite opinion, but what are your plans when smallpox returns because antivaxxers gave it a window of opportunity? Look up some images for smallpox and tell me you wouldn't get a vaccine for that horror show.",0,,,1,canada
wk2emz,7,"Real talk. This isn't meant to be an insult, but just what's very obvious from reading your post. It's possible I'm even talking to a bot with how robotic your response is. But the 100% undeniable takeaway from your words is that you severely lack critical thinking skills, and any ability to look at the greater picture. It's as if you live in a fog where you think anything outside of your view doesn't exist.

While the government is not saying that they're making anything mandatory today, it should definitely be considered what the consequences would be should that ever happen. It's like saying it's not raining right now, so why should we bother being prepared for a flood. Why not scream that people are just making up the potential for there being a flood out of thin air! We should always be thinking ahead, and in this case Trudeau has not given us any reason why we should trust him if he says this will only remain a voluntary measure.

And don't get me started on the covid shots. Canada does not exist in a bubble. There's a big world out there beyond that fog. We could have 100% covid shot update here and nothing would be different so long as there isn't a massive wall surrounding our borders. Not to mention the shots don't stop transmission anyway.",0,,,6,canada
wk2emz,8,"So if anyone disagrees with you they must be a bot? That's some serious negging there guy.

Your analogy isn’t the best, so let's skip it, shall we? I mean, you could say the seventh day adventists anticipate the end of the world and are making plans for that eventuality, but most of us know it will never happen. Floods happen, depending on location, mandates may or may not happen. Anyone can have an opinion on ""maybe"", but not about current facts.   


Commenters here are saying there *will be a mandate.* There is no mandate. It doesn't matter what you believe, how you choose to speculate, or what nonsense you use to discredit the words of an obvious bot. 

Canada would be in a much better place if everyone had their shot. You clearly haven't had yours based on ideology and party loyalty, but again, your personal opinion means nothing when science is involved. Vaccines are safe, have always worked, and will always work. They don't cause autism and they don't contain microchip like your phone. You might choose to *prepare* yourself for that eventuality, but it doesn't mean it will happen. You,d be wasting your time and breath.",0,,,3,canada
wk2emz,9,[removed],0,,,2,canada
wk2emz,3,"""we wont take your guns""",0,,,9,canada
wk2emz,4,"Again…. this is about fertilizer, not guns. There. Is. No. Mandate. There just isn't and that's making you all crazy. What is life without the ability to scream bloody murder about made up injustices? OH THE HUMANITY!!  


If they do take your guns it's because the majority of Canadians value gun safety, not because of a personal vendetta against you and your gravy seal aspirations. If the majority wants more gun control, and they vote for the party that wants to do that, there is sweet f a the minority can do. If the minority works *with* the majority for compromise, they get more of what *they want. T*hat's how democracy works.",0,,,9,canada
wk2emz,5,"Yes, I’m sure banning the importation of handguns will make Canada safer. Especially since we all know dangerous criminals do everything above board and will not purchase weapons illegally. In fact, this change will reduce illegal firearms purchases! It’s so smart!",0,,,2,canada
wk2emz,5,"if the majority wants gun safety banning guns does not do that. Most gun violence crimes come from criminals . It's not about  a personal vendetta you moron. It's about misleading and pandering to voters that dont know better, like your self. 
It's pretty bad when top officials say legal gun owners arent the problem but the liberal government ignore them",0,,,-1,canada
wk2emz,6,\*yourself,0,,,1,canada
wk2emz,4,"""No plans for divisive vaccine mandates""",0,,,1,canada
wk2emz,3,They said they wouldn't mandate the vaccine and turned around on those words not even a year later. Seeing how much the government focuses on environmental issues it's only logical to get a little bit worried. If people push back now they can avoid a catastrophe.,0,,,7,canada
wk2emz,4,"Read very very carefully.   


There is no mandate. There is no mandate. There is no mandate.

Bitch about a mandate if it ever happens, but until then, save your shrill projections and energy for something more worthwhile. You can't change a 1 to a 2, no matter how much you hate 2’s. Right now 1 is 1 and 2 doesn't exist. Can you wrap your head around that? Ok.

Let me get this straight: you think tackling environmental decay is going to end in a catastrophe? What the hell do you think will happen if we don't stop the climate crisis?",0,,,8,canada
wk2emz,4,"Are we really at the point of comparing policy decisions responding to a global pandemic of a nature not seen in 100 years, and suggested policies regarding agricultural environment practices? I don't get the ""fear the decisions that no one's made because someone made a decision that was totally unrelated a couple times so FEAR FEAR FEAR!"" Mentality. If they try to push for it to become a mandate then sure bitch away, call up representatives, protest, use the tools of democracy to try and change things, but trying to say that we should not even discuss options out of fear of a potential for a suggestion to become a mandate is going to do nothing but hold us back as a society",0,,,2,canada
wk2emz,5,"It will be too late then. Notice the gun ban? At first it was voluntary and now it's not. This is their way, slowly make change. 

First, it's just a suggestion, then the rules are drafted harshly but it's voluntary, then their are gifts for doing it voluntary (gifts bought and paid with tax dollars). Next, the battle ramps up. Those that did so voluntarily will think smugly and cast down on those that don't. Once public uptake is ~25%, the hammer comes down and we all bicker but it's too late, there is enough minority support to topple the masses. 

I could make anyone vegan with their tactics in 8 months.",0,,,6,canada
wk2emz,6,"I understand what you're saying but what the hell is the alternative. Says fuck it don't even bother because big bad govy may try to kick up the ante in 2-4 years? Just don't address a decades long issue out of fear of decisions not made? What is your alternative proposal to government decision making? They could absolutely just legislate it into being without consulting at all, then I'd understand the arm waving more. But they're in a consultation phase right now with an understood short term conclusion of no forced practice changes, no enforced regulation. 

If they change that then yeah let's get upset about it, sure, but to ignore the issue and say don't do anything because it might evolve from a conversation to a decision is just plain silly to me. What does a government do then?",0,,,-1,canada
wk2emz,7,"You're not wrong, if and only if there is a way to reduce fertilizer without reducing crop yields. The farmers I read about in the news seem very concerned that meeting the targets will reduce crop yields making it even harder to globally compete. 

Do you support a reduction in fertilizer if it means a reduction in crop yields? 

Since we are reducing fertilizer here, would it make sense to only import food that follows the same standard? Not doing so (which is what is being proposed) hurts our farmers while allowing the pollution to happen elsewhere. 

It's the same with Chinese products. They don't have the same labour laws we do and therefore we are uncompetitive in certain sectors. 

We're massive hippocrates in Canada, following guidelines and presenting them while importing dirty stuff (pollution) from others nations.",0,,,4,canada
wk2emz,4,"How have they ""mandated the vaccine""? Be specific.

A lot of accusations being thrown out by a handful of people. And if there's one thing I've learned on the internet - the only people who lie more than politicians are Conservative voters on the internet.",0,,,-1,canada
wk2emz,5,"I know people who lost their jobs over it, many couldn't get on a plane or go to a restaurant. I hate how people like you try to make it out like it was totally optional with no consequences for refusing. At best it was unethical systematic coercion, all for some pharma product with some serious side effects that barely even protected you from the damn virus.",0,,,2,canada
wk2emz,5,"Pretty disingenuous to say they weren't mandated. Restricting air travel to vaccinated persons, in conjunction with what was done on a provincial level, was incredibly restrictive on unvaccinated folk (for transparency, I was just fine with the provincial mandates when they came in).",0,,,-1,canada
wk2emz,3,">But they haven’t. Why speculate?

Because this government loves to mandate.",0,,,-1,canada
wk2emz,4,"And conservatives love to reframe the truth into whatever let’s them squeal the loudest. I didn't invent the system you guys created, I just live around it.   


There is no mandate. You can't speculate either way, but you do because you people LOVE to get angry. It's your favourite thing to be. If nothing is worth getting angry about, you just read your media and believe the shit they make up. There is no mandate on fertilizer.   


Bitch about actual mandates why don't you? But that would need another post, because this one is about fertilizer and the government's attempts to slow down climate catastrophe. Nitrogen fertilizer has been a disaster waiting to happen for decades. Tok any people means not enough food. Stop having so many babies and there will be enough food and employment for all.",0,,,3,canada
wk2emz,4,The government took action during a global pandemic that killed millions of people? God forbid.,0,,,1,canada
wk2emz,2,[removed],0,,,5,canada
wk2emz,3,"I believe it’s 30% on nitrogen imports no?

Also despite our feelings, food costs vs min wage are some of the lowest in human history. I think 2019 was the absolute lowest. It’s why margins on farming is low and historic agrarian areas are having issues. Population growth is decreasing but our agriculture output is increasing. It took a war involving two of the worlds largest agricultural producers. Worldwide droughts last year, and then worldwide flooding to boot, to cause food to spike.",0,,,3,canada
wk2emz,4,And most of our nitrogen is imported. Farms don't get to pick and choose where our fertilizer comes from. It's just another money grab,0,,,5,canada
wk2emz,5,"I believe we are a net exporter of both ammonia and urea for fertilizers.

https://oec.world/en/profile/hs/ammonia?redirect=true

Nutrien makes a shit ton of N fertilizer at red water.",0,,,5,canada
wk2emz,6,[removed],0,,,3,canada
wk2emz,7,Usually it’s buying back in say NB or a border town where the US supply is just a skip away vs 1000km away in Canada.,0,,,2,canada
wk2emz,8,"It still jacks up the cost a lot especially just crossing the border. Did you know we ship wheat to China then buy back the flour? It's absolutely insane. We should be processing that stuff ourselves which would cost less AND create jobs.

It's really bad with agriculture but certainly not limited to it. A lot of our natural resources are sold raw then bought back after its refined. Worst part is that Canadian companies aren't even doing most of the resources extraction anymore so that money is leaving the country.",0,,,3,canada
wk2emz,4,Talk to Sri Lanka or Africa about reducing global food security with all the crazy weather in the last decade by reducing fertilizer use.,0,,,1,canada
wk2emz,5,Well we are talking about “urban idiots” who support jt so Canadians are the focus no? Either way We don’t even think world hunger is a production issue anymore. Just logistical issue. Like transporting veggies to Nunavut requires a plane so it’s expensive.,0,,,2,canada
wk2emz,2,[deleted],0,,,1,canada
wk2emz,3,That's not at all accurate. Many other applications actually burn a lot more fuel,0,,,1,canada
wk2emz,1,">>Canadian Federation of Independent Business (CFIB)

This is just a Conservative think tank and is not a real thing",0,,,13,canada
wk2emz,1,"It’s right wing bait pushed by right wing media.

The targets have always been voluntary but they will push the narrative of a slippery slope and Canada becoming Sri Lanka which is laughable.",0,,,-6,canada
wk2emz,2,"Mandate - an official order or commission to do something.

Have you met this Prime Minister? 

- Gun Bans
- Emergency Orders
- SNC Lavalin
- Jody Wilson Raybould 
- ""I dont think about economic policy""
- WE Charity Scandal
- Ethics Violations
- [Dozens of secret Order in Councils](https://www.cbc.ca/news/politics/secret-orders-in-council-1.6467450)

Are you really going to be that surprised if he mandates fertilizer production and use?",0,,,18,canada
wk2emz,3,"The phrase was ""I don't think about monetary policy"", which is not the responsibility of the Prime Minister or his government - that's solely the domain of the Bank of Canada, which is run at arm's length to the rest of the public service and the ministers.",0,,,17,canada
wk2emz,4,You do know that the mandate of the Bank of Canada was changed by the LPC late last [year](https://www.cbc.ca/news/business/bank-of-canada-mandate-1.6283648).,0,,,3,canada
wk2emz,4,"Constant misinformation with these guys. PPs Twitter is full of comparisons between different things dressed to look similar, quotes are always snipped and used out of context.",0,,,15,canada
wk2emz,4,"Lol, that's why he spends like a drunken Sailor. Remember when Harpo and the Cons had a balanced budget, and everyone argued that it wasn't actually balanced. 

How's big Trudy doing?",0,,,-3,canada
wk2emz,5,"Balanced budgets are not necessarily good for society. If you don't believe me, have a look for yourself.   


There is good debt and bad debt, so it depends on the reasons for the debt. Running a country is nothing like running a household, but the narrative has been around for a long time.   


There is an argument to be made that the cons didn't  actually balance the budget, that they simply hid and shuffled numbers to make it look like a balanced budget.",0,,,4,canada
wk2emz,6,"For my pocket book? It's great. The government doesn't have to keep raising taxes everytime it wants to do something, or just continue to punish future generations. 

Secondly, let me know what numbers liberals can hide or shift to make it look even remotely like they know what they're doing fiscally. Just ask Morneau..... oh wait.",0,,,2,canada
wk2emz,7,"The reality is that when balancing the budget is top priority, it actually harms future generations. Countries are run for the future. If infrastructure or services get starved out, it takes longer to get them back up to speed than if they were just properly funded from the start.   


Sometimes you need to spend money to make money.

As for the fudging to balance the budget. In my partner's department, they saw plenty of budget items get passed on to the next fiscal, which was an obvious end run manoeuvre. I'm sorry if it makes you angry to hear, but it's just the truth.   


We were talking about one thing, and when you couldn’t come up with cogent arguments, you resorted to accusing the liberals of something even though you have nothing to back you up. You can't just change the topic to your personal fantasy and expect anyone to comment in good faith.",0,,,1,canada
wk2emz,8,"I dont need to argue these mental gymnastics about how government deficit is somehow good when your political party does it. 

As Milton Friedman often explained, the real issue is not how you pay for government spending — debt or taxes — but the spending itself. In other words: Don’t just look at the deficit, look at why we have a deficit. And the reason we have a deficit is pretty simple: Government spends too much.

The only cure for inflation is to reduce the rate at which total spending is growing.",0,,,1,canada
wk2emz,9,"I never said anything about who should run a deficit. You assume I vote liberal. I do not. 

 It doesn't matter who is running the country, it's bad policy to focus solely on deficit reduction. The Conservative party likes to take money from services that help the public so they can claim a balanced budget. Funny how they never cut spending on oil subsidies. If money was reallocated to the real public needs, there would be less need for deficit reduction. Money needs to be moved, not removed.

As an aside, our current inflation is largely due to big business gouging consumers while they can before things may or may not go down the shitter. They are making record profits while food prices are going through the roof. The irony is that big business will be entirely responsible for a crash if it happens.    


My political party has never held the majority.",0,,,2,canada
wk2emz,3,The only thing in that list that might be relevant is the gun bans. What does taking a vacation to a private island have to do with mandating people's actions.,0,,,4,canada
wk2emz,3,"Read carefully: There is no mandate. There is no mandate. Ok? Got it? Understood?   


You go ahead and bitch about any reality you want, but this is fantasy, so save it.",0,,,8,canada
wk2emz,4,"How is it that it seems the criticism seems to boil down to: ""It's not happening in this immediate moment! Therefore it could never change from the way its presented in this moment"" 

Idiots",0,,,4,canada
wk2emz,5,"I'm sorry you feel that way, but still, there is no mandate. Can't make that shit up just to have a cleansing rage on about it. Just wait for a while and if things change, then bitch about it.   


You're all pretending the mandate is real because you need it to be real in order to have a big ol strop about it.   


Anything can change, it takes a special kind of idiot to try and convince people a lie is the truth.",0,,,1,canada
