post_id,level,body,gilded,likes,num_reports,score,subreddit
wk2emz,0,"Are we talking the same fertilizers that are causing algae blooms. Algae blooms that can cause fatalities in animals and children?

I live in a huge farming belt that makes almost all water unswimmable for a month every summer. Hundreds (thousands?) of people, animals, dogs get sick every year.

Farmers feed people, yes. But only a complete moron would say that farming practices need to stay the same and risk lives instead of changing to preserve life.
There HAS to be compromise on both sides.",0,,,332,canada
wk2emz,1,"That compromise needs to include proper accounting. The main gripe is that the current calculations for N2O by Environment Canada (ECCC) are based purely on the volume of fertilizer shipped. [It doesn't account for any on-farm practices that increase nitrogen use efficiency and reduce both run-off and emissions.](https://www.realagriculture.com/2021/10/with-30-fertilizer-emissions-goal-looming-governments-math-fails-to-account-for-on-farm-reductions/)

Reducing fertilizer waste is in the interests of the farmer too, and it's not at all clear how those practices are going to be tracked, even as they're incentivized through the upcoming federally-funded On-Farm Climate Action Fund.",0,,,119,canada
wk2emz,2,"Yup and theres 8 years to figure this all out and implement, if we can let all the ""We NeEd FeRtIlIzErS fOr FoOd"" noise subside.

No ones arguing we dont need fertilizers, just just need to account for their use and regulate that best practices be used",0,,,84,canada
wk2emz,3,"8 years is a very small amount of time for something as impactful as this. We don't even know the real numbers for the 2020 baseline we're supposed to be beating.

I don't oppose a reduction target but right now there is basically nothing a farmer can do which will affect the math other than to cut gross fertilizer use.",0,,,19,canada
wk2emz,4,"What if people just ate less?

I'm serious.

Obesity continues to rise, if people just ate less until they didn't gain weight, we would need less farming.",0,,,1,canada
wk2emz,5,With the associated rise in cost a lot of people will have to. But we're a net exporter of food. It's not a rich country like us that's going to get the worst of any food production shortfalls.,0,,,3,canada
wk2emz,5,And obesity is also being glorified these days.,0,,,1,canada
wk2emz,5,Eating less meat would be waaaay more efficient than simply eating less. And it would help with obesity too.,0,,,1,canada
wk2emz,6,"Potentially for the fattier meat's / processed but extra lean turkey , chicken breast , flank steak, extra lean bison, eggs, egg whites, most white fish / non-farmed salmon will all be great additions to diets to help with satiety and animal protein is superior to plant based protein when you look at amino acid profiles.  

Protein will keep you full for longer, helping reduce binges and it's not only used for building muscles. Hair, nails, skin, organs, energy, will all improve with moderate healthy protein intake.",0,,,2,canada
wk2emz,6,Less carbs..you want less carbs to reduce obesity. You can eat a high fat diet and loose weight. its the carbs that get you.,0,,,2,canada
wk2emz,3,">No ones arguing we dont need fertilizers, just just need to account for their use and regulate that best practices be used

If that was the case, then why wouldn't they just say that, instead of once again making a political soundbite announcement about blanket reductions *or else*?",0,,,8,canada
wk2emz,4,"The were very clear to say ""this is not a 30% reduction in use, but a 30% reduction in emissions""",0,,,25,canada
wk2emz,5,"And again, the math is only based on inorganic fertilizer shipments. That's a measurement of consumption, not emissions, and it doesn't account for emissions from organic sources (especially manure) at all.",0,,,13,canada
wk2emz,6,"Yes, there was also talk of updating the math to reflect emissions and not usage.

Hell we might even update the math and find our 30% reduction right there",0,,,5,canada
wk2emz,5,Its funny to think that farmers would just waste anything in the prodution of food and that farmers are doing anything to jepardize thier farms and or land water ect. Thats there livelyhood for generations and if you do some reasurch you will find that most canadian farmers are using the best possible ways to farm.,0,,,-3,canada
wk2emz,6,">Its funny to think that farmers would just waste anything in the prodution of food and that farmers are doing anything to jepardize thier farms and or land water ect. Thats there livelyhood for generations and if you do some reasurch you will find that most canadian farmers are using the best possible ways to farm.

Never met a farmer who doesnt drive a jacked up duelly to town for groceries. That may have been true 50 years ago... 

In addition the worst offenders when it comes to envrionmental impacts are farmers, routinly plowing under creeks and wetlands. 

Just like the ""noble savage"" fallacy when itbcomes to first nation people. The ""noble farmer"" is also a made up idea.",0,,,1,canada
wk2emz,7,"Yes, this is definitely bullshit. The idea that farmers wouldn't over-use fertilizer because it costs money is assuming that the cost of the wasted fertilizer is equal to or greater than the effort required to be more efficient.",0,,,5,canada
wk2emz,7,"Lovely generalizations without any evidence. You've got O&G companies, strip mines, millions of cars driving down the road, waste water spewing into lakes... I challenge you to come up with your statement that farmers are 'the worst offenders' when it comes to environmental impacts.",0,,,2,canada
wk2emz,7,"You have not met many farmers then. It just plain is not logical to waste anything farming ie fertilizer,gas,seed,water it goes against thier bottom line ie profits",0,,,1,canada
wk2emz,6,"I'm sure 9 out of 10 are not and are doing best practices.

But society cater to the stupidest denominator",0,,,1,canada
wk2emz,3,"I drive to work through multiple counties in southwestern Ontario every day. I spot at least one farming regulation violation per week, all from different farmers. The industry needs more oversight.",0,,,4,canada
wk2emz,4,What sort of regulation violations do you see?,0,,,5,canada
wk2emz,5,"Spraying too close to water courses, allowing livestock in streams, high turbidity drainage, over application of pesticides, improper soil stockpiling and handling, improper placards on vehicles, no lights or reflective placards, EXCESSIVE fertilizer application, improper disinfection of poultry transport vehicles and trailers (especially during bird flu outbreaks), improper packaging at point of sale.

I'm sure if I were to tour inside some of the facilities I could come up with license violations at 9 out of 10 farms in Ontario.",0,,,0,canada
wk2emz,6,"I can definitely see many lights and signs missing on farm machinery, certainly dangerous in highly populated areas like southern Ontario. 

I think Alberta actually has some of the most stringent water regulations when it comes to livestock. Sask has next to none. I would like to see some rules about buffer zones, which would also help mitigate fertilizer run off. 

I don’t know what soil stockpiling is or why a farmer would “handle” soil. Do you mean manure?

How can you tell half of these things driving by? You can eye ball the fert rate  or how much pesticides are being applied from your car? 

You probably would find improper practices on most farms. Reality is most farms cut corners because farmers are price takers. There’s no way to increase margin if costs go up, farmers are at the mercy of the market which they do not set. I do not think farms should necessarily be exempt from regulation, but the more is added without a way of offsetting it with added revenue will lead to more consolidation, as smaller farms are unable to acquire capital to comply.",0,,,2,canada
wk2emz,4,"But the Farmers on this subreddit all say that they're doing the absolute best and none of them are over fertilizing cuz that's wasteful.

So clearly every single farmer is noble and virtuous",0,,,0,canada
wk2emz,3,"The problem here is that the target to reduce synthetic fertilizer is set but the methods on how to do it are completely unknown and are being left to chance in order for one to appear in that time period.

A more logical way to implement this is.. fund research to find alternative fertilization practices, fund the roll out of it, start to reduce the emissions from synthetic fertilizer, set targets. This way the targets will not only be achievable but also profitable. 

This just seems like a way to appease climate conscious voters.. ""we have set a target, we don't yet know how we will achieve it, but look at us, we set a target!""",0,,,0,canada
wk2emz,4,"It's not up to chance they are developing the framework now and still have 8 years, assuming they release the final version of the framework 5 years from now theres still 3 years for implementation.",0,,,2,canada
wk2emz,1,"Take a look at this satellite picture of the big algae bloom from 2011:

[https://phys.org/news/2013-04-record-breaking-lake-erie-algae-bloom.html](https://phys.org/news/2013-04-record-breaking-lake-erie-algae-bloom.html)

Where does it look like the bloom is originating from? 

[https://coastalscience.noaa.gov/news/lake-erie-hab-2020-bloom-severity-was-mild-as-predicted-by-seasonal-forecast/#:\~:text=The%202020%20bloom%20developed%20starting,the%20duration%20of%20the%20bloom](https://coastalscience.noaa.gov/news/lake-erie-hab-2020-bloom-severity-was-mild-as-predicted-by-seasonal-forecast/#:~:text=The%202020%20bloom%20developed%20starting,the%20duration%20of%20the%20bloom).

This is 2020. It always seems to originate in Toledo, not the Canadian side for the most part. The farming practices in the US are different than they are here. Broadcasting fertilizer and leaving it on top of the ground is not common practice here. No till is much more rare. We use virtually no anhydrous ammonia. I find it difficult to blame the algae blooms on Canadian farmers.",0,,,31,canada
wk2emz,2,"Part of it looks like it is coming out of L. St. Clair.  and just moving with the flow of water down the Great Lakes. 

I wish that both Canada and the U.S.A mandated 1km setback from the Great Lakes, and naturalized that 1km shoreline with wetlands. Wetlands could filter out much of that fertilizer.",0,,,13,canada
wk2emz,3,"If you look at that 2011 picture, there's no way the amount starting in Lake St Clair could build up in the larger lake erie to the concentration seen right around Toldedo.",0,,,7,canada
wk2emz,1,[deleted],0,,,12,canada
wk2emz,2,"If it is a non-issue, then you should not be upset if Trudeau abandons it.",0,,,5,canada
wk2emz,3,No.  It not being difficult to follow regulations does not mean that things will be fine if we have no regulations.,0,,,1,canada
wk2emz,2,Here you go: https://reddit.com/r/canada/comments/wk2emz/_/ijl5uy9/?context=1,0,,,2,canada
wk2emz,1,"This plan only covers nitrogen reaching the atmosphere, it has no effect on nitrogen that is never released but is rinsed into rivers.",0,,,7,canada
wk2emz,1,"Yes but farmers and the Financial Post have a Conservative (and conservative) bent so any time they can trot out anti-left, anti-Liberal, opinions masked as journalism they will take it.",0,,,3,canada
wk2emz,1,Where abouts is this? The Great Lakes?,0,,,1,canada
wk2emz,1,"People need food. You are going to need to eat too.

So, given this fact, can you detail the new planned farming practices please?",0,,,-10,canada
wk2emz,2,"No one can THEY ARE STILL IN THE CONSULTATION PHASE.

And uselessly antagonistic comments detract from the discussion",0,,,10,canada
wk2emz,2,Are you saying that we cant have both clean water and food?,0,,,15,canada
wk2emz,3,People aren't going to care about your environmental issues when they are hungry. This is basic governance. I wouldn't be surprised if an actual guillotine makes a come back in 10 years but  this time on Parliament Hill.,0,,,1,canada
wk2emz,3,Nope. I asked what these new farming practices are going to be.,0,,,-7,canada
wk2emz,4,"Im sure there are options. Buffer zones, catchment areas for run off, manure management plans for farms. likely a change in fertilizer formulations that are used and better education/insight on when to use them and where.",0,,,10,canada
wk2emz,5,Buffer zones are an area that Canadian agriculture could improve for sure. In the US there are untold acres of land that can't or shouldn't be used for crop production. The government pays the farmers to grow native grasses/plants on those acres. Canadian farmers don't get any such program.,0,,,2,canada
wk2emz,2,Check out the Stopping Algae Blooms article by CBC news. People are already working on lowering phosphorus usage.,0,,,5,canada
wk2emz,1,"In my experience, farmers *are* complete morons.",0,,,-1,canada
wk2emz,2,"I’ve met some brilliant ones, some idiots who couldn’t find their ass with both hands, everything in between, and people with blind spots. 

It turns out farmers are people, and not majestic, infallible stewards of the land.",0,,,2,canada
wk2emz,0,">A federal government plan to mandate that Canadian agribusinesses reduce their use of nitrogen fertilizer in order to lower greenhouse (GHG) gas emissions 

The plan is voluntary. Poor writing to jam the word mandate in there to rile up the crazies",0,,,385,canada
wk2emz,1,"The first industry partner against it in the article is ""Fertilizer Canada"" lol

Yeah, no shit they oppose a plan to reduce fertilizer

Voluntary with incentives sounds like a good plan to me, hopefully that is enough to meet targets. Wish farmers would see incentives as a way to make more money instead of a threat",0,,,161,canada
wk2emz,2,"I read an article from a farmer stating that they can reduce their fertilizer and ""time"" it better so they are being more efficient resulting in no loss of yield. Of course the biggest pushback I see is all driven by studies from Fertilizer Canada which is, as you pointed out, made up of the biggest fertilizer producers and sellers in Canada.",0,,,103,canada
wk2emz,3,"Got a link? I wouldn't mind having that article on hand

I haven't seen any actual farmers opposing this, just lots of fear mongering pieces about ""farmers"" but only listing industry partners, like this one",0,,,20,canada
wk2emz,4,"Not quite what you're looking for but this comment spells it out pretty well

https://www.reddit.com/r/worldnews/comments/w5skx5/trudeau_pushes_ahead_on_fertilizer_reduction_as/ihap1ow",0,,,6,canada
wk2emz,5,"I'm no farmer and cannot say with any certainty that this would be analogous but from my basic understanding of hobby gardening that this is like folks who overfeed and ""know the right amount at the right time"" ... both are capable of producing results but one is just oversaturation and the other is calculated use.

Not saying farmers don't already do that but when private fertilizer is saying that calculated use is problematic I will scratch me head because of my very pedestrian understanding of gardening.",0,,,6,canada
wk2emz,4,It's the odd 'farm worker' whose 'expert opinion' is that all farmers are hippy land stewards are already 100% efficient because 'who wastes money?'.,0,,,9,canada
wk2emz,3,With how expensive fertilizer is right now especially you can be sure farmers arn't wasting any of it and you can bet the farm they arnt using it in inefficiently  either. The fertilizer bills make diesel bills look like rounding errors in comparison.,0,,,10,canada
wk2emz,4,"Efficient use requires specialized equipment to test nitrogen concentrations in the ground. The startup cost to acquire that equipment is a barrier too, and takes a few years to make back with the fertilizer savings. My impression is most farmers err on the side of overuse in lieu of not having that test equipment

This plan is in part to help reduce that upfront cost so farmers CAN invest in that equipment",0,,,16,canada
wk2emz,5,"Most farmers today work hand in hand with an agronomist who does multiple soil tests from multiple points in each quarter section of land.
They then compare with historical levels compared to previous applications to determine how much of each type of fertilizer will be needed for the year.
The application is controlled by GPS guided tractors, and the farmer (tractor driver) is more of a supervisor in the process.
Alternate crops (like peas) are used in different years to increase the amount of nitrogen in the soil naturally as much as possible.
Fertilizer is expensive, and most farmers do everything they can to reduce their usage.",0,,,3,canada
wk2emz,4,I assume they are all excited about the incentives for reducing their use then,0,,,1,canada
wk2emz,3,Fertilizer use and yield is quite linear. The effects of when you put it on in fhe growing cycle are fairly marginal,0,,,1,canada
wk2emz,4,If that were the case why wouldn't we just use as much fertilizer as possible. There are lots of articles out there talking about how much more efficient we can be with fertilizer use.  https://ourworldindata.org/reducing-fertilizer-use,0,,,5,canada
wk2emz,2,"Now is not the time to start transitioning into less crop yields after multiple droughts and floods globally that and Ukraine being unable to move its grain stock around the globe due to the war (Ukraine is one of the major bread baskets of the world). 

We very well could see global famine at which we have never seen on earth. People forget that it’s only been 100 years since we (humanity) discovered a way to synthesize fertilizer. Before that we sailed around the world looking for bird poop on islands to use as fertilizer as its rich in nitrogen. 

We escalated our global population thanks to this invention by over 4 billion persons. If we decide to suddenly just stop using this invention and return to more environmental friendly means of production we will at best see billions die from starvation from lack of food. At worst see multiple global wars over resources just to survive which could easily kill more.",0,,,-10,canada
wk2emz,3,"Jumping from an incentive-based, voluntary fertilizer reduction program to billions of people dying has got to be a top 5 biggest jumps I've ever seen.

Stop with the incredibly disproportionate fear mongering (with no actual evidence to support your claims, I'll add). It's not real debate, you're just yelling into the wind",0,,,13,canada
wk2emz,4,"Almost as big: One of the people in the article implied that they were going to go ""without"" the fertilizers instead of having programs that help reduce fertilizers.  There is sooooo much wrong with this fucking article it's making my blood boil!",0,,,7,canada
wk2emz,4,"Canada is one of the few nations on earth with a large surplus in food production. Let’s say we reduce production by 10% from this voluntary measure. Can you guess how many people just starved to death from this number being reduced by 10% literally millions we produce that much food. I am not talking about millions of Canadians. We obviously have enough production to feed ourselves many times over but when the global food product yield is at an all time low you want to further reduce it voluntarily? 

Doing so while knowing what’s going on globally would be morally unjust. Looking the other way while people face global famine and think you’re doing the right thing in reducing green house gasses? I guess you would rather all those people die as that certainly would reduce global emissions the fastest.",0,,,-2,canada
wk2emz,5,"how many? zero.  our grain is exported and blended with lower gluten wheat to make bread.  they'll have to blend in other flours that maybe don't provide that lovely crumb.

We aren't a big enough player and anyway, if we are doing human life accounting...how many lives in the future will e saved by our reduction of nitrous oxides in the atmosphere vs. those that might starve now?  balance weighs to the future lives saved by this attempt by the feds to reduce fert usage.

lastly.  that 10% is fabricated.  That would put us at yields from a decade ago not crush farmers.  they will have to adopt new technologies and new high performance varieties but as usual they will be right back on track.

The producers always get scared when they are pushed into the right choice instead of cajoled.  The grifters are just using another facet of modern life that they have no fucking clue about.",0,,,5,canada
wk2emz,3,"Why even bother talking about a hypothetical future no one is considering?

Imagine if we replaced everyone's legs with wheels! We could end homelessness if everyone only needed 5' clear instead of 8'!",0,,,2,canada
wk2emz,1,"Not reduce use, reduce emissions from use.

There are other techniques to applying fertilizers that result in less emissions.",0,,,40,canada
wk2emz,1,Another Postmedia article (a company owned by an American right-wing media conglomerate) misrepresenting the facts to generate outrage against the current not-right-wing government? Shocking.,0,,,129,canada
wk2emz,2,Welcome to r/Canada!,0,,,21,canada
wk2emz,2,The government enacted the EMA based on a retracted cbc article which turned out to have misinformation. They walked back on multiple promises. They just circumvented parliament on import regulation for handguns. How are you okay with any government by passing democratic process. We should all be a very concerned.,0,,,-18,canada
wk2emz,1,... there is a side of the political spectrum that seems aware that it can only make a good counter-point if they first present a false premise. A certain psychology professor has gotten very famous for doing exactly that.,0,,,19,canada
wk2emz,1,"Coming from a government that previously said that Canada is not a country that mandates vaccines, that they would allow gun owners to keep their rifles, and that promised electoral reform? The one that constantly gaslights gun owners by saying that gun laws targeting legal gun owners don’t affect legal gun owners?

Based on their track record, zero benefit of the doubt is deserved. People should be concerned about plans to make this mandatory because this is a government that arrogantly believes only it knows what’s best. 

If it’s voluntary now they will make it mandatory when it invariably fails to show the outcome they want.",0,,,86,canada
wk2emz,2,"Literally nobody was forced to take a vaccine, and my lever action rifle is perfectly fine.

Sorry that you think preferred vocations or methods of travel are rights rather than privileges… and that you are such a bad shot.",0,,,32,canada
wk2emz,3,"On paper, from a politician's perspective, yes the vaccine was voluntary.    

But if your perspective is from a working or middle class Canadian, that depends on employment or public transportation, you were forced to. Trudeau's government employed every coercive tactic it could to pressure all faucets of society to take it.",0,,,8,canada
wk2emz,4,"You mean Provincial governments and private employers right? 

The best part of the Trucker convoy is that a majority of those trucks didn’t have operating authority in the US to begin with.",0,,,42,canada
wk2emz,4,"Yeah lots of employers have stipulations. Even the US forces have mandatory vaccines. None of y'all who want the vaccines have to take it at all, just don't expect to work for a place that has contractual stipulations and then be surprised you can't work there when you reject said stipulations.",0,,,21,canada
wk2emz,5,[deleted],0,,,-2,canada
wk2emz,6,"they didn't, where's your proof.",0,,,2,canada
wk2emz,7,[deleted],0,,,2,canada
wk2emz,8,Thats still federal,0,,,2,canada
wk2emz,3,If taking away someone’s income for not taking the vaccine isn’t forcing I don’t know what is,0,,,4,canada
wk2emz,3,Millions of Canadians feel like they were forced or coerced into getting it.  There's no denying that.,0,,,1,canada
wk2emz,4,"Aren't those the same people who say ""facts over feelings""? What happened to that? Just because you feel a certain way doesn't make it true",0,,,10,canada
wk2emz,4,Do you have some source to back up this claim?,0,,,3,canada
wk2emz,3,[deleted],0,,,-3,canada
wk2emz,4,What rights were taken away from those who declined to be vaccinated?,0,,,5,canada
wk2emz,3,[deleted],0,,,-3,canada
wk2emz,4,"It's his choice, and he made it knowing full well what the consequences were. Free country. That medical board is similarly free to look at a patient that disregards the clearly stated rules that they put forth and decide that the next guy in line who will actually follow their rules deserves the implant. Do you like living in a free society? Because this is exactly what that means.",0,,,2,canada
wk2emz,5,"They don't get to cite ""public health"" when they make up rules on a whim which are not consistent between jurisdictions and institutions, which are implemented and expire at different times, and are not equally applied between classes of people. Is this the free society you're talking about. An unvaccinated worker cannot work in healthcare losing their career and livelihood, but a worker sick with Covid is permitted to do so. Public health? Free society? Logical and moral consistency? Please do yourself and everyone else a favor and quit being so fucking dishonest.",0,,,1,canada
wk2emz,3,"Forced to take a vaccine or get fired. 

Forced to take a vaccine or can't travel without quarantine... still for some strange reason. 

And if your lever action can hold more than 5 rounds, you will have to permanently modify it in order to keep it so no it will not be fine.",0,,,-7,canada
