post_id,level,body,gilded,likes,num_reports,score,subreddit
wk2emz,1,Farmers don't set the price they get for their product,0,,,47,canada
wk2emz,2,"Further to that, the price of a tonne of urea this spring $1250

Last year $550

When I started farming ~$200

It's in the farmers' best interest to not use more than is needed by the crop to achieve the target yield.",0,,,7,canada
wk2emz,1,"Not really. The supply side of the agricultural equation has no real way to pass costs on to the consumer. Most ag products are global commodities, with prices set by commodity exchanges in Chicago, etc, based on global supply and demand. Aside from a few small niche markets, like direct to consumer farmer market stuff, ag producers take the price they get, and if that's not enough to cover input costs they lose money.

The way this situation would be re-balanced is that farmers would decide to plant less of certain crops, which on a large scale would re-balance supply and demand and prices on the exchanges would adjust accordingly. Theoretically.",0,,,25,canada
wk2emz,1,"The impact of lower crop yields WILL be passed directly to the consumer through less supply and higher prices at the grocery store. The question is, can your average consumer absorb that hit, especially now.

The other issue is the government is refusing to acknowledge the reductions that on-farm mitigations have already accomplished in the last few years.",0,,,16,canada
wk2emz,2,"Well….

I’ve worked in agriculture, both in Canada and Europe.

Europe has a long way yet to get farms down to an acceptable level of pollution, but compared, NA is in the stone age.

Let me take the example of fertilizer, the battle your farmers a taking up with the government was had in Europe. In the 80’s.
And the restrictions have gotten tighter and tighter ever since. Yet, european farms are still competetive.
And that is without touching topics like animal husbandry and pesticides

With lower fertilizer usage does not only come lower yield, it also brings lower production cost, and i am guessing here, most farmers pay $2 in ‘extra’ fertilizer to get $1 in extra yield.
Its all about filling the grain bins to most farmers, the rising cost of filling them is ThE gOvErNmEnT’s FaUlT


But of course, i could be wrong",0,,,1,canada
wk2emz,2,"Nitrogen fertilizers are not as good as others. It doesn't stay in the soil and runs off in to  waterways, destroying aquatic life and overwhelming those waterways with algae.   


Nitrogen fertilizers are old technology. Things have improved since the turn of the century.   


Food prices will continue to rise as the environment is destroyed and the population grows. No amount of fertilizer can overcome the population problem.",0,,,-2,canada
wk2emz,3,"You can’t grow food without nitrogen. It’s a building block of live and it needs to be in the soil to have the plant grow. How it gets there is where you have many options. You can’t just suck all the nitrogen from the soil and expect it to recover by putting it later because a dead soil takes time to recover. The ability to feed people long term relies heavily on having enough nitrogen, phosphorus and potassium in the soil. To say nitrogen fertilizers are bad sounds like the start of a bad sequel of Lysenkoism.",0,,,8,canada
wk2emz,1,"There's a few ways to introduce efficiencies in fertilizer use, including targeted application.  Some farmers already use it, I don't see why optimization is going to lead to food shortages... it's a knee-jerk ""fuck trudeau"" ""don't tell me what to do"" reaction and people are trying to fundraise and garner sympathy on the back of this scare tactic.",0,,,7,canada
wk2emz,2,"Those practices [aren't included in the current calculations](https://www.realagriculture.com/2021/10/with-30-fertilizer-emissions-goal-looming-governments-math-fails-to-account-for-on-farm-reductions/), only gross inorganic nitrogen shipments.",0,,,4,canada
wk2emz,0,Who needs food anyways. People like Trudeau think it just comes from a grocery store,0,,,2,canada
wk2emz,0,I mean they banned fertilizer use in Sri Lanka as well. I heard that also affected crop yields.,0,,,2,canada
wk2emz,1,"[https://www.vox.com/future-perfect/2022/7/15/23218969/sri-lanka-organic-fertilizer-pesticide-agriculture-farming](https://www.vox.com/future-perfect/2022/7/15/23218969/sri-lanka-organic-fertilizer-pesticide-agriculture-farming)

>According to one estimate, the president’s agrochemical ban was poised to save Sri Lanka the $400 million it was spending yearly on synthetic fertilizer, money it could use toward increasing imports of other goods.

They simply could not afford it.  From the same article

>The agrochemical ban caused rice production to drop 20 percent in the six months after it was implemented, causing a country that had been self-sufficient in rice production to spend $450 million on rice imports — much more than the $400 million that would’ve been saved by banning fertilizer imports.

Also

>“Sri Lanka started subsidizing fertilizers in the 1960s and we saw that rice yields tripled,” says Saloni Shah, a food and agriculture analyst at the Breakthrough Institute, a US-based environmental nonprofit that advocates for technological solutions. “\[Sri Lanka\] became self-sufficient in rice ... that’s huge for all Asian countries, from the food security standpoint.”

It turned out not to be a good decision, but it was done primarily for (false) economic, not environmental reasons.

>At the end of 2019, tax cuts slashed government revenue, while in 2020 the Covid-19 pandemic further decimated the tourism industry, with skyrocketing inflation pouring more fuel on the fire.",0,,,4,canada
wk2emz,0,Trudeau is a damn idiot.,0,,,5,canada
wk2emz,0,That doesn’t seem to be a whole lot of thought in quite a few government decisions,0,,,5,canada
wk2emz,0,Wondering why NP is pushing so much crap ... they should be reducing gas emissions.,0,,,4,canada
wk2emz,0,[deleted],0,,,4,canada
wk2emz,1,Humans cant live the life were living without fucking the environment. Weve painted ourselves into a corner.,0,,,0,canada
wk2emz,2,I mean the logical conclusion here is we shouldn't continue to live the life we're living.,0,,,2,canada
wk2emz,2,lmao people think we can continue living our same lifestyle while reversing climate change,0,,,3,canada
wk2emz,3,[deleted],0,,,5,canada
wk2emz,1,Because starvation is a good alternative right?,0,,,0,canada
wk2emz,0,"This government is brilliant. Inflation at almost all time highs, debt exploding, interest rates forced to go up, middle class disappearing, and the lower class facing food insecurity.

You know what we need? To reduce our fertilizer use.

I mean we only export oil and food, we've killed the first one and lets make sure to kill the second. I don't foresee any issues with a declining food supply.",0,,,3,canada
wk2emz,0,"There is so many uneducated posts in this tread it’s disturbing. People sitting in their city, telling a farmer how to farm. “Trust me bro”. You know what makes your lawn so green? Nitrogen fertilizer. Stop using it. Ban all residential fertilizer use, tax it, make it so expensive no one will want to use it. Label it “voluntary”. DEF fluid in most diesel vehicles/machinery since 2012. Mainly nitrogen, ban it, it’s doing more harm to the environment then it’s helping. 

Educate yourselves before making such foolish posts and embarrassing yourselves.",0,,,4,canada
wk2emz,1,[deleted],0,,,3,canada
wk2emz,2,Because to them food comes from a box with instructions and microwave settings.,0,,,0,canada
wk2emz,0,"Another absolutely wanton Trudeau virtue-signal?? How could it be? /s

At what point will Canadians wake up and realize that the Trudeau Liberals are destructive to Canada as a whole?",0,,,-2,canada
wk2emz,1,"The targets are voluntary.

Also, we are not the only country trying to reduce waste from fertilizers that actively harms the environment, it’s a global initiative.",0,,,35,canada
wk2emz,2,"All farmers everywhere in the world try to reduce their fertilizer consumption. You want to know why? Because fertilizer cost a lot of money. Farmers are trying to maximize their crop output for the cheapest means possible. Farmers have been doing this for…let’s see…since the beginning of farming. Farmers do everything in their power to maximize their profits. Fertilizer cost a rediculous amount, farmers try to use less of it already. In fact the amount of technology and research and development in agriculture is astonishing. If only the government did some research they would see that farmers are actually working really hard to have less emissions, less fertilizer, better crop yields and better treatment of the land. But hey, it’s probably the best ideas to let the government get involved to tell the experts how to do their jobs. Next time you see a farmer ask them what they are doing to reduce waste. I bet you that they could write a book about what efforts they have put in to reduce waste and maximize output. 
This law has nothing to do with actually helping the environment. It is a flashy way for the current government to save face and make us all think that they are doing the right thing.
This is exactly like the stupid gun laws the feds keep pushing. They are doing absolutely nothing to curb gun crime because you are targeting law abiding citizens and not tackling the root of the problem being: “illegal guns are being smuggled into Canada through indigenous territories.” But yeah let’s not open that can of worms because we might hurt someone’s feelings",0,,,5,canada
wk2emz,3,">Farmers are trying to maximize their crop output for the cheapest means possible.

What do you think fertilizer does?

History is one long tale of farmers slowly degrading their land.",0,,,-1,canada
wk2emz,4,[deleted],0,,,4,canada
wk2emz,4,"That's horseshit. Most soils in Western Canada are in far better shape now than they were even a few decades ago, through the implementation and widespread adoption of on-farm practices which sequester soil carbon and maintain soil structure, such as zero/low tillage.

The notion that farmers don't care about the massive generational investment they raise their own kids on is incredibly ignorant.",0,,,4,canada
wk2emz,5,"It's not horseshit. I'm not accusing them of shooting their kids in the foot or being irresponsible people. My grandparents are farmers. I'm saying the actual practice of feeding all these humans degrades the land. It's society's fault, not the farmers. They are just literally doing our dirty work. It's not like harvesting crops with sickles can still feed the world.

Either way - great, they're tilling less. They got a bounceback in quality due to fixing one problem. Now tell me about gradual salinization, or soil compaction from heavy industrial farming machinery, or the kind of erosion that takes place over 400 years but that you don't notice in 20. Again - not the farmers' fault when they need to water with groundwater, or when economies of scale force them to use massive tools. But before it was this shit, it was something else. Hell, even gradual soil compaction is primarily countered by deep tilling.

You don't need to call me ignorant; it's rude and I think you've misjudged what I am talking about. The notion that farmers are able to push back against all the economic pressures of society and treat their land **perfectly** is also naïve. The notion that they are aware of every bit of damage they are doing, when half the problems we are now aware of were only even *discovered* in the last century, is also ignorant. I'm not talking about damage on the time scale of one farmer or even necessarily one family.",0,,,2,canada
wk2emz,2,"> The targets are voluntary.

Can we please stop saying it’s “voluntary”. After the last year or so I would have thought we all learned nothing is “voluntary” in the end.",0,,,-14,canada
wk2emz,3,"Can't believe people are still crying over a vaccine. A vaccine that we all saw work. This isn't like other vaccines where atleast the idiocy can be blamed on the ignorance of simply not seeing what things were like before the vaccine. This one, we saw the before and after. 

Baffled",0,,,23,canada
wk2emz,4,Conspiracy sub users flooding this sub…it’s quite something to behold.,0,,,17,canada
wk2emz,5,This sub has traditionally been centre-right with a few far-right regulars. Now it’s careening into the conspiracy abyss.,0,,,12,canada
wk2emz,3,Nope. Its voluntary.,0,,,0,canada
wk2emz,4,"Yes completely voluntary, “with a federal government plan to mandate that Canadian agribusinesses reduce their use of nitrogen fertilizers….” Directly from the Financial Post article in OG’s post….",0,,,2,canada
wk2emz,5,"Yes, because a Post Media opinion piece is 100% factual and accurate.",0,,,3,canada
wk2emz,5,We'll see.,0,,,1,canada
wk2emz,3,"I know lots of unvaccinated people. If its not voluntary, how come all the people who didn't want to take it didn't have to?",0,,,2,canada
wk2emz,4,What about all the people that didn’t want it but where coerced in to getting it because work or something else?!,0,,,-1,canada
wk2emz,5,"Pretty hard to feel bad for someone who decides to lose their job or change careers based on refusing to do something that is free and safer than driving. But yeah, I've got a friend who gave up her wildfire fighting career because she didn't want to get vaccinated. Her choice.",0,,,4,canada
wk2emz,2,"LOL remember when Trudeau said ""we’re not a country that makes vaccination mandatory"" .... I wonder why people don't trust him.",0,,,1,canada
wk2emz,2,The fertilizer that feeds over 7 billion people?  How much will food cost and who gets to starve?,0,,,-5,canada
wk2emz,3,"You are missing the point.  Some farming practices routinely over fertilize on purpose.  The extra runs off and causes damage to the environment.  The effect on yield is negligible if care is taken to get the amounts right.  It even saves farmers an expense.  And with a world shortage of fertilizer, not wasting it allows more of a supply to places that need it to help feed those billions.",0,,,5,canada
wk2emz,4,They can't see past their burning sexual desires for Trudeau to understand policies that help them or the country.,0,,,5,canada
wk2emz,5,We had trudeau for 7 years and the country is undoubtedly worse off for it,0,,,1,canada
wk2emz,6,"What you've got there is called an opinion. Just like the rest of us.   


I shudder to think where we would be if the cons were the gov't for the past few years, but again, just an opinion. You haven't even got any actual info to back it up.",0,,,2,canada
wk2emz,3,People are already starving and you can thank capitalism for that. If we don't curb our pollution more people will starve than already are. The farmers that are complaining are entitled boomers who learnt to farm lazily and destructively.,0,,,-2,canada
wk2emz,4,"You should learn about all the famines other forms of economic systems have caused...

I'm sure random person shitposting on Reddit knows more about farming than farmers. Typical Reddit idiot spouting about things they know nothing about.",0,,,5,canada
wk2emz,5,"First, I have read about famine. Second, capitalism is an economic system, not a form of government. Third, I stand by my statement.",0,,,1,canada
wk2emz,6,"You're right, I corrected it. You can stand by your statement and dig your head in the sand as as much as you like but capitalism has lifted and is continuing to lift billions of people out of poverty as we speak.",0,,,0,canada
wk2emz,7,">but capitalism has lifted and is continuing to lift billions of people out of poverty as we speak.

That's wrong. It's doing the opposite.",0,,,0,canada
wk2emz,8,Where have people been made poor by capitalism?,0,,,2,canada
wk2emz,4,">The farmers that are complaining are entitled boomers who learnt to farm lazily and destructively.

Damn right! we should collectivize all the lands and focus on crops over cattle. We should be very scientific about it and plant crops together closely because plants are communal and like to get along so they will help each other grow and protect against pests collectively, this way we can reduce the dependence on synthetic pesticides and dirty fertilizers...

/s

... if this sounds stupid, its because, it is factually what being non-capitalist means when it comes to agriculture

https://www.encyclopedia.com/science/encyclopedias-almanacs-transcripts-and-maps/disastrous-effects-lysenkoism-soviet-agriculture

Modern industrial farming can feed more people than we have on earth, the loss of efficiency is from the regulators, protectionist policies and subsidies to local farming, and in general people who don't do any farming having ideas on what should be farmed where... you know... ""planning""",0,,,1,canada
wk2emz,3,Most nitrogen fertilizer ends up in waterways. There are alternatives to these old fashioned farming practices.,0,,,1,canada
wk2emz,1,[deleted],0,,,12,canada
wk2emz,1,"It’s a voluntary plan, which the article fails to mention.",0,,,11,canada
wk2emz,2,For now.,0,,,0,canada
wk2emz,3,So edgy. Tell me how the world works with your secret insider info.,0,,,1,canada
wk2emz,1,"No, reactionary bullshit divisive opinions like this are bad for Canada as a whole.

How's the weather in Moscow?",0,,,12,canada
wk2emz,2,"""everyone I don't like is a russian agent""

cmon now. give your head a shake.",0,,,0,canada
wk2emz,3,"Right up there with 'all politicians I don't like are destroying Canada'.

If you're being useful to Putin, you're the one who needs a head shake.",0,,,1,canada
wk2emz,4,"I think it's a pretty big leap to go from someone shit talking politicians to ""you're helping putin"".",0,,,1,canada
wk2emz,1,"If they thought the lockdown Protests were bad, wait and see what Farmers who just want to be left alone are like.",0,,,6,canada
wk2emz,2,"> If they thought the lockdown Protests were bad, wait and see what Farmers who just want to be left alone are like.

Please see the Netherlands for future references...",0,,,-3,canada
wk2emz,3,"The Netherlands has stated their goal is to reduce the number of farms through punitive legislation.   

Canada has a voluntary program with incentives for farmers who reduce their over fertilizer usage.   

They are nothing alike but there will be protests about 'freedom' because ignorance and outrage is more fun.",0,,,20,canada
wk2emz,4,"The Netherlands started with voluntary programs but then they made them mandatory. There was a low take up of voluntary buy outs so they made them mandatory and said they would be willing to use force. Why would any farmer want to give up their land? 

Same with nitrogen fertilizer reduction, it will be voluntary, at first, but then will be mandatory bankrupting farmers and then investment firms will swoop in and buy Canadian farmland. 

https://www.dutchnews.nl/news/2021/09/farmers-face-compulsory-buyouts-to-cut-nitrogen-emissions-nrc/",0,,,2,canada
wk2emz,5,"Right.   Look at what they were doing.  Voluntary buyout of farms.   They want fewer farms.  

Is that what Canada is doing?  Has Canada stated it's goals are to eliminate most animal farms?",0,,,3,canada
wk2emz,4,[removed],0,,,-6,canada
wk2emz,5,This is a very silly view,0,,,-1,canada
wk2emz,5,No idea what that is supposed to mean.,0,,,0,canada
wk2emz,6,They're a conspiracy kook. Ignore them.,0,,,1,canada
wk2emz,5,Riiight. You are living in the potential future. Rest of us are living in reality. Weak trolling attempt bro.,0,,,0,canada
wk2emz,1,"> At what point will Canadians wake up and realize that the Trudeau Liberals are destructive to Canada as a whole?

Around the point Sri Lanka did and by then it’s too late.",0,,,-12,canada
wk2emz,2,"Isn't it funny how many Canadian conservative ideologues are suddenly experts on Sri Lanka? Where is this coming from? Which news sources and forums are repeating this talking point for ya'll to lob in to bad faith arguments?   


None of you looks outside your small world unless it's fed to you through propaganda created  by like minded ideologues.",0,,,7,canada
wk2emz,2,"Sri Lanka ran out of money. They import most of their fertilizer so their government told the country to go “organic” which was a stupid idea because their yields fell off the cliff.

No Canadian government is banning fertilizers so the hyperbole can stop.",0,,,21,canada
wk2emz,3," The fertilizer thing is one small part of the economy, honestly it's not even the top 3 reason for Sri Lankan economic issues. Right now the right wing media is latching into the fertilizer thing to be like 'Haha see? hippies are dumb' and making it out to be the only reason.",0,,,13,canada
wk2emz,3,"> No Canadian government is banning fertilizers so the hyperbole can stop.

YET... No offense but I don’t believe it will remain “voluntary”",0,,,-17,canada
wk2emz,4,"No tin foil needed. 

The word voluntary still has a legal definition.",0,,,12,canada
wk2emz,5,So did Vaccine but that got changed a couple of times until it fit the narrative.,0,,,-8,canada
wk2emz,6,"“The narrative”. Lol, we’re not on a conspiracy sub. You have to talk normally.",0,,,12,canada
wk2emz,4,"Yet?   


If this is the way reality works, then no wonder conservative ideologues are angry all the time. You just get to make stuff up and argue with made up reality instead of real reality. Which this is.   


Voluntary means voluntary. It doesn't mean ""for now"". It means voluntary. It is voluntary. There is no plan to make it mandatory, but that doesn't stop any of you from getting outraged by your own made up truth. You don't get to do that.   


Voluntary. Eat it with a spoon. Voluntary. Look it up, because it means something, and it's meaning is clear to anyone with a dictionary.",0,,,3,canada
wk2emz,3,"Try to pay for a combine with yield reductions, margins are thin and costs only go up. There is lots farmers can do and already do without these laws ,agribusiness and equipment manufacturers have been working with controlled rate seeding and fertilizer for years. Having governments step on the necks of farmers is a bad road to follow. Let’s not make them the next target for elimination due to virtue signals, work with them they do a lot for us",0,,,-4,canada
wk2emz,4,It's a voluntary plan...no necks being stepped on. It's literally working with them to meet a goal by providing incentives to join this...again....voluntary plan.,0,,,6,canada
wk2emz,1,"I voted for Trudeau and I am 100% behind Canada becoming a leader in green energy.  


We can not wish our way to a carbon neutral future, and just deciding to use less fertilizer without realizing the impact on the food supply is foolish and dangerous.  


Canada is less than 2% of the worlds carbon emissions and if we completely shut down our grid and lived in the woods it would have almost no impact on what China, India, USA, etc are doing to the environment. (actually more like what Coca Cola, GE, Proctor and Gamble are doing to the environment ... but it is certainly not the 40 million Canadians that are responsible for our current environment).  


Let's try to reduce emissions and be a leader in the future of green energy but don't starve the poor by creating good shortages. The rich will be able to afford the price increases. The poor won't.",0,,,-3,canada
wk2emz,2,It's a voluntary program with incentives for farmers that reduce over fertilizer usage.  Those that don't want to participate don't have to.,0,,,3,canada
wk2emz,0,It's all just a money grab as usual with government,0,,,2,canada
wk2emz,0,"Remember when we made the government to help people who pay taxes, instead of a place where all the rich fucks decide dumb shit",0,,,4,canada
wk2emz,0,All farmers responses I've seen shows farmers already reduced use by 30%.  Using best most up to date tech.  Typical govt becoming farmers.  This worked great to commie countries in the past. This worked great in Sri Lanka,0,,,3,canada
wk2emz,0,Listen to Quick Dick McDick on YouTube for an excellent farmer’s point of view. (Hopefully this comment isn’t deleted),0,,,2,canada
wk2emz,1,Looked it up. The video is just outright misinformation and climate change denialism.,0,,,1,canada
wk2emz,2,How did you get that?,0,,,1,canada
wk2emz,0,This is meant to rile up uninformed Qanon lunatics spreading nonsense about this being about seizing land to build housing for brown people. The program is voluntary.,0,,,4,canada
wk2emz,1,"Before you jump to conclusions that the government loves us and always has our best interests at heart please see what’s in store for Netherlands farm land. A 45 million person mega ‘smart’ city in the Netherlands, Germany and Belgium. 

And you might ask yourself why they want to buy out farmers’ land in Holland rather than just switch them over to regenerative agriculture. This is a land grab. And no, I am not right wing and still don’t understand what Qanon is. 

https://www.tristatecity.nl/",0,,,2,canada
wk2emz,0,"Great, first they piss off truckers. Now they are screwing over farmers.",0,,,2,canada
wk2emz,0,"The only people freaking out about this are uneducated, non farmers who haven't bothered to look into this topic past the Facebook posts of other idiots. This is a win for farmers and the environment that won't affect crop yields.",0,,,2,canada
wk2emz,0,You know what else hurts crop yields: droughts and fires brought on by climate change.,0,,,1,canada
wk2emz,0,"Honestly, this government is doing everything in its power to fuck itself.",0,,,-2,canada
