post_id,level,body,gilded,likes,num_reports,score,subreddit
wk2emz,3,"“Literally nobody was forced to take a vaccine”

I think you’re forgetting all the people who lost their livelihoods, were told they couldn’t sit at a restaurant table, go to certain places in public and couldn’t travel because of the vaccine mandates. 

And travel is a right. It’s in the Canadian Charter of rights and freedoms lol. 

1930s Germany called…",0,,,-8,canada
wk2emz,4,"jfc....  


You live in a virtual reality spun around you by right-wing media that has you literally relating to 1930s germans... holy fuck....",0,,,11,canada
wk2emz,5,Interesting… so what part did I say was not factual?? Because we definitely had those mandates,0,,,-1,canada
wk2emz,4,"It was the provinces that put up barriers on travel. You were always allowed to return home, you just had to quarantine for 2 weeks.",0,,,2,canada
wk2emz,5,"It was federally mandated that you needed to be vaccinated to get on a plane, train, ferry etc. Considering we’re the second largest country in the world, that’s a bit of an issue",0,,,0,canada
wk2emz,6,"Making travel less convenient if you're unvaccinated = Literally Nazi Germany?


Interesting...",0,,,3,canada
wk2emz,4,"The first time travel was restricted over vaccinations was in the 1870s, where trains would be stopped, everyone’s vaccination status would be checked, and those who were unvaccinated would be removed from the train. What was done in response to Covid is not anything new. 

It really speaks to how privileged we are in our current lives that so many goons get so distraught over inconveniences that they mistake it for oppression, and compare it to one as bad as the holocaust. Pandemics suck, get over it.",0,,,0,canada
wk2emz,5,"Can you provide a single shred of evidence that’s true?? And even if it is there’s a massive difference between diseases like smallpox, which killed 1 in 3 people compared to covid, which the average age of death is 78 and you have a greater than 99% chance of surviving. 

I’m all for vaccines. I’m double vaxxed from covid. There’s a cost weight benefit though and it doesn’t make sense to take people’s right away from them, when they won’t get a vaccine that doesn’t even stop you from getting the disease and spreading it to others.

It’s complete fear mongering. Stay in your basement if you want, just don’t throw a hissy fit and cheer that people’s jobs should be taken from them if they decide they’re not worried about covid like you are",0,,,1,canada
wk2emz,6,"Sure, page 19. 

https://www.cpha.ca/sites/default/files/assets/history/book/history-book-print_all_e.pdf

As for the rest of what you said… Yeah no, I don’t really care to argue about how Covid-19 compares to other viruses. I’m not an epidemiologist, neither are you, and half of the problems we’ve had during this pandemic are because people assume they know better. Mandates were advocated across the board by the international medical community, and did significantly reduce the spread, the data is out there. Masks reduce odds of transmission, vaccinations reduce odds of transmission. I don’t have the energy to have this debate for the millionth time when the data is out there and easy to find. 

I’m not hiding in my basement lol. I’m young, fit, healthy, and triple vaccinated. I am the last person who needs to worry about a Covid infection. Did I follow the stricter mandates when they were out? Yes. Do I think everyone should be confined to their basements? No. I’m just saying the people who comparing having to put a piece of fabric on their face and get a vaccination to what the Jews experienced during the holocaust are fucking babies. Call it like I see it. There truly are victims of the pharmaceutical industries actions during this pandemic, and it ain’t you living in the first world.",0,,,4,canada
wk2emz,3,"Can't work in healthcare without the vaccine but can work in healthcare while sick with Covid. Explain the logic in that one, big brained intellectual heavyweights.   


There is almost no rhyme or reason to anything the government does other than to do what they want and to fuck you over, and then they pin you idiots against each other as the villains.",0,,,-2,canada
wk2emz,3,Today your lever action is fine. You’re naive if you think it’s not next up on the list,0,,,-3,canada
wk2emz,2,"Yes they believe in 'Overton window' theory. 

So they drop the idea into the media. 
 Then they ratchet it up
 Then they ratchet it up some more
 And some more

Until they shoot their foot off and then decide to finally stop, like a drunk that got into a car accident decides to stop drinking.

Carbon tax, same thing. Pennywise, pound foolish.",0,,,6,canada
wk2emz,2,"thank you. The liberal government has failed so many times to keep its word, hard to imagine they wont mandate it when no farmers voluntarily take a hit to their production.
The Trudeau supporters have never gardened before,  because If they did they would understand why farmers use fertilizers",0,,,7,canada
wk2emz,2,"How about you criticize the government for things they have done/didn't do, and leave the ""what ifs"" out of it. If it's voluntary don't call it mandatory. Just weakens the argument.",0,,,-11,canada
wk2emz,3,"They just provided multiple examples of where this government walked back on their word. 

Fool me once shame on me, fool me twice....",0,,,36,canada
wk2emz,4,"And criticize them for those actions. If they change this one, then you can criticize them for that too.

I doubt any government in the history of this Country has maintained every promise. Are we supposed to ignore everything any government does because of a history of missed obligations or false statements? 

Again, criticize them for actions they've actually done. There are plenty. Don't play ""what if"" games because that will never end.",0,,,-10,canada
wk2emz,5,"Do you wait to get scammed before realizing that particular person was a scammer? Just because the people on the telephone telling me my computer had viruses were scamming me, doesn't mean the people on my telephone telling me that I will go to jail from the IRS are scammers too!",0,,,10,canada
wk2emz,6,"This isn't remotely similar.

We're talking about a government bringing forward policy x, and people complaining because they are scared it will become policy y.

Then they make an argument saying policy x is actually policy y, which it isn't. 

It would at least make sense if people brought forward examples and stated their concern that the government may expand policy x into y, but just lying about what they are doing is disingenuous and not productive.

This is a slippery slope falicy that every political party loves to use. Look at the smear campaigns the liberals use against the conservatives come election time in regards to abortion.",0,,,-3,canada
wk2emz,7,"Except the government has brought forward policy x and it was policy y within a few months. ""We aren't a country that mandates vaccines"" they said while mandating vaccines for federally regulated employees or ""we don't take guns from legal gun owners"" they said while taking guns from legal gun owners. Now ""we don't mandate reducing fertilizer"" they say before the regulate fertilizer. 

The government is ideologically possessed and they will carry out their ideology using the same formula they've used time and time again. Start with ""oh its not a big deal it's voluntary"" and slowly tighten the noose to minimize the blowback towards an undesirable policy.",0,,,9,canada
wk2emz,8,"And when/if they do that, criticize them for it. Don't call a voluntary process mandatory.

It is very easy to state all your fair examples, and say we are concerned this voluntary program can become mandatory.

 Just calling it mandatory is a lie, and it weakens the whole discussion. It gives the government a crutch, because now the argument is about if it is voluntary or mandatory, instead of looking at their track record and voicing real concerns.",0,,,8,canada
wk2emz,9,"When they do that, it's too late to criticize.

The whole strategy is to disempower protests. Look at the US with Roe v Wade. You cannot protest that they are getting rid of abortions because they didn't, they just opened the door for the states to do that.
 
The hardliners will protest immediately and they won't have the numbers. Then the US will start to remove abortions and the normal centrist people will protest, but many of the hardliners will have given up, and again there won't be the numbers, and nothing will change. The ideologues will advance their goals at the expense of the population. Rinse and repeat. 

Criticize now, or forever hold your peace.",0,,,11,canada
wk2emz,7,"It’s 100% similar. There’s a track record of false promises, side stepping parliamentary process, and not listening to constituents. If you pay for a iPhone, and you get a broken Nokia, how have you not been scammed?",0,,,3,canada
wk2emz,8,"I don't own an iPhone or a Nokia. Who are you arguing with here? 

Why are we even talking about scams? I'm discussing sticking to the facts of an argument.",0,,,1,canada
wk2emz,3,"By the time they do it’s too late. They showed their colours, it’s not absurd to expect them to do again what they just did.",0,,,9,canada
wk2emz,3,They've lied.  A lot. Fool me 5 times...,0,,,4,canada
wk2emz,4,"And they should be held accountable for every lie they've made.

But if they cut you a cheque for $500 tomorrow are you not going to cash it because you think it will bounce? 

It would be fair to at least state their is concern this policy could become mandatory. But they are straight up lying about what it is, and a lot of people seem to be lapping it up.",0,,,5,canada
wk2emz,5,">But if they cut you a cheque for $500 tomorrow are you not going to cash it because you think it will bounce? 


Do you honestly think this is a reasonable analogy?",0,,,5,canada
wk2emz,6,"I think the majority of this conversation is unreasonable. Facts have stopped meaning anything to people, and it's a sad state in this Country.",0,,,7,canada
wk2emz,7,">Facts have stopped meaning anything to people, and it's a sad state in this Country.

Where have you been for the last 2 decades?  Yeah, people aren't buying it, and rightfully so.",0,,,4,canada
wk2emz,8,">Where have you been for the last 2 decades? Yeah, people aren't buying it, and rightfully so.

Here...? What do you mean?",0,,,3,canada
wk2emz,5,"A better analogy is Lucy pulling the football from Charlie Brown every single time. A pattern of behaviour develops and you know what to expect. It’s the same with governments and how they behave and enact policy.

What you’re advocating is to try to kick the football again, and if Lucy pulls it back, then criticize her again. What everyone else sees is a pattern of behaviour, and knows Lucy is going to pull the ball on you at the last second anyway.

But by all means, keep trying to kick the football from Lucy.",0,,,3,canada
wk2emz,3,"The comment you replied to provided concrete examples of the government saying an initiative would be temporary/voluntary, then going back on their word.",0,,,2,canada
wk2emz,1,National Post just keeps getting worse and worse,0,,,16,canada
wk2emz,1,[deleted],0,,,26,canada
wk2emz,2,"All fertilizer is N-P-K, so when something is 2-1-1, that 2 is for the nitrogen 

All plants need nitrogen to grow so I'm not sure what magical fertilizer your uncle uses that makes plants not need nitrogen to grow.",0,,,44,canada
wk2emz,3,They're talking about synthetic fertilizer vs natural. Synthetics are water soluble and wash away. Natural fertilizers while having less nitrogen can stay present for longer and therefore have better absorption,0,,,9,canada
wk2emz,4,">Natural fertilizers while having less nitrogen can stay present for longer and therefore have better absorption

This is dependent on a huge multitude of factors so no not really. Plus there is the fact that we flat out do not produce enough shit in the world to replace synthetic",0,,,2,canada
wk2emz,4,Surely they can just mix the nitrates with something sticky that doesn't rinse away immediately?,0,,,1,canada
wk2emz,5,They are working on that,0,,,2,canada
wk2emz,3,Not all fertilizer is NPK. Potash is an example of a single nutrient fertilizer. NPK fertilizers are multi-nutrient fertilizers.,0,,,7,canada
wk2emz,4,"Yes but if the soil is deficient of nitrogen, adding potash won't help your crops grow",0,,,5,canada
wk2emz,3,His uncle does not exist.,0,,,4,canada
wk2emz,3,Idk maybe I misunderstood something he said but he basically said the ones that they are limiting are the worst ones for retaining in the soil,0,,,3,canada
wk2emz,4,"Reading the other threads on this subject, there are ones that are more easily washed away and thus more is used. And the reasoning behind it's use was ""my grand daddy did that way, my daddy did it that way, and by god I am gonna do it that way""

So in other words, stubborn farmers who don't think they need to learn or change with the technology.",0,,,3,canada
wk2emz,5,"I'm a stubborn old farmer and I've spent hundreds of thousands of dollars on new technology. No serious farmer does things the way their ""grand daddy"" did.",0,,,14,canada
wk2emz,6,"the people that think that farmers are stuck in the old ways have never been to a farm,  or talked to a farmer , or actually looked at the cost of farm equipment. Its impossible to keep up with production  if your doing it old school.",0,,,4,canada
wk2emz,2,"No offence to your uncle, but nitrogen based fertilizers are the only thing that have allowed the human population to reach the level it has. 

Remember all the 20th century wars fought over guano? No, because the Haber Process came along and fundamentally changed farming.",0,,,41,canada
wk2emz,3,"Looking at some of the other posts it looks like it's more an where there's better quality nitrogen fertilizer these days that requires you to use less because it doesn't wash away as easily.  So yeah, it let us get where we are, but there's better options than the ones we traditionally use.",0,,,9,canada
wk2emz,4,"I mean it goes deeper than that. Industrial nitrogen fixation has enriched the biosphere with nitrogen (hence why it supports more life to grow and also the cause of climate change) and somewhere around half the nitrogen in humans alive today was produced artificially.

The number of people alive in Earth multiplied from one to eight billion heavily because of this, and resolving it either way will reduce the Earth's capacity for so many people at once. What we have essentially done is enrich the Earth with nitrogen in such a manner that much of it is locked up in billions of large animals like humans and cows by way of investing it selectively to the food they eat.

Either way, population decline is going to be a part of this. Less nitrogen means less nitrogen. Making it more *efficient* is a matter of ensuring it ends up in life forms instead of the air, but that doesn't entirely solve the sustainability catch 22 of [adding nitrogen to the nitrogen cycle](https://en.wikipedia.org/wiki/Human_impact_on_the_nitrogen_cycle).",0,,,3,canada
wk2emz,3,Except synthetic fertilizers [completely wreck the soil](https://www.google.com/amp/s/phys.org/news/2022-07-soil-abounds-life-australian-soils.amp). So if we want to keep eating in the future we are going to have to learn to get along without them.,0,,,5,canada
wk2emz,4,"> Except synthetic fertilizers completely wreck the soil. 

That's why farmers won't harvest the crops every 3-4 years, they'll grow corn or wheat or something and then just till it into the soil to replenish it.",0,,,3,canada
wk2emz,2,I'm a farmer. Your uncle is wrong.,0,,,4,canada
wk2emz,2,"Yea idk man. Plants need nitrogen, we don't really have an alternative. There's a reason our God-king Haber got his Nobel despite helping murder millions.

I would love to hear more about this magic nitrogen-free fertilizer. But frankly you sound full of shit, sorry.",0,,,3,canada
wk2emz,2,"Anhydrous ammonia. Nitrogen is there until a plant uses it up, not the same thing",0,,,3,canada
wk2emz,2,"There are certain crops that do not require nitrogen fertilizer. If a farmer has peas, wheat, and canola, different fertilizers would be needed for each. Soil analysis is done to find the ideal fertilizer for what the soil is missing.",0,,,3,canada
wk2emz,2,">So really nitrogen fertilizers are bad for the environment AND bad for farming.

Yes but allowed us to have 8 billion people on this planet so take your pick so yeah they are pretty good. Also all fertilizers are prone to run off Nitrogen and phosphate are the worst ones and it washes off no matter the source but better application methods can make it less prone",0,,,7,canada
wk2emz,2,Fertilizer does not wash away. It is quickly absorbed into the soil so plants can utilize it. By the end of the growing season it should all be used by the crop. The only way it can be washed away is if there is some early disaster or flood.,0,,,1,canada
wk2emz,3,"> Fertilizer does not wash away.

https://en.wikipedia.org/wiki/Eutrophication#Sources_of_nutrients",0,,,1,canada
wk2emz,4,"Read the article ""Phosphate adheres tightly to soil particles"" it can only be moved by erosion or run off. Farmers do everything in their power to prevent erosion and fertilizer is applied after spring runoff. If we lose fertilizer, we lose money so we do everything we can to make sure it goes to the plant.",0,,,3,canada
wk2emz,1,Just like income taxes were temporary?,0,,,8,canada
wk2emz,1,Divisive amplified narritive from an American right wing rag again?,0,,,20,canada
wk2emz,1,The plan is not voluntary. Current efforts to reduce fertilizer use are voluntary. The government plan is a mandate.,0,,,5,canada
wk2emz,1,Like how the vaccine was voluntary,0,,,10,canada
wk2emz,2,It was.,0,,,7,canada
wk2emz,3,"Following that logic, I'm assuming then that you would support farmers being not allowed to farm if they don't comply with this plan, right?",0,,,10,canada
wk2emz,4,"Yes, you have defined regulations. Congratulations.",0,,,-5,canada
wk2emz,5,Hey at least you stand by your convictions. Do you still consider that arrangement voluntary?,0,,,8,canada
wk2emz,6,"> While the reduction target is “ambitious,”  it does not “represent a mandatory reduction in fertilizer use” and action will focus on improving nitrogen management, Cameron Newbigging, spokesman for Agriculture and Agri-Food Canada said in a statement. The approach for achieving reductions is still under development and the government is accepting feedback until Aug. 31 and will develop “next steps in the approach” once the consultations are complete, he said.

https://financialpost.com/commodities/agriculture/trudeau-spars-with-farmers-on-climate-plan-risking-grain-output",0,,,1,canada
wk2emz,7,"What I said was clearly in reference to what conservatives fear will happen, not the state of the regulations today. Maybe I can make it more clear: Having already conceded that you would support farmers being not allowed to farm if they don't comply with the above plan, do you still consider that arrangement voluntary?",0,,,7,canada
wk2emz,8,"If you don't reduce your emissions to the targets and you fall outside of the regulation, you won't be able to continue to produce. We set that standard for any industry. 

I imagine they won't be outright banned from farming, but fined as the emissions would be measured post-hoc. But in general, yes, if you can't adapt to the regulation you shouldn't be allowed to continue. If too many farmers stop farming that means the regulation was too strict or that the government needs to take additional steps to help the farmers adapt.",0,,,-4,canada
wk2emz,9,Agree 100%. Do you consider the arrangement you described to be voluntary?,0,,,6,canada
wk2emz,5,Regulations are voluntary?,0,,,2,canada
wk2emz,6,"Emission reduction is not voluntary.

Nitrogen fertilizer reduction, as mis-characterized in the article, is voluntary.",0,,,2,canada
wk2emz,1,"covax as voluntary also, until it wasn't.",0,,,4,canada
wk2emz,1,"Noone is crazy when there is an architected global food shortage by the Russian mafia via the war in Ukraine, and we have Simple Jack PM over here once again attacking a group of productive citizens.

How tone deaf do you have to be to announce something like this at this time? Even his right hand woman is a so called expert in Russian aggressions and they still make this really, really bad optics announcement? 

https://www.cnn.com/2022/06/10/europe/food-grain-crisis-ukraine-russia-intl/index.html

ITs almost like JT wants to help Putin starve out Africa with a global holodomor? Is that a good look right now? Where is his PR team? Sleeping? 

https://en.wikipedia.org/wiki/Holodomor

https://www.cnn.com/2022/07/07/africa/somalia-famine-children-dying-ward/index.html

*I for one support the reduction of these nitrates, maybe next year?",0,,,3,canada
wk2emz,1,Right because it's not like the Liberals have a history of not telling the truth or playing fast and lose with the facts.,0,,,1,canada
wk2emz,1,It’s like 3% less too or something right? Not a huge percentage,0,,,1,canada
wk2emz,1,[removed],0,,,-29,canada
wk2emz,2,How do we know *you* are not the one virtue signaling?!,0,,,10,canada
wk2emz,2,Found one of the crazies,0,,,7,canada
wk2emz,3,"Well, he used “woke” and “virtue signalling” in the same comment… so I’m inclined to believe he’s telling the absolute truth.",0,,,13,canada
wk2emz,3,[removed],0,,,-9,canada
wk2emz,4,"Before they said anything, you called everyone who didn't agree with **your** ""truth"" woke and virtue signaling. Glass houses, dude. If you're too fragile to be painted with a broad brush without getting angry, don't do it to others.",0,,,6,canada
wk2emz,4," Prehaps they're right, what sane person just goes this hard on a strawman to a throwaway 5 word comment.

Here's another quote for the situation 

Shakespeare - ""The lady doth protest too much, methinks""",0,,,6,canada
wk2emz,4,[deleted],0,,,5,canada
wk2emz,4,Orwell threw grenades at right wingers in Spain.,0,,,3,canada
wk2emz,5,and lost,0,,,0,canada
wk2emz,6,"I wish you understood the irony in quoting an intellectual, and then immediately disavowing him for weakness. When you cite him he's a moral authority, and when someone who knows anything says it, he doesn't matter because he was outpowered. If you *do* get it, the lazy trolling might be fun for you, but it's just showing that honest people don't hold the views you do.",0,,,6,canada
wk2emz,4,[deleted],0,,,1,canada
wk2emz,5,"That's funny. 

Thank you for your contribution. 

Your participation medal is in the mail.",0,,,2,canada
wk2emz,4,"""Ignorance is strength"".

Stay strong, dude.",0,,,1,canada
wk2emz,5,"How original. 

Now off you go as you are dismissed.",0,,,2,canada
wk2emz,4,"No, just you.",0,,,-4,canada
wk2emz,2,"You do know farmers consider themselves “stewards of the land”, right?

They can’t do that if they destroy farmland and pollute the local streams and lakes with excess manure.",0,,,0,canada
wk2emz,3,"This article claims it was about reducing nitrous oxide emissions, not land degradation. That said, it's a terrible FP article, so who is to say whether the government also considered land degradation in the policy. Certainly fertilizer overuse is a problem in more ways than just this one.",0,,,3,canada
wk2emz,1,"Yeah separate issue from green house gas emissions, but my extended family owns a lake shore cabin in which the lake is fed by rain run off. Every summer there’s huge agal blooms from all the fertilizer run off, and it occasionally kills a bunch of the fish and other critters. We can’t let our dogs near the water if it gets too bad or the toxicity could poison them. My grandfather would come out there as a kid (man lived to 97) and apparently the lake would never be close to that green as a kid. 

There’s definitely environmental impacts beyond just greenhouse gas emissions.",0,,,0,canada
wk2emz,1,So sick of that shit. Anyway to make the headline more sensational and get clicks.,0,,,0,canada
wk2emz,0,[deleted],0,,,128,canada
wk2emz,1,For it to remain voluntary. The concern is that the Liberals are going to mandate it.,0,,,83,canada
wk2emz,2,"But they haven’t. Why speculate? *There is no mandate, there is no mandate, there is no mandate.* That's just the facts. Live with those until they change. Is that so hard?

They are trying to foment outrage and promote false talking points on the right. This is just bare faced propaganda, as it's written.",0,,,24,canada
wk2emz,3,The problem is the government has said they wouldn't mandate certain issue and then turned around and mandated them. You can't believe them on their word alone.,0,,,11,canada
wk2emz,4,"So you *do* enjoy raging and wringing your hands over stuff that isn't real, and might never become real?   


Go ahead and have your mistrust, vote for the candidate you think best represents your needs, but don't come on here expecting to bleat lies as if they were already true. Why is that so hard for the conservative mind to get?   


There is no mandate. There just *isn't*. Nothing I can do can change that. I have no power to alter reality to fit your personal need for outrage.   


You know anger is addictive, right?",0,,,8,canada
