export IMG_SHAPE_1=32 && export IMG_SHAPE_2=32 && export IMG_SHAPE_3=3 && export STRATEGY='baseline' && flwr run .
2025-04-13 14:29:56.014109: I tensorflow/core/platform/cpu_feature_guard.cc:210] This TensorFlow binary is optimized to use available CPU instructions in performance-critical operations.
To enable the following instructions: AVX2 FMA, in other operations, rebuild TensorFlow with the appropriate compiler flags.
Loading project configuration... 
Success
2025-04-13 14:30:03.502819: I tensorflow/core/platform/cpu_feature_guard.cc:210] This TensorFlow binary is optimized to use available CPU instructions in performance-critical operations.
To enable the following instructions: AVX2 FMA, in other operations, rebuild TensorFlow with the appropriate compiler flags.
/usr/local/lib/python3.11/site-packages/wandb/analytics/sentry.py:90: SentryHubDeprecationWarning: `sentry_sdk.Hub` is deprecated and will be removed in a future major release. Please consult our 1.x to 2.x migration guide for details on how to migrate `Hub` usage to the new API: https://docs.sentry.io/platforms/python/migration/1.x-to-2.x
  self.hub = sentry_sdk.Hub(client)
INFO :      No base model found: Initializing new model
wandb: Currently logged in as: sbs24043 (sbs24043-cct-dublin). Use `wandb login --relogin` to force relogin
wandb: Tracking run with wandb version 0.17.8
wandb: Run data is saved locally in /Users/olenapleshan/data_analytics/assignments/thesis/federated-learning/wandb/run-20250413_143021-yqzdvmil
wandb: Run `wandb offline` to turn off syncing.
wandb: Syncing run experiment-development/20250413-1430
wandb: ⭐️ View project at https://wandb.ai/sbs24043-cct-dublin/flower-embedded-fed
wandb: 🚀 View run at https://wandb.ai/sbs24043-cct-dublin/flower-embedded-fed/runs/yqzdvmil
INFO :      Starting Flower ServerApp, config: num_rounds=4, no round_timeout
INFO :      
INFO :      [INIT]
INFO :      Using initial global parameters provided by strategy
INFO :      Starting evaluation of initial global parameters
INFO :      Evaluation returned no results (`None`)
INFO :      
INFO :      [ROUND 1]
INFO :      configure_fit: strategy sampled 2 clients (out of 8)
(ClientAppActor pid=55986) /usr/local/lib/python3.11/site-packages/wandb/analytics/sentry.py:90: SentryHubDeprecationWarning: `sentry_sdk.Hub` is deprecated and will be removed in a future major release. Please consult our 1.x to 2.x migration guide for details on how to migrate `Hub` usage to the new API: https://docs.sentry.io/platforms/python/migration/1.x-to-2.x
(ClientAppActor pid=55986)   self.hub = sentry_sdk.Hub(client)
(ClientAppActor pid=55987) wandb: Currently logged in as: sbs24043 (sbs24043-cct-dublin). Use `wandb login --relogin` to force relogin
(ClientAppActor pid=55987) /usr/local/lib/python3.11/site-packages/wandb/analytics/sentry.py:90: SentryHubDeprecationWarning: `sentry_sdk.Hub` is deprecated and will be removed in a future major release. Please consult our 1.x to 2.x migration guide for details on how to migrate `Hub` usage to the new API: https://docs.sentry.io/platforms/python/migration/1.x-to-2.x
(ClientAppActor pid=55987)   self.hub = sentry_sdk.Hub(client)
(ClientAppActor pid=55987) wandb: Tracking run with wandb version 0.17.8
(ClientAppActor pid=55987) wandb: Run data is saved locally in /Users/olenapleshan/data_analytics/assignments/thesis/federated-learning/wandb/run-20250413_143036-7gh6gfx9
(ClientAppActor pid=55987) wandb: Run `wandb offline` to turn off syncing.
(ClientAppActor pid=55987) wandb: Syncing run experiment-development/20250413-1430
(ClientAppActor pid=55987) wandb: ⭐️ View project at https://wandb.ai/sbs24043-cct-dublin/flower-embedded-fed
(ClientAppActor pid=55987) wandb: 🚀 View run at https://wandb.ai/sbs24043-cct-dublin/flower-embedded-fed/runs/7gh6gfx9
(ClientAppActor pid=55986) INFO :      No base model found: Initializing new model
(ClientAppActor pid=55986) /usr/local/lib/python3.11/site-packages/tensorflow/python/framework/tensor_util.py:522: DeprecationWarning: NumPy will stop allowing conversion of out-of-bound Python integers to integer arrays.  The conversion of 2147483648 to int32 will fail in the future.
(ClientAppActor pid=55986) For the old behavior, usually:
(ClientAppActor pid=55986)     np.array(value).astype(dtype)
(ClientAppActor pid=55986) will give the desired result (the cast overflows).
(ClientAppActor pid=55986)   nparray = np.array(values, dtype=np_dt)
(ClientAppActor pid=55987) WARNING :   DEPRECATED FEATURE: `array_from_numpy` is deprecated. Instead, use the `Array(ndarray)` class directly or `Array.from_numpy_ndarray(ndarray)`.
(ClientAppActor pid=55987) 
(ClientAppActor pid=55987)             This is a deprecated feature. It will be removed
(ClientAppActor pid=55987)             entirely in future versions of Flower.
(ClientAppActor pid=55987)         
(ClientAppActor pid=55987) WARNING :   DEPRECATED FEATURE: `array_from_numpy` is deprecated. Instead, use the `Array(ndarray)` class directly or `Array.from_numpy_ndarray(ndarray)`.
(ClientAppActor pid=55987) 
(ClientAppActor pid=55987)             This is a deprecated feature. It will be removed
(ClientAppActor pid=55987)             entirely in future versions of Flower.
(ClientAppActor pid=55987)         
(ClientAppActor pid=55986) wandb: Currently logged in as: sbs24043 (sbs24043-cct-dublin). Use `wandb login --relogin` to force relogin
(ClientAppActor pid=55986) wandb: Tracking run with wandb version 0.17.8
(ClientAppActor pid=55986) wandb: Run data is saved locally in /Users/olenapleshan/data_analytics/assignments/thesis/federated-learning/wandb/run-20250413_143036-3htrsq8u
(ClientAppActor pid=55986) wandb: Run `wandb offline` to turn off syncing.
(ClientAppActor pid=55986) wandb: Syncing run experiment-development/20250413-1430
(ClientAppActor pid=55986) wandb: ⭐️ View project at https://wandb.ai/sbs24043-cct-dublin/flower-embedded-fed
(ClientAppActor pid=55986) wandb: 🚀 View run at https://wandb.ai/sbs24043-cct-dublin/flower-embedded-fed/runs/3htrsq8u
(ClientAppActor pid=55987) INFO :      No base model found: Initializing new model
(ClientAppActor pid=55986) 
(ClientAppActor pid=55986)         
(ClientAppActor pid=55986) 
(ClientAppActor pid=55986)         
(ClientAppActor pid=55987) /usr/local/lib/python3.11/site-packages/tensorflow/python/framework/tensor_util.py:522: DeprecationWarning: NumPy will stop allowing conversion of out-of-bound Python integers to integer arrays.  The conversion of 2147483648 to int32 will fail in the future.
(ClientAppActor pid=55987) For the old behavior, usually:
(ClientAppActor pid=55987)     np.array(value).astype(dtype)
(ClientAppActor pid=55987) will give the desired result (the cast overflows).
(ClientAppActor pid=55987)   nparray = np.array(values, dtype=np_dt)
INFO :      aggregate_fit: received 2 results and 0 failures
WARNING :   No fit_metrics_aggregation_fn provided
INFO :      configure_evaluate: strategy sampled 4 clients (out of 8)
(ClientAppActor pid=55987) INFO :      No base model found: Initializing new model
(ClientAppActor pid=55986) WARNING :   DEPRECATED FEATURE: `array_from_numpy` is deprecated. Instead, use the `Array(ndarray)` class directly or `Array.from_numpy_ndarray(ndarray)`. [repeated 2x across cluster] (Ray deduplicates logs by default. Set RAY_DEDUP_LOGS=0 to disable log deduplication, or see https://docs.ray.io/en/master/ray-observability/user-guides/configure-logging.html#log-deduplication for more options.)
(ClientAppActor pid=55986)             This is a deprecated feature. It will be removed [repeated 2x across cluster]
(ClientAppActor pid=55986)             entirely in future versions of Flower. [repeated 2x across cluster]
(ClientAppActor pid=55986) INFO :      No base model found: Initializing new model [repeated 3x across cluster]
INFO :      aggregate_evaluate: received 4 results and 0 failures
Baseline evaluation results: loss  2.3224521468846597  accuracy  {'federated_evaluate_accuracy': 0.19245826878388986}
INFO :      
INFO :      [ROUND 2]
INFO :      configure_fit: strategy sampled 2 clients (out of 8)
(ClientAppActor pid=55986) WARNING :   DEPRECATED FEATURE: `array_from_numpy` is deprecated. Instead, use the `Array(ndarray)` class directly or `Array.from_numpy_ndarray(ndarray)`.
(ClientAppActor pid=55986) 
(ClientAppActor pid=55986)             This is a deprecated feature. It will be removed
(ClientAppActor pid=55986)             entirely in future versions of Flower.
(ClientAppActor pid=55986)         
(ClientAppActor pid=55986) WARNING :   DEPRECATED FEATURE: `array_from_numpy` is deprecated. Instead, use the `Array(ndarray)` class directly or `Array.from_numpy_ndarray(ndarray)`.
(ClientAppActor pid=55986) 
(ClientAppActor pid=55986)             This is a deprecated feature. It will be removed
(ClientAppActor pid=55986)             entirely in future versions of Flower.
(ClientAppActor pid=55986)         
(ClientAppActor pid=55987) INFO :      No base model found: Initializing new model [repeated 2x across cluster]
INFO :      aggregate_fit: received 2 results and 0 failures
INFO :      configure_evaluate: strategy sampled 4 clients (out of 8)
(ClientAppActor pid=55987) 
(ClientAppActor pid=55987)         
(ClientAppActor pid=55987) 
(ClientAppActor pid=55987)         
(ClientAppActor pid=55987) WARNING :   DEPRECATED FEATURE: `array_from_numpy` is deprecated. Instead, use the `Array(ndarray)` class directly or `Array.from_numpy_ndarray(ndarray)`. [repeated 2x across cluster]
(ClientAppActor pid=55987)             This is a deprecated feature. It will be removed [repeated 2x across cluster]
(ClientAppActor pid=55987)             entirely in future versions of Flower. [repeated 2x across cluster]
(ClientAppActor pid=55986) INFO :      No base model found: Initializing new model [repeated 3x across cluster]
INFO :      aggregate_evaluate: received 4 results and 0 failures
Baseline evaluation results: loss  1.9480512039739688  accuracy  {'federated_evaluate_accuracy': 0.2817186905961313}
INFO :      
INFO :      [ROUND 3]
INFO :      configure_fit: strategy sampled 2 clients (out of 8)
(ClientAppActor pid=55986) INFO :      No base model found: Initializing new model [repeated 3x across cluster]
(ClientAppActor pid=55986) WARNING :   DEPRECATED FEATURE: `array_from_numpy` is deprecated. Instead, use the `Array(ndarray)` class directly or `Array.from_numpy_ndarray(ndarray)`.
(ClientAppActor pid=55986) 
(ClientAppActor pid=55986)             This is a deprecated feature. It will be removed
(ClientAppActor pid=55986)             entirely in future versions of Flower.
(ClientAppActor pid=55986)         
(ClientAppActor pid=55986) WARNING :   DEPRECATED FEATURE: `array_from_numpy` is deprecated. Instead, use the `Array(ndarray)` class directly or `Array.from_numpy_ndarray(ndarray)`.
(ClientAppActor pid=55986) 
(ClientAppActor pid=55986)             This is a deprecated feature. It will be removed
(ClientAppActor pid=55986)             entirely in future versions of Flower.
(ClientAppActor pid=55986)         
(ClientAppActor pid=55987) 
(ClientAppActor pid=55987)         
(ClientAppActor pid=55987) 
(ClientAppActor pid=55987)         
INFO :      aggregate_fit: received 2 results and 0 failures
INFO :      configure_evaluate: strategy sampled 4 clients (out of 8)
(ClientAppActor pid=55986) INFO :      No base model found: Initializing new model
(ClientAppActor pid=55987) WARNING :   DEPRECATED FEATURE: `array_from_numpy` is deprecated. Instead, use the `Array(ndarray)` class directly or `Array.from_numpy_ndarray(ndarray)`. [repeated 2x across cluster]
(ClientAppActor pid=55987)             This is a deprecated feature. It will be removed [repeated 2x across cluster]
(ClientAppActor pid=55987)             entirely in future versions of Flower. [repeated 2x across cluster]
INFO :      aggregate_evaluate: received 4 results and 0 failures
Baseline evaluation results: loss  1.806380879907224  accuracy  {'federated_evaluate_accuracy': 0.3312943875025179}
INFO :      
INFO :      [ROUND 4]
INFO :      configure_fit: strategy sampled 2 clients (out of 8)
(ClientAppActor pid=55987) INFO :      No base model found: Initializing new model [repeated 4x across cluster]
(ClientAppActor pid=55987) 
(ClientAppActor pid=55987)         
(ClientAppActor pid=55987) 
(ClientAppActor pid=55987)         
(ClientAppActor pid=55987) WARNING :   DEPRECATED FEATURE: `array_from_numpy` is deprecated. Instead, use the `Array(ndarray)` class directly or `Array.from_numpy_ndarray(ndarray)`. [repeated 2x across cluster]
(ClientAppActor pid=55987)             This is a deprecated feature. It will be removed [repeated 2x across cluster]
(ClientAppActor pid=55987)             entirely in future versions of Flower. [repeated 2x across cluster]
(ClientAppActor pid=55986) INFO :      No base model found: Initializing new model
INFO :      aggregate_fit: received 2 results and 0 failures
INFO :      configure_evaluate: strategy sampled 4 clients (out of 8)
(ClientAppActor pid=55986) 
(ClientAppActor pid=55986)         
(ClientAppActor pid=55986) 
(ClientAppActor pid=55986)         
(ClientAppActor pid=55986) WARNING :   DEPRECATED FEATURE: `array_from_numpy` is deprecated. Instead, use the `Array(ndarray)` class directly or `Array.from_numpy_ndarray(ndarray)`. [repeated 2x across cluster]
(ClientAppActor pid=55986)             This is a deprecated feature. It will be removed [repeated 2x across cluster]
(ClientAppActor pid=55986)             entirely in future versions of Flower. [repeated 2x across cluster]
(ClientAppActor pid=55986) INFO :      No base model found: Initializing new model
INFO :      aggregate_evaluate: received 4 results and 0 failures
Baseline evaluation results: loss  1.5771276013666051  accuracy  {'federated_evaluate_accuracy': 0.4441534097613967}
INFO :      
INFO :      [SUMMARY]
INFO :      Run finished 4 round(s) in 91.43s
INFO :          History (loss, distributed):
INFO :                  round 1: 2.3224521468846597
INFO :                  round 2: 1.9480512039739688
INFO :                  round 3: 1.806380879907224
INFO :                  round 4: 1.5771276013666051
INFO :          History (metrics, distributed, evaluate):
INFO :          {'federated_evaluate_accuracy': [(1, 0.19245826878388986),
INFO :                                           (2, 0.2817186905961313),
INFO :                                           (3, 0.3312943875025179),
INFO :                                           (4, 0.4441534097613967)]}
INFO :      
(ClientAppActor pid=55987) INFO :      No base model found: Initializing new model [repeated 3x across cluster]
wandb: | 0.023 MB of 0.023 MB uploaded
wandb: Run history:
wandb: federated_evaluate_accuracy ▁▃▅█
wandb:     federated_evaluate_loss █▄▃▁
wandb: 
wandb: Run summary:
wandb: federated_evaluate_accuracy 0.44415
wandb:     federated_evaluate_loss 1.57713
wandb: 
wandb: 🚀 View run experiment-development/20250413-1430 at: https://wandb.ai/sbs24043-cct-dublin/flower-embedded-fed/runs/yqzdvmil
wandb: ⭐️ View project at: https://wandb.ai/sbs24043-cct-dublin/flower-embedded-fed
wandb: Synced 5 W&B file(s), 0 media file(s), 0 artifact file(s) and 0 other file(s)
wandb: Find logs at: ./wandb/run-20250413_143021-yqzdvmil/logs
wandb: WARNING The new W&B backend becomes opt-out in version 0.18.0; try it out with `wandb.require("core")`! See https://wandb.me/wandb-core for more information.